Narrative,General Hassles,Inner Concerns,Financial Concerns,Time Pressures,Environmental Hassles,Family Hassles,Health Hassles,Academic Hassles
"Today was quite a challenging day at DLSU. Dealing with instructors who seemed disinterested and unresponsive made it difficult to grasp the concepts during lectures. Their lack of clarity and inability to answer questions left me feeling frustrated and lost. It's disheartening when the people responsible for guiding your education fall short. Nonetheless, I remained determined to find alternative resources and seek help from peers to overcome these obstacles.",0,0,0,0,0,0,0,1
"I woke up this morning feeling overwhelmed by the challenges in managing group projects. It's always a struggle to find a time that works for everyone's schedules, and coordinating tasks is like herding cats. Today, we had a meeting scheduled, but half the group didn't show up, leaving us frustrated and behind schedule. Despite the setbacks, we pushed through, dividing the workload and communicating online. It's exhausting, but we're learning valuable lessons in teamwork and time management. As an undergraduate student from DLSU, these group project hassles are a constant reminder of the real-world challenges we'll face in our future careers.",0,0,0,0,0,0,0,1
"Today was just another day filled with the usual academic responsibilities that left me feeling discontented. The constant barrage of assignments, readings, and exams seemed never-ending, making it difficult to find joy in my studies. The pressure to excel and meet expectations was overwhelming, leaving me longing for a moment of respite. Despite the challenges, I reminded myself to stay focused and persevere, knowing that this journey would eventually lead me to my goals.",0,0,0,0,0,0,0,1
"So, like, I wake up in the morning and realize I overslept. Panic mode activated! I scramble to get ready, skipping breakfast like a champ. Rushing through the crowded streets, I bump into people left and right. Finally, I reach my classroom, panting and disheveled. As I enter, everyone's eyes turn towards me. Great, I've become the center of attention again. Sigh. Another day, another hassle of being late to class.",0,0,0,0,0,0,0,1
"Today was just one of those days. I woke up feeling discontent with my current academic responsibilities. The never-ending pile of readings, assignments, and exams seemed overwhelming. I couldn't help but feel frustrated and exhausted. However, I pushed through the day, reminding myself that this is just a temporary phase. I managed to complete some tasks and even found time to relax and unwind. Tomorrow is a new day, and I am determined to tackle my academic responsibilities with a refreshed mindset.",0,0,0,0,0,0,0,1
"Today was quite a rollercoaster! Dealing with group projects proved to be more challenging than I anticipated. Coordinating schedules, brainstorming ideas, and dividing tasks seemed like an uphill battle. Everyone had different priorities, and it was difficult to find common ground. Despite the frustrations, we managed to find a way to work together, pushing through the hurdles. Although it tested my patience, I realized that overcoming these challenges ultimately strengthened our bond and taught us the importance of effective communication and compromise.",0,0,0,0,0,0,0,1
"Today was quite challenging as I faced some hurdles with my instructors at DLSU. One of them assigned an overwhelming amount of readings without considering our other course loads. Another instructor seemed disinterested in answering our questions, leaving us confused and frustrated. It's tough when communication and understanding become barriers to our education. However, I'm determined to overcome these challenges and make the most out of my undergraduate journey.",0,0,0,0,0,0,0,1
"Rushing through the bustling streets of Manila, I found myself caught in the daily hassle of getting late to class. As I sprinted towards the university gates, my heart pounded in my chest, fearing the consequences of tardiness. Sweat dripped down my forehead, my mind racing with thoughts of missed lectures and disappointed professors. Finally reaching the classroom, I slipped into my seat, gasping for breath, hoping to blend in unnoticed. Lesson learned: never underestimate the notorious Manila traffic when planning my daily commute.",0,0,0,0,0,0,0,1
"Today was a tough day at DLSU. I couldn't shake off the dissatisfaction I felt with my academic performance. Despite putting in hours of studying, I still struggled to grasp certain concepts. It was frustrating to see my efforts not reflecting in my grades. Doubts began to creep in, making me question my abilities. However, I reminded myself that setbacks are a part of the learning process, and I must persevere. Determined to improve, I vowed to seek help from professors and classmates to overcome this hurdle.",0,0,0,0,0,0,0,1
"Oh man, today was such a mess! I woke up late and ended up getting late to class. Rushing through the crowded streets, I sprinted towards the university, hoping to make it in time. The elevator took ages, and I finally reached my classroom, only to find the professor had already started the lecture. Sliding into my seat, I couldn't help but feel flustered and embarrassed. Lesson learned: never hit the snooze button again!",0,0,0,0,0,0,0,1
"Today was a typical day at DLSU, filled with the usual hustle and bustle. However, I found myself facing difficulties with my peers or classmates. Group projects seemed to be causing tension and disagreements among us. It was frustrating trying to find common ground and work together effectively. Despite this, I tried to remain patient and compromised to ensure a harmonious outcome. It reminded me that teamwork can be challenging, but overcoming these obstacles ultimately leads to personal growth and stronger relationships.",0,0,0,0,0,0,0,1
"I woke up in a frenzy, realizing I overslept. Rushing through my morning routine, I hastily grabbed my books and dashed out the door. As I sprinted towards the university, my heart pounded with anxiety. Dodging students along the way, I finally arrived at class, breathless and disheveled. My professor gave me a stern look, but I sighed in relief. Despite the hassle of being late, I made it just in time.",0,0,0,0,0,0,0,1
"So there I was, rushing through the crowded streets of Manila, desperately trying to make it to my first class on time. As luck would have it, traffic seemed to conspire against me, causing my heart to race with each passing second. I weaved through the maze of vehicles, praying that my professor would understand my predicament. Finally, I stumbled into the classroom, breathless and disheveled, but relieved. Lesson learned: never underestimate the power of Manila traffic when it comes to getting late to class.",0,0,0,0,0,0,0,1
"Today was quite a challenging day at DLSU. I encountered some difficulties with my classmates during our group project. It seemed like everyone had their own opinions, and it became quite challenging to reach a consensus. Despite the disagreements, we managed to find a middle ground and completed the task successfully. These occasional clashes with peers remind me of the importance of effective communication and teamwork, helping me grow both academically and personally.",0,0,0,0,0,0,0,1
"Today has been a rollercoaster of emotions. Waking up with a sense of dissatisfaction with my academic performance has clouded my entire day. The constant nagging feeling that I could have done better in my recent exams has been eating away at me. It's frustrating to put in so much effort and not see the desired results. Nonetheless, I am determined to use this dissatisfaction as fuel to work harder and improve my performance in the future. It's just a bump in the road, and I won't let it define me.",0,0,0,0,0,0,0,1
"Today was another challenging day at DLSU. I couldn't help but feel discontent with my current academic responsibilities. The never-ending pile of assignments and the constant pressure to excel were taking a toll on me. It seemed like I was drowning in a sea of papers and deadlines. I yearned for a moment of respite, a chance to breathe and escape from this overwhelming routine. But amidst all the chaos, I reminded myself of my goals, my passion for learning, and the opportunities that lay ahead. Despite the daily hassles, I knew that my hard work would eventually pay off.",0,0,0,0,0,0,0,1
"Today was a typical day at DLSU, filled with the usual challenges in managing group projects. My teammates and I struggled to find a common meeting time due to conflicting schedules. Additionally, coordinating everyone's contributions became problematic as some members failed to meet deadlines. Despite these hurdles, we persevered and successfully completed our project, learning valuable lessons in teamwork and time management along the way. It was a tough day, but definitely a rewarding one.",0,0,0,0,0,0,0,1
"So today was just one of those days where I couldn't help but feel dissatisfied with my academic performance. No matter how hard I tried, it seemed like I just couldn't grasp the concepts in my math class. The frustration kept building up as I struggled to understand the equations and solve the problems. It's moments like these that make me question my abilities and wonder if I'm cut out for this course. But hey, tomorrow is a new day and I'll continue to push myself and seek help until I overcome this hurdle.",0,0,0,0,0,0,0,1
"Today was quite a rollercoaster! My day started with a group meeting for a project, and boy, managing group projects is no cakewalk. Trying to align everyone's schedules and ideas was a challenge in itself. Different work ethics and conflicting opinions made it difficult to move forward smoothly. However, after some intense discussions and compromise, we finally managed to find a middle ground. It's moments like these that remind me of the importance of effective communication and teamwork in overcoming daily hassles.",0,0,0,0,0,0,0,1
"Today was a rollercoaster of emotions as I navigated through the concerns regarding academic transitions. The constant changes in schedules and modes of learning have left me feeling overwhelmed and unprepared. From struggling to adapt to online classes to facing technical glitches during exams, it feels like a never-ending battle. However, with the support of my professors and fellow students, I am determined to overcome these obstacles and make the most out of my undergraduate journey at DLSU.",0,0,0,0,0,0,0,1
"Today was just one of those days where I couldn't help but feel discontent with my current academic responsibilities. The never-ending pile of assignments and readings seemed to be suffocating me. It's frustrating to constantly juggle between classes, group projects, and exams. I yearn for a break, even just a short moment to catch my breath and regain my motivation. But alas, I must persevere and push through, reminding myself that this is just a temporary hurdle in my educational journey.",0,0,0,0,0,0,0,1
"Today was a bit of a rollercoaster. I had a tough time understanding my instructors during our online classes. The poor internet connection made it even harder to grasp the concepts they were explaining. It was frustrating not being able to ask questions or clarify my doubts in real-time. Despite these challenges, I tried my best to stay motivated and proactive, seeking additional resources and reaching out to classmates for support. It's a constant struggle, but I'm determined to make the most out of my education regardless of the obstacles.",0,0,0,0,0,0,0,1
"Today was quite a rollercoaster. I woke up late and barely made it to class on time. As if that wasn't enough, I faced difficulties with my classmates during a group project. Everyone seemed to have their own agenda, and it was challenging to find a common ground. We clashed on ideas and struggled to work together efficiently. It was frustrating, but we managed to compromise and complete the task. Dealing with peer conflicts is never easy, but overcoming them is a valuable learning experience.",0,0,0,0,0,0,0,1
"Today was a rollercoaster of emotions as I navigated through various academic transitions. From adjusting to online classes and grappling with unfamiliar platforms, to struggling with the lack of face-to-face interactions, it felt like a never-ending battle. The constant concerns about understanding course materials and keeping up with deadlines added to the stress. However, with the support of my professors and classmates, I managed to find solace in knowing that we were all in this together. Despite the challenges, I remained determined to make the most out of this unique learning experience.",0,0,0,0,0,0,0,1
"Today was a rollercoaster of emotions as I navigated through the concerns regarding academic transitions. From adjusting to online classes to keeping up with the rapid pace of assignments, it felt overwhelming. Despite the challenges, I found solace in connecting with classmates virtually and seeking guidance from professors. Although this transition may be tough, I am determined to adapt and make the most out of my undergraduate journey at DLSU.",0,0,0,0,0,0,0,1
"Today was quite challenging. I had difficulties with my classmates during our group project. It seemed like everyone had their own ideas and no one wanted to compromise. It was frustrating trying to get everyone on the same page. Despite the disagreements, we managed to find a common ground and complete the task. It was a valuable lesson in teamwork and communication, but it definitely made my day more stressful than I anticipated.",0,0,0,0,0,0,0,1
"Today was such a frustrating day. I woke up feeling down, dissatisfied with my academic performance. Despite my efforts, I couldn't seem to achieve the grades I desired. It seemed like no matter how much time I invested in studying, it was never enough. This constant dissatisfaction loomed over me, making it hard to focus and enjoy my day. I hope tomorrow brings a fresh start and a better outlook on my academic journey.",0,0,0,0,0,0,0,1
"Today was quite a challenging day at DLSU. I encountered some difficulties with my peers and classmates. During our group project meeting, there were disagreements about the direction we should take. It was frustrating trying to find a compromise that satisfied everyone's ideas. However, we eventually managed to find common ground and successfully completed our project. Despite the initial hassle, it was a valuable learning experience in teamwork and communication.",0,0,0,0,0,0,0,1
"Today has been a real struggle. I woke up feeling dissatisfied with my academic performance. It seems like no matter how hard I study, I can't seem to achieve the grades I desire. This constant dissatisfaction is starting to take a toll on my motivation and self-confidence. It's frustrating to put in so much effort and not see the results I want. I'm determined to find a way to improve and overcome this hurdle.",0,0,0,0,0,0,0,1
"As an undergrad student from DLSU, group projects have become one of the daily hassles I encounter. Juggling different schedules, coordinating tasks, and ensuring equal contributions from each member can be quite challenging. It often feels like herding cats, as everyone has their own ideas and opinions. However, despite the occasional conflicts and setbacks, these challenges have taught me valuable lessons in teamwork, patience, and compromise. Ultimately, overcoming these hurdles leads to a stronger bond within the group and a sense of accomplishment when we successfully complete our projects.",0,0,0,0,0,0,0,1
"Today was quite hectic for me. As usual, I got caught up in the morning rush and ended up getting late to class. It seemed like the whole world conspired against me, from the never-ending traffic to the crowded train. I sprinted through the corridors, hoping to make it on time, my heart pounding. Finally, I reached my classroom, panting and disheveled, only to be greeted by the professor's stern gaze. It was definitely not the ideal way to start the day, but I managed to catch my breath and dive into the lesson.",0,0,0,0,0,0,0,1
"Today was just another day of discontent with my current academic responsibilities. It feels like I'm drowning in a sea of assignments and exams. The never-ending cycle of studying, attending lectures, and completing projects has left me feeling overwhelmed and drained. It's challenging to find the motivation to keep going, but I know I have to push through. I'll take a deep breath, put on my game face, and tackle these academic hurdles head-on.",0,0,0,0,0,0,0,1
"Today was quite a challenging day at DLSU. As an undergraduate student, I encountered several concerns regarding academic transitions. From adjusting to online classes to navigating through new learning platforms, it felt overwhelming. Additionally, the sudden shift in study routines and the lack of face-to-face interactions with professors and peers added to the struggle. Nonetheless, I persevered, seeking assistance from classmates and making use of online resources. Despite these daily hassles, I remained determined to adapt and excel in my academic journey.",0,0,0,0,0,0,0,1
"So today was just another day of discontent with my current academic responsibilities. The never-ending stream of assignments, exams, and projects is slowly sucking the life out of me. I woke up this morning feeling overwhelmed and dreading the long list of tasks that awaited me. The pressure to perform well and meet deadlines is suffocating. I can't help but wonder if this is what college life is all about – constant stress and never having a moment of respite. I long for the days when learning was a joy and not a burden.",0,0,0,0,0,0,0,1
"Today was a typical day at DLSU, although I couldn't help but feel overwhelmed by concerns regarding academic transitions. The sudden shift to online classes has been quite challenging, as I struggle to adapt to the new learning environment. Navigating through different platforms and constantly worrying about unstable internet connections only adds to the stress. Nevertheless, I try to remain positive and remind myself that with perseverance and support from professors, I can overcome these obstacles and excel in my studies.",0,0,0,0,0,0,0,1
"So, today was quite a day at DLSU. I had my fair share of daily hassles, but the most prominent one was the difficulties I faced with my classmates. It seemed like everyone was in a competitive mode, constantly trying to outshine each other. It created a tense atmosphere during group discussions, making it challenging to collaborate effectively. Despite the difficulties, I tried my best to maintain a positive attitude and find common ground with my peers. At the end of the day, I realized that working together and supporting one another is the key to success in any academic setting.",0,0,0,0,0,0,0,1
"So, picture this: I wake up to the sound of my alarm blaring, realizing that I overslept again. In a state of panic, I hastily get dressed and grab my backpack, rushing out the door. As I sprint towards the university, my heart races, knowing that I'm going to be late for class. Dodging people along the way, I finally arrive at the lecture hall, panting and disheveled. Sneaking in quietly, I take a seat at the back, hoping the professor won't notice my tardiness. Another day, another hassle, but at least I made it.",0,0,0,0,0,0,0,1
"Today was quite a challenging day for me as an undergraduate student at DLSU. I couldn't help but feel overwhelmed with concerns regarding academic transitions. From adjusting to online classes to navigating through unfamiliar platforms, it has been quite a struggle to adapt. Nonetheless, with the support of my professors and fellow students, I am determined to overcome these obstacles and make the most out of my university experience.",0,0,0,0,0,0,0,1
"Today has been quite a hassle. I woke up feeling discontent with my current academic responsibilities. The never-ending pile of readings, assignments, and exams seems overwhelming. It's hard to find the motivation to keep pushing through. But despite the frustration, I remind myself that this is just a temporary phase. I know that with determination and perseverance, I can overcome these challenges and come out stronger. So, I take a deep breath, gather my thoughts, and dive back into my studies, hoping for a better tomorrow.",0,0,0,0,0,0,0,1
"Today was a typical day at DLSU, filled with the usual hustle and bustle. One of the challenges I faced was managing group projects. Coordinating with my teammates, finding a common schedule, and dividing tasks proved to be quite a hassle. Despite the initial struggle, we eventually found our rhythm and worked together efficiently. It's moments like these that remind me of the importance of communication and teamwork, skills that will undoubtedly serve me well in the future.",0,0,0,0,0,0,0,1
"So, today was just one of those days where everything seemed to go wrong. I woke up late, scrambling to get ready for class. Running through the crowded streets, I could feel my heart racing, knowing that I was going to be late. As I reached the classroom, catching my breath, I sneaked in hoping not to disturb the professor. It was a hassle to start the day in such a rush, but hey, at least I made it to class.",0,0,0,0,0,0,0,1
"Today was another challenging day at DLSU as I tackled the never-ending struggle of managing group projects. Coordinating with my teammates, finding time to meet, and dividing tasks proved to be a hassle. It seemed like we were always on different pages, making progress slow and frustrating. However, despite the difficulties, we managed to push through and accomplish our goals. These challenges may be exhausting, but they also teach us valuable lessons in teamwork and perseverance.",0,0,0,0,0,0,0,1
"Today was quite a rollercoaster. Dealing with group projects, as usual, proved to be a challenge. Coordinating schedules, balancing workloads, and ensuring everyone is on the same page can be exhausting. It's frustrating when some team members don't pull their weight or procrastinate until the last minute. But hey, it's all part of the university experience, right? Despite the daily hassles, we managed to push through and deliver a decent outcome. Can't wait for tomorrow's adventures!",0,0,0,0,0,0,0,1
"Today was a rollercoaster of emotions as I navigated through the concerns regarding academic transitions. From the overwhelming workload to adjusting to online classes, it felt like an uphill battle. However, with the support of my professors and classmates, I managed to overcome the challenges. Although it was daunting, this experience taught me resilience and adaptability. Despite the daily hassles, I am determined to make the most out of my undergraduate journey at DLSU.",0,0,0,0,0,0,0,1
"So there I was, rushing through the crowded streets of Manila, trying desperately not to be late for my morning class. As luck would have it, the jeepney I hopped on got stuck in traffic, making my heart race with anxiety. With each passing minute, my stress levels soared higher, until finally, I arrived at school just as the bell rang. Breathless and flustered, I dashed into the classroom, hoping my tardiness wouldn't go unnoticed. The day had barely begun, and yet the daily hassle of getting late to class had already left me feeling drained.",0,0,0,0,0,0,0,1
"Today was just one of those days where I couldn't help but feel discontent with my current academic responsibilities. The never-ending pile of assignments, the overwhelming pressure to perform well, and the constant struggle to balance my social life with my studies seemed to weigh heavily on me. As I sat in the library, surrounded by textbooks and notes, I couldn't help but long for a break from it all. But despite the frustrations, I reminded myself that this is just a phase and that hard work always pays off in the end.",0,0,0,0,0,0,0,1
"Today was another typical day at DLSU, filled with the usual challenges in managing group projects. Coordinating with my teammates proved to be a hassle, as conflicting schedules and miscommunication hindered our progress. Additionally, finding a suitable meeting place on campus was no easy task. Despite these hurdles, we persevered and managed to complete our project successfully. It was a valuable learning experience, teaching me the importance of effective communication and adaptability in a team setting.",0,0,0,0,0,0,0,1
"Today was a bit of a struggle. I woke up feeling discontent with my current academic responsibilities. The never-ending pile of readings, assignments, and exams was weighing heavily on my mind. It seemed like there was always something new to tackle, leaving me feeling overwhelmed and stressed. Despite my best efforts to stay on top of things, it felt like I was constantly playing catch-up. I knew I had to find a way to better manage my time and prioritize my tasks, but for now, I couldn't help but feel frustrated with the never-ending cycle of academic demands.",0,0,0,0,0,0,0,1
"Today was a typical day at DLSU, filled with the usual academic transitions. As an undergraduate student, I constantly encountered concerns regarding these transitions. From adjusting to new professors and their teaching styles to adapting to different course requirements, it was a never-ending process. However, amidst the daily hassles, I found solace in the support of my fellow classmates and the guidance of my mentors. Together, we navigated through the challenges, making each day a step closer to our goals.",0,0,0,0,0,0,0,1
