Narrative,General Hassles,Inner Concerns,Financial Concerns,Time Pressures,Environmental Hassles,Family Hassles,Health Hassles,Academic Hassles
"Today was a typical day for me as an undergraduate student at DLSU. After attending morning classes, I returned home to the never-ending list of daily hassles. As I stepped into my yard, I noticed the overgrown grass and weeds mocking me. Reluctantly, I grabbed the rusty old lawnmower and began the arduous task of taming the unruly lawn. Sweat dripped down my face as I battled with nature's relentless growth. Despite the monotony, I found solace in the simplicity of this mundane task, briefly escaping the demands of academic life.",0,0,0,0,0,1,0,0
"Today was another hectic day as an undergraduate student at DLSU. Apart from the usual academic load, I found myself overloaded with family responsibilities. My younger sister fell sick, and I had to rush her to the doctor while juggling my assignments and studying for exams. Balancing my family's needs with my academic commitments proved to be challenging, but as always, I managed to find a way to make it work. It's moments like these that remind me of the importance of resilience and determination in overcoming daily hassles.",0,0,0,0,0,1,0,0
"So today started off with the usual hustle and bustle of being an undergraduate student at DLSU. As I rushed to get ready for my classes, I couldn't help but notice the mess in my room. It was time for some home maintenance (inside). I quickly tidied up, made my bed, and organized my study materials. It may seem like a small hassle, but having a clean and organized space helps me focus on my studies and sets a positive tone for the rest of my day. With that task accomplished, I headed out, ready to conquer the challenges that awaited me at school.",0,0,0,0,0,1,0,0
"So, today was one of those days where I had to deal with home maintenance inside the house. As an undergraduate student at DLSU, I already have a lot on my plate between classes and assignments. But when I woke up this morning, I noticed a leaking faucet in the bathroom. I had to quickly run to the hardware store, grab some tools, and try my best to fix it before heading off to class. It was definitely a hassle, but at least I learned a thing or two about plumbing along the way.",0,0,0,0,0,1,0,0
"Today was a typical day for me as an undergraduate student at DLSU. After attending my morning classes, I returned home to face the never-ending chore of home maintenance. Inside my small apartment, I had to sweep and mop the floors, dust the furniture, and clean the kitchen. It was a hassle, but I knew it was necessary to create a clean and comfortable living space. Despite the mundane nature of the task, I tackled it with determination, dreaming of the moment when I could finally relax and enjoy a well-deserved break.",0,0,0,0,0,1,0,0
"Today was a typical day for me as an undergraduate student at DLSU. As I woke up, my mind started racing with the day's responsibilities. However, my plans were abruptly halted when I noticed the mess in my room. Home maintenance, or should I say, the lack thereof, was staring me in the face. I sighed and reluctantly began tidying up, realizing that even amidst the chaos of student life, a clean and organized living space is essential for a productive day ahead.",0,0,0,0,0,1,0,0
"Today was another hectic day for me as an undergraduate student at DLSU. On top of my academic load, I found myself overloaded with family responsibilities. From ensuring my younger siblings got ready for school to helping my parents with household chores, it felt like a juggling act. Amidst the chaos, I managed to squeeze in some studying and complete my assignments. Balancing family and academic responsibilities is undoubtedly challenging, but I embrace it as part of my journey towards a better future.",0,0,0,0,0,1,0,0
"Today was another challenging day as an undergraduate student at DLSU. On top of my academic load, I found myself overloaded with family responsibilities. My younger siblings needed help with their schoolwork, my mom needed assistance with household chores, and my dad required my support in running errands. Balancing all these tasks proved to be quite overwhelming, leaving me mentally and physically exhausted. Nevertheless, I managed to persevere, reminding myself that my education and family are equally important. Despite the daily hassles, I strive to maintain a positive mindset and stay committed to both my studies and familial obligations.",0,0,0,0,0,1,0,0
"So, today was just another typical day in my life as an undergraduate student at DLSU. I woke up early in the morning to the sound of my mom nagging me about the yardwork that needed to be done. Reluctantly, I dragged myself outside to mow the lawn and trim the hedges. It was sweaty and tiring, but I couldn't let my mom down. After a long day of classes, assignments, and extra-curricular activities, I finally collapsed on my bed, exhausted but satisfied with the little accomplishment of maintaining our home's exterior.",0,0,0,0,0,1,0,0
"So, today started off with the usual hustle and bustle of being an undergraduate student at DLSU. As I rushed to get ready for class, I couldn't help but notice the mess in my room. Home maintenance inside definitely became a daily hassle. Clothes were strewn all over the floor, books were scattered on my desk, and my bed was in desperate need of being made. I quickly tidied up, trying to make my little sanctuary a bit more presentable. Although it was just a small inconvenience, it reminded me of the responsibilities that come with being an adult and balancing college life.",0,0,0,0,0,1,0,0
"So today was one of those days where I had to tackle home maintenance issues. As an undergraduate student from DLSU, I rarely have time to spare for these mundane tasks. But today, I couldn't escape the fact that my room needed a serious decluttering session. From organizing my study materials to dusting off every nook and cranny, I spent the entire afternoon making my room more livable. It may not be the most exciting way to spend my day, but at least now I have a clean and peaceful space to come back to after a long day of classes.",0,0,0,0,0,1,0,0
"Today was one of those days when I felt overloaded with family responsibilities. As an undergraduate student at DLSU, juggling academics and family commitments can be quite challenging. I woke up early to help my younger siblings get ready for school, making sure they had their breakfast and uniforms ready. Throughout the day, I received numerous calls from my parents, seeking my advice and assistance on various matters. Despite feeling overwhelmed, I reminded myself that family always comes first, and I managed to navigate through the day with determination and a sense of fulfillment.",0,0,0,0,0,1,0,0
"Today was quite a busy day for me as an undergraduate student at DLSU. After attending my classes, I returned home to face the never-ending battle of home maintenance. Inside my humble abode, I found myself confronted with a pile of dirty dishes, a mountain of laundry demanding attention, and a cluttered living space. With a sigh, I rolled up my sleeves and embarked on a cleaning spree, tackling one chore at a time. Despite the hassle, it felt satisfying to restore order and cleanliness to my living space, allowing me to unwind and focus on my studies.",0,0,0,0,0,1,0,0
"Today was a typical day for me as an undergraduate student at DLSU. After attending my morning classes, I returned home to the never-ending list of chores. Yardwork and outside home maintenance was on top of the list. Armed with a rake and a lawnmower, I tackled the overgrown grass and fallen leaves. Sweat dripped down my forehead as I worked tirelessly under the scorching sun. Despite the physical exhaustion, seeing the neat and tidy yard was rewarding, reminding me that life is a balancing act between academics and responsibilities at home.",0,0,0,0,0,1,0,0
"So, it was just another day in my life as an undergraduate student at DLSU. After a tiring day of attending classes and studying, I finally returned home to my dorm. However, the moment I stepped inside, I was hit with the realization that my room was a complete mess. Clothes were strewn all over the floor, books were scattered on the desk, and there were dishes piled up in the sink. Sighing, I reluctantly started tidying up, realizing that home maintenance (inside) was yet another hassle that I had to deal with on a daily basis.",0,0,0,0,0,1,0,0
"So, today was quite a hassle-filled day. After my morning classes at DLSU, I had to rush back home to deal with some yardwork and outside home maintenance. The grass in our backyard had grown wild, and the bushes desperately needed trimming. Armed with a lawnmower and gardening tools, I spent hours sweating under the scorching sun, battling with unruly plants. It was exhausting, but the satisfaction of a well-manicured yard made it all worth it. Now I can finally relax and enjoy the fruits of my labor!",0,0,0,0,0,1,0,0
"Today was another hectic day as an undergraduate student at DLSU. On top of my academic load, I found myself overloaded with family responsibilities. My parents needed my assistance in managing household chores and taking care of my younger siblings. It was a juggling act, trying to balance my college commitments and familial duties. Despite the challenges, I persevered, knowing that education is the key to a better future for my family.",0,0,0,0,0,1,0,0
"Today was another hectic day as an undergraduate student at DLSU. Not only was I overloaded with assignments and projects, but I also had to juggle numerous family responsibilities. From helping my younger siblings with their homework to running errands for my parents, it felt like there were not enough hours in the day. Despite the constant chaos, I managed to find solace in the support of my family and the determination to succeed in my studies. It may be overwhelming at times, but I am grateful for the opportunity to balance both my education and my family responsibilities.",0,0,0,0,0,1,0,0
"Today was quite a hectic day for me as an undergraduate student at DLSU. Apart from attending classes, I had to deal with the hassle of yardwork and outside home maintenance. Armed with a rake and a lawnmower, I tackled the overgrown grass and fallen leaves in our garden. Sweating under the scorching sun, I couldn't help but daydream about being back in the air-conditioned classroom. Nonetheless, the satisfaction of a tidy yard made it all worth it.",0,0,0,0,0,1,0,0
"Today was another hectic day for me as an undergraduate student at DLSU. On top of juggling my academic responsibilities, I found myself overloaded with family responsibilities. From running errands for my parents to helping my younger siblings with their schoolwork, it felt like there were not enough hours in the day. Despite the challenges, I managed to stay focused and determined. Although overwhelming at times, these family responsibilities serve as a reminder of the importance of balance in my life.",0,0,0,0,0,1,0,0
"Today was a whirlwind of chaos as I juggled my overloaded plate of family responsibilities along with my academic commitments. From helping my younger siblings with their online classes to assisting my parents with household chores, it felt like a never-ending cycle of tasks. Amidst this chaos, I managed to squeeze in some time for my studies, but the constant interruptions made it challenging to focus. Although exhausting, I reminded myself that these family responsibilities are a privilege and a testament to the love and trust bestowed upon me.",0,0,0,0,0,1,0,0
"Today was a typical day for me as an undergrad at DLSU, filled with classes, assignments, and the usual daily hassles. However, one unexpected hassle that came my way was yardwork or outside home maintenance. My parents had asked me to mow the lawn and trim the hedges, adding to my already busy schedule. Despite being tired, I grabbed the gardening tools and got to work. It was exhausting, but seeing the neat and tidy yard at the end of the day made it all worthwhile.",0,0,0,0,0,1,0,0
"My day as an undergrad student at DLSU began with the usual hustle and bustle. Between juggling classes and assignments, I found myself dealing with the daily hassle of home maintenance inside. As I rushed to get ready, I noticed a leak in the bathroom sink that needed immediate attention. Frustrated, I grabbed a wrench and managed to fix it just in time. It may have been a small hassle, but it served as a reminder that even amidst the chaos of college life, I needed to take care of my personal space.",0,0,0,0,0,1,0,0
"So, today was quite a hassle! After my morning classes, I had to tackle some yardwork at home. Armed with a rake and a determined spirit, I ventured outside to tidy up the mess of fallen leaves that seemed to have multiplied overnight. It took longer than expected, with the scorching sun adding to my exhaustion. Nonetheless, seeing the clean and pristine yard made it all worth it. I may be a student, but I can handle outside home maintenance like a pro!",0,0,0,0,0,1,0,0
"So, today was one of those days when I had to deal with the never-ending yardwork at home. As an undergrad student from DLSU, my days are usually filled with lectures, assignments, and exams, but today I had to put on my gloves and get my hands dirty. From pulling out stubborn weeds to mowing the unruly grass, it was definitely a hassle. But hey, it's all part of being a responsible homeowner, right? At least I can proudly say that I can handle both books and the backyard!",0,0,0,0,0,1,0,0
"Today was quite a busy day for me as I juggled my academic responsibilities with home maintenance. I woke up early to clean my room and organize my study materials. Dusting shelves, sweeping the floor, and making my bed were just a few tasks that needed to be done. It felt refreshing to have a tidy space to focus on my studies. Although it was a hassle, I realized that maintaining a clean and organized environment positively influenced my productivity and overall well-being.",0,0,0,0,0,1,0,0
"Today was a typical day for me as an undergrad at DLSU, filled with classes, assignments, and daily hassles. After attending my morning lectures, I returned home to be greeted by the never-ending chore of yardwork. Armed with a rake and a determination to conquer the unruly grass, I spent the afternoon sweating under the scorching sun, trying to maintain the aesthetics of our humble abode. Though it was tiresome, the satisfaction of seeing the neatly trimmed lawn made it all worth it in the end.",0,0,0,0,0,1,0,0
"Today was another typical day for me as an undergraduate student at DLSU. However, it was not without its daily hassles. Being overloaded with family responsibilities, I found myself juggling between studying for my exams and taking care of my younger siblings. It was a constant struggle to find the right balance, but I managed to prioritize my responsibilities and make the best out of the situation. Despite the challenges, I remain determined to excel in my studies and fulfill my family obligations.",0,0,0,0,0,1,0,0
"So, today was just one of those days. I woke up early to the sound of my neighbor's lawnmower, reminding me of the yardwork I had been putting off. With a groan, I reluctantly dragged myself out of bed and into the scorching heat. Armed with a pair of gloves and a rake, I spent the morning battling with stubborn weeds and fallen leaves. Sweat dripped down my face as I labored, but at least the sight of a tidy yard was somewhat satisfying. Yardwork may be a hassle, but it's a necessary evil for a homeowner like me.",0,0,0,0,0,1,0,0
"Today was another long day for me as an undergraduate student at DLSU. After juggling classes and assignments, I came home to face the never-ending task of yardwork. Armed with a rake and a determined spirit, I tackled the overgrown grass and fallen leaves. It was a sweaty and tiring process, but there was a sense of satisfaction in transforming the messy yard into a neat and tidy space. Despite the hassle, I couldn't help but appreciate the opportunity to connect with nature and take a break from the demands of academic life.",0,0,0,0,0,1,0,0
"So, today was one of those typical days where I had to deal with yardwork or outside home maintenance. As an undergraduate student at DLSU, juggling between classes, assignments, and extracurricular activities already keeps me on my toes. But now, add the hassle of mowing the lawn, pulling out weeds, and sweeping the front porch into the mix. It may not be the most glamorous task, but it's a necessary evil. Despite the exhaustion, I can't help but appreciate the sense of accomplishment that comes with taking care of my home.",0,0,0,0,0,1,0,0
"Today was a typical day as an undergraduate student at DLSU. After attending morning classes and completing assignments, I returned home to find my parents requesting my help with yardwork. Reluctantly, I put on my old clothes and grabbed the gardening tools. Sweating under the scorching sun, I trimmed bushes, pulled out weeds, and mowed the lawn. Despite the hassle of outside home maintenance, witnessing the transformation of our garden into a beautiful oasis was rewarding. It reminded me that life's daily hassles often lead to fulfilling outcomes.",0,0,0,0,0,1,0,0
"Today was a typical day at DLSU, but as an undergraduate student, I found myself overloaded with family responsibilities. I woke up early to help my younger siblings get ready for school while also preparing breakfast for everyone. Between classes, I received calls from my parents asking for assistance with household chores and errands. It was challenging to balance my academic commitments and my family's needs, but I persevered. Despite the added pressure, I managed to complete my assignments and attend my classes. Although exhausting, I find solace in knowing that I am contributing to my family's well-being while pursuing my education.",0,0,0,0,0,1,0,0
"Today was another typical day as an undergraduate student at DLSU. After classes, I had to deal with the hassle of yardwork and outside home maintenance. Armed with a rake and a lawnmower, I spent the afternoon tidying up our front yard, removing fallen leaves and cutting the overgrown grass. It was tiring, but I found solace in the satisfaction of seeing the neatly trimmed lawn. Despite the inconvenience, I managed to balance my responsibilities as a student with the demands of maintaining a home.",0,0,0,0,0,1,0,0
"So, today was just one of those days where everything seemed to go wrong. I woke up to a flooded bathroom because of a leaking faucet. After scrambling to find a bucket, I started mopping up the mess. As if that wasn't enough, the power suddenly went out while I was in the middle of doing laundry, leaving me with half-washed clothes. I couldn't help but sigh in frustration, realizing that home maintenance inside was becoming a never-ending hassle. It's moments like these that make me appreciate the simple joy of a hassle-free day.",0,0,0,0,0,1,0,0
"So, today was quite a hectic day for me as an undergraduate student from DLSU. In addition to attending classes and rushing through assignments, I also had to deal with the hassle of yardwork and outside home maintenance. It was exhausting trying to balance academics and the responsibilities of keeping our home in order. But hey, at least I got some fresh air and exercise while doing it!",0,0,0,0,0,1,0,0
"So, today was quite a hassle. As an undergraduate student from DLSU, I had to deal with the usual daily struggles, including home maintenance inside. I woke up to a leaky faucet in the bathroom, which seemed to defy all my attempts to fix it. As if that wasn't enough, the power went out just as I was about to start studying for my midterm exams. With candles scattered around, I managed to make the best of the situation and soldier through my readings. It's safe to say that today, home maintenance became my unexpected and unwanted companion in my journey towards academic success.",0,0,0,0,0,1,0,0
"Today was another hectic day for me as an undergraduate student at DLSU. On top of my already heavy workload, I found myself overloaded with family responsibilities. My parents needed help with household chores and taking care of my younger siblings. It was challenging trying to balance my academic commitments while fulfilling my duties at home. Nevertheless, I managed to juggle everything and remain determined to succeed. Although it's tough, I remind myself that these challenges will only make me stronger and more resilient in the long run.",0,0,0,0,0,1,0,0
"So today was a bit hectic. After my morning classes at DLSU, I headed back home and realized that my room was a complete mess. I had clothes strewn all over the floor, and my desk was cluttered with books and papers. I decided to dedicate a couple of hours to do some home maintenance and clean up my space. It was quite a hassle, but once I finished organizing everything, I felt a sense of accomplishment and relief. Now I can finally focus on my studies without any distractions.",0,0,0,0,0,1,0,0
"Today was a typical day as an undergraduate student at DLSU. After a long day of classes and studying, I returned home to the never-ending task of home maintenance. Inside my cozy apartment, I tackled the mundane chores of cleaning, organizing, and ensuring everything was in its proper place. From dusting shelves to mopping the floors, maintaining my living space was yet another hassle to add to my already hectic schedule. However, the satisfaction of a tidy and organized home made it all worth it in the end.",0,0,0,0,0,1,0,0
"Today was another hectic day for me as an undergraduate student at DLSU. On top of my academic load, I found myself overloaded with family responsibilities. Balancing assignments and household chores became a juggling act. I had to rush through my readings while simultaneously helping my younger siblings with their homework. It was exhausting, but I reminded myself that this was just a temporary phase. Despite the daily hassles, I remained determined to persevere and succeed in both my studies and family obligations.",0,0,0,0,0,1,0,0
"Today was another hectic day for me as an undergraduate student from DLSU. On top of my academic obligations, I was overloaded with family responsibilities. I woke up early to help my younger siblings get ready for school, prepared breakfast for everyone, and even managed to squeeze in some time to clean the house. Despite the challenges, I remain determined to balance my studies and family duties, as I know they both play significant roles in shaping my future.",0,0,0,0,0,1,0,0
"Today was another hectic day for me as an undergraduate student at DLSU. On top of my demanding academic schedule, I found myself overloaded with family responsibilities. My parents, who both work long hours, heavily rely on me to help with household chores and taking care of my younger siblings. Juggling between assignments, attending online classes, and ensuring my family's well-being has become a daily challenge. Despite the exhaustion, I remain determined to keep pushing forward, knowing that my education and family's welfare are equally important.",0,0,0,0,0,1,0,0
"Today was a typical day for me as an undergraduate student at DLSU, although I was feeling overwhelmed with family responsibilities. Balancing my studies and taking care of my younger siblings has been quite challenging. I had to wake up early to prepare breakfast, get them ready for school, and ensure they were safe before rushing to my classes. Despite the daily hassles, I always remind myself that these responsibilities make me stronger and more resilient, fueling my determination to succeed academically and provide a better future for my family.",0,0,0,0,0,1,0,0
"Today was a typical day for me as an undergraduate student at DLSU. After a long day of classes and studying, I returned home to my dorm room. As I entered, I noticed the mess that had accumulated throughout the week. With a sigh, I rolled up my sleeves and tackled the home maintenance tasks. I swept the floor, organized my desk, and wiped down the surfaces. It was a hassle, but seeing my living space tidy and clean brought a sense of satisfaction. It's a small price to pay for a comfortable and conducive environment for studying and relaxation.",0,0,0,0,0,1,0,0
"So, today was one of those days where I had to deal with home maintenance inside my apartment. As an undergraduate student from DLSU, I often find myself juggling between classes, assignments, and maintaining my living space. From fixing a leaky faucet to unclogging the drain, it's a constant hassle. But hey, it's all part of adulting, right? Despite the inconvenience, I managed to get everything sorted and even learned a thing or two about DIY home repairs along the way. Here's to hoping for a hassle-free day tomorrow!",0,0,0,0,0,1,0,0
"So, like, today was one of those days where I had to deal with the never-ending yardwork and outside home maintenance. Ugh, I woke up early and dragged myself outside to mow the lawn and trim the overgrown plants. Sweating under the hot sun, I cursed every weed and blade of grass that seemed to grow overnight. I mean, can't the garden just take care of itself? But hey, at least I got a good workout while making my home look presentable. Time to collapse on the couch now, and never underestimate the power of a well-deserved nap!",0,0,0,0,0,1,0,0
