Narrative,General Hassles,Inner Concerns,Financial Concerns,Time Pressures,Environmental Hassles,Family Hassles,Health Hassles,Academic Hassles
"Today was another hectic day as an undergraduate student at DLSU. Waking up to the noisy traffic and the polluted air was a constant struggle. Walking to my classes amidst the smog-filled streets was not only tiresome but also harmful to my health. It's disheartening to witness the pollution levels rising day by day, making me question the sustainability of our surroundings. Despite these daily hassles, I remain hopeful that one day we can find effective solutions to combat pollution and create a healthier environment for all.",0,0,0,0,1,0,0,0
"Today was just another typical day as an undergraduate student at DLSU. As I walked to campus, the heavy pollution that engulfed the city filled my lungs, making it hard to breathe. The constant noise of honking cars and construction work further added to the chaos. Despite these daily hassles, I pushed through, determined to make the most out of my day. From attending classes to studying in the library, I focused on my goals, knowing that overcoming these obstacles is just a part of my journey towards success.",0,0,0,0,1,0,0,0
"Today was another hectic day as an undergraduate student at DLSU. I woke up to the irritating sound of car horns blaring and the foul smell of pollution seeping through my window. As I walked to class, I couldn't help but notice the thick layer of smog engulfing the city, making it difficult to breathe. Throughout the day, I found myself constantly sneezing and coughing due to the polluted air. Despite the challenges posed by pollution, I managed to power through my classes and stay focused on my studies, determined to make the most out of my day at DLSU.",0,0,0,0,1,0,0,0
"Today was such a rollercoaster of emotions. As an undergrad at DLSU, I couldn't help but feel concerned about the news events unfolding around the world. The constant updates on political unrest and natural disasters had my mind racing. Amidst my classes and assignments, I found myself constantly checking for updates, feeling a mix of worry and hope. It's overwhelming, but I remind myself to stay informed and do my part in making a positive impact, no matter how small.",0,0,0,0,1,0,0,0
"Today was another typical day as an undergraduate student at DLSU. As I made my way to the campus, I couldn't help but notice the thick smog hanging over the city, a constant reminder of the pollution we face daily. It made my morning commute uncomfortable and left me feeling concerned about the long-term effects on our health. Despite this hassle, I remained determined to make the most of my day and contribute to finding sustainable solutions for our environment.",0,0,0,0,1,0,0,0
"Today started off like any other day for me as an undergraduate student at DLSU. However, as I made my way to campus, I couldn't help but notice the unsettling presence of crime. The news of a recent theft had spread like wildfire among my classmates, leaving us all on edge. It's disheartening to see such incidents disrupt the peace and safety of our university. Despite these daily hassles, we must remain vigilant and work together to create a secure environment for everyone on campus.",0,0,0,0,1,0,0,0
"So, today was a pretty hectic day for me. As an undergrad at DLSU, I had my fair share of daily hassles. First of all, I couldn't help but be concerned about the news events that unfolded throughout the day. The constant barrage of distressing stories had me feeling overwhelmed and anxious. It was challenging to focus on my coursework with all the chaos happening around the world. However, I tried my best to stay informed while not letting it consume me entirely. It's essential to strike a balance between staying aware and taking care of our mental well-being.",0,0,0,0,1,0,0,0
"Man, today was a tough one. Woke up to the news of rising prices of common goods, and it hit me hard. I had to skip my usual morning coffee because the price hike was just too much. Throughout the day, I couldn't help but notice the inflated prices at the canteen and even the convenience stores near campus. It's becoming harder to get by as an undergraduate student. I guess I'll have to tighten my budget even more and find creative ways to make ends meet.",0,0,0,0,1,0,0,0
"Today started off with concerns about news events in my mind. As an undergraduate student at DLSU, I couldn't help but worry about the current state of the world. However, I reminded myself to focus on my studies and make the most out of my day. Despite the daily hassles, I managed to attend my classes, engage in meaningful discussions, and connect with my fellow students. By the end of the day, I realized that while news events might weigh on me, it's important to stay optimistic and continue striving for a better future.",0,0,0,0,1,0,0,0
"Today was just like any other day in Manila, filled with the usual hustle and bustle. But the one thing that never fails to bother me is the pollution. As I walked to class, I couldn't help but notice the thick smog hanging in the air, making it difficult to breathe. The honking of cars and the constant noise from construction sites added to the chaos. It's frustrating to see the beautiful city I call home suffer from such environmental hazards. I hope one day we can find a solution to this never-ending battle against pollution.",0,0,0,0,1,0,0,0
"Today was quite a hassle. As an undergraduate student from DLSU, I couldn't help but worry about the concerning news events happening around the world. It's disheartening to witness conflicts and disasters unfold, leaving me feeling helpless. However, I try to stay informed and contribute positively to my community by engaging in meaningful discussions and supporting causes that promote peace and justice. It may be overwhelming at times, but I believe that even small actions can make a difference in creating a better future.",0,0,0,0,1,0,0,0
"Man, what a day! Woke up and checked my phone, only to see headlines about rising prices of common goods. Great, just what I needed! As I headed to the campus, I stopped by the cafeteria for a quick breakfast. But guess what? Prices had gone up there too! Lunchtime rolled around, and my friends and I decided to grab some fast food. You won't believe it, but even there, the prices had skyrocketed! It's getting harder to keep up with the increasing cost of living. I hope things get better soon, or I'll be living on instant noodles for the rest of my college life!",0,0,0,0,1,0,0,0
"Today was another typical day as an undergraduate student at DLSU. As I made my way to campus, I couldn't help but notice the thick smog hanging in the air, a constant reminder of the pollution that plagues our city. It made my commute more challenging, with the heavy traffic and the unpleasant smell. Despite these daily hassles, I pushed through, determined to make the most out of my day and contribute to finding solutions for the betterment of our environment.",0,0,0,0,1,0,0,0
"So, today was just another typical day at DLSU, filled with endless lectures and assignments. But what really got on my nerves was the rising prices of common goods. I mean, seriously, can a poor student catch a break? From the expensive cafeteria meals to the overpriced textbooks, it feels like every day is a battle against the ever-increasing costs. It's frustrating to constantly worry about money when all I want to do is focus on my studies. But hey, I guess that's just the reality of being an undergraduate student.",0,0,0,0,1,0,0,0
"Today was another typical day as an undergraduate student at DLSU. I woke up early, excited for the day ahead. However, as soon as I stepped out of my dorm, I was greeted by the notorious Manila traffic. The usually short commute turned into a never-ending journey of honking horns and impatient drivers. Despite the frustration, I managed to keep my spirits up, knowing that this daily hassle was just a small bump in the road towards achieving my dreams.",0,0,0,0,1,0,0,0
"Man, today was one of those days where traffic just messed everything up. I left my dorm early, thinking I'd beat the rush, but boy was I wrong. The roads were jam-packed with cars honking endlessly. I was stuck in bumper-to-bumper traffic for what felt like an eternity. By the time I reached campus, I was already late for my morning class. Ugh, I really need to find a way to avoid this daily hassle.",0,0,0,0,1,0,0,0
"Today was a typical day at DLSU, filled with the usual hustle and bustle. However, it was marred by an unfortunate incident of crime. As I walked back to my dormitory after classes, I witnessed a snatcher swiftly grab a student's bag and disappear into the crowd. The victim's shocked expression lingered in my mind, reminding me of the harsh reality that even within the confines of our university, crime can rear its ugly head. It served as a reminder to stay vigilant and cautious, even in the supposed safety of our campus.",0,0,0,0,1,0,0,0
"So, today started off like any other day. I woke up to the sound of my alarm, groggily rolled out of bed, and made my way to the kitchen for breakfast. As I poured myself a bowl of cereal, I couldn't help but notice that the prices of the common goods had increased yet again. It's becoming increasingly difficult to make ends meet as a student. But hey, I guess that's just one of the daily hassles we all have to deal with. Time to get ready for class and face the day ahead!",0,0,0,0,1,0,0,0
"So, today was just another typical day at DLSU. As I made my way to class, I couldn't help but notice the overwhelming pollution in the city. The air felt heavy and filled with smog, making it difficult to breathe. It's frustrating to see the effects of pollution on our environment and the toll it takes on our health. Despite the hassle, I remain hopeful that one day we can find sustainable solutions to combat this issue and make our campus a cleaner and healthier place to study and thrive.",0,0,0,0,1,0,0,0
"Today started off like any other day at DLSU, but little did I know that crime would disrupt my routine. While walking to my class, I noticed a commotion near the library. As I got closer, I witnessed a snatch thief attempting to steal a student's bag. Without hesitation, I joined forces with fellow students and confronted the criminal, managing to retrieve the bag before he escaped. Although it was a hassle, it felt empowering to stand up against crime and protect our community at DLSU.",0,0,0,0,1,0,0,0
"Today was a whirlwind of chaos with too many responsibilities weighing me down. As an undergraduate student at DLSU, juggling coursework, extracurricular activities, and part-time work has become overwhelming. My day comprised back-to-back classes, followed by a rush to complete assignments, and a desperate attempt to squeeze in some study time. Exhaustion settled in as I realized the never-ending cycle of obligations. Nonetheless, I remind myself that these hurdles are part of the journey towards personal growth and success.",0,0,0,1,0,0,0,0
"Today was a typical day at DLSU, filled with too many interruptions. From the moment I stepped into the campus, friends bombarded me with questions about assignments and upcoming exams. During classes, professors were constantly interrupted by students seeking clarifications or asking unrelated questions. Even during lunch, the crowded cafeteria was abuzz with noise and interruptions. It was difficult to focus and get things done. Despite the interruptions, I managed to squeeze in some productive moments, but I can't help but wish for a day with fewer disruptions.",0,0,0,1,0,0,0,0
"Man, today was rough. I barely got any sleep last night, and it totally threw off my whole day. I couldn't concentrate in class, and my eyes kept drooping every time I tried to read something. I even dozed off during a group discussion! Coffee became my best friend, but even that couldn't hide the bags under my eyes. Lesson learned: pulling an all-nighter is never a good idea. I definitely need to prioritize getting enough rest from now on.",0,0,0,1,0,0,0,0
"Today was just like any other day at DLSU, filled with classes and endless assignments. As an undergraduate student, it feels like there's never enough time for entertainment and recreation. Between lectures, group projects, and studying, my schedule becomes packed to the brim. I yearn for those moments of relaxation, where I can unwind and enjoy some downtime. However, with each passing day, the struggle to find a balance between academics and personal leisure seems to grow. But despite the daily hassles, I remain determined to make the most out of my time here.",0,0,0,1,0,0,0,0
"Today was a typical day at DLSU, filled with various daily hassles. Apart from rushing to classes and dealing with assignments, I also had to navigate through social obligations. Attending club meetings, catching up with friends, and making time for family became a juggling act. Trying to strike a balance between academics and maintaining relationships can be challenging, but I'm grateful for the opportunity to grow both academically and socially at DLSU.",0,0,0,1,0,0,0,0
"Today was another hectic day as an undergraduate student at DLSU. With classes, assignments, and exams looming over me, there never seems to be enough time for entertainment and recreation. I longingly watched as my friends made plans for a movie night, while I drowned in a sea of textbooks. As much as I love my studies, I can't help but yearn for a moment of relaxation and fun. But hey, I guess that's the price we pay for pursuing our dreams.",0,0,0,1,0,0,0,0
"So, today was just one of those days filled with social obligations. First, I had to attend a group study session, where I had to interact with classmates and contribute to the discussion. Then, I had a lunch date with a friend I hadn't seen in ages. Later, I had to attend a club meeting and participate in brainstorming sessions. It's exhausting, but I guess that's just a part of college life. At least I got to connect with people and strengthen my relationships.",0,0,0,1,0,0,0,0
"Today was a hectic day as an undergraduate student from DLSU. I found myself juggling too many responsibilities, from attending multiple classes and completing assignments to participating in extracurricular activities. The constant pressure to excel academically while maintaining a social life was overwhelming. Despite the challenges, I managed to stay focused and organized, ensuring that none of my responsibilities were neglected. Although exhausting, these daily hassles are an essential part of my growth and development as a student.",0,0,0,1,0,0,0,0
"My day at DLSU was filled with endless meetings that seemed to drag on forever. From department meetings to group project discussions, it felt like I was constantly running from one meeting to another. I barely had time to catch my breath or grab a quick bite to eat. It was exhausting and frustrating, as I couldn't focus on my studies. All I wanted was some uninterrupted time to concentrate on my assignments and relax. Hopefully, tomorrow would be a less meeting-packed day.",0,0,0,1,0,0,0,0
"Today was quite a noisy day at DLSU. As I walked into the cafeteria, the sound of chattering students and clattering cutlery filled the air. Trying to find a quiet spot to study in the library was a challenge as well, with groups of students discussing their projects and presentations. Even during my classes, the constant background noise of people shuffling their papers and whispering disrupted my concentration. Noise seems to be an unavoidable daily hassle on campus, but despite it all, I managed to find moments of peace and focus amidst the chaos.",0,0,0,1,0,0,0,0
"Today was a typical day filled with various hassles. Amidst my busy academic schedule, I found myself caught up in social obligations. From attending a friend's birthday party to joining a group study session, I had little time for myself. While I enjoyed the company of my friends, it became exhausting to constantly juggle between academics and socializing. But at the end of the day, I realized that these social obligations were essential for maintaining a well-rounded university experience.",0,0,0,1,0,0,0,0
"Today was one of those days filled with endless noise. As I sat in the library, desperately trying to concentrate on my studies, the sounds of chattering students, clicking keyboards, and shuffling papers surrounded me. Even my headphones couldn't drown out the constant interruptions. Later, on my way back to the dorm, the blaring horns and bustling traffic only added to the chaos. It seemed like peace and quiet were a distant dream. All I craved was a moment of tranquility to escape the noise-filled world around me.",0,0,0,1,0,0,0,0
"Today has been quite a challenging day for me as an undergraduate student at DLSU. The constant concern about meeting high standards has been weighing heavily on my mind. From the rigorous academic demands to the pressures of extracurricular activities, it feels like there's never enough time to excel in all areas. But despite these daily hassles, I remind myself that growth comes from pushing boundaries and embracing these challenges head-on. So, I strive to stay focused, work diligently, and trust in my abilities to overcome these concerns and rise to the occasion.",0,0,0,1,0,0,0,0
"Today was a typical day at DLSU, filled with the usual hustle and bustle. However, not getting enough rest last night made it quite challenging. My energy levels were low, and I struggled to stay focused during classes. I found myself dozing off during lectures, desperately trying to pay attention. Despite feeling fatigued, I pushed through the day, determined to make the most of it. Although exhausting, I reminded myself that tomorrow is a new day, and I'll make sure to prioritize getting enough rest to ensure a more productive day ahead.",0,0,0,1,0,0,0,0
"Today was a hectic day at DLSU, with too many meetings lined up back-to-back. It felt like a never-ending cycle of sitting in conference rooms, discussing agendas, and making decisions. The constant shuffle between different venues left me exhausted and craving for some free time. It was challenging to keep up with the fast pace and stay focused. However, I managed to make it through the day, looking forward to some much-needed relaxation and a good night's sleep.",0,0,0,1,0,0,0,0
"Today was a hectic day filled with social obligations. After classes, I had to attend a group meeting for a project. Then, I had to rush to a friend's birthday party, where I tried to balance socializing with catching up on assignments. Later, I made an appearance at a club meeting, even though I was exhausted. Juggling these social commitments proved challenging, but it was worth it to maintain connections and make the most of my university experience.",0,0,0,1,0,0,0,0
"Today was another challenging day at DLSU. As an undergraduate student, the constant concern about meeting high standards has become a daily hassle. From demanding professors to intense competition amongst peers, the pressure to excel is ever-present. However, I find solace in knowing that these challenges push me to strive for greatness. With determination and hard work, I embrace these concerns as opportunities for personal growth and development. Despite the daily hassles, I am confident that I am on the right path towards success.",0,0,0,1,0,0,0,0
"My day as a DLSU undergraduate student is always packed with endless tasks and responsibilities. The constant pressure to excel academically leaves me with not enough time for entertainment and recreation. While others may indulge in leisure activities, I find myself buried in books and assignments. Although it can be frustrating, I remind myself that this sacrifice is temporary, and the fruits of my hard work will be worth it in the end.",0,0,0,1,0,0,0,0
"I woke up determined to have a productive day, but it seemed like the universe had other plans. From the moment I stepped out of my dorm, I was bombarded with interruptions. Friends stopping me for a quick chat, professors changing class schedules last minute, and even random phone calls. It felt like every time I tried to focus, someone or something would pull me away. Despite the constant interruptions, I managed to find moments of solitude to complete my tasks. It may have been a hassle, but I refused to let it ruin my day.",0,0,0,1,0,0,0,0
"Today has been a typical day at DLSU, filled with the usual hustle and bustle. Unfortunately, I didn't get enough rest last night, which made it challenging to stay focused during my morning classes. I found myself fighting off drowsiness as my professor lectured on. The lack of sleep also affected my energy levels throughout the day, making it difficult to engage in extracurricular activities. Despite these daily hassles, I managed to push through and make the most out of my day at DLSU.",0,0,0,1,0,0,0,0
"Today was a typical day at DLSU, filled with concerns about meeting high standards. As an undergraduate student, the pressure to excel in academics, extracurricular activities, and personal life can be overwhelming. From the moment I woke up, thoughts about meeting these expectations consumed my mind. The constant worry about not being good enough weighed heavily on me throughout the day, making it difficult to fully enjoy my college experience. Nevertheless, I persevered, reminding myself that growth comes from challenging oneself. Despite the daily hassles, I strive to find a balance and embrace the opportunities for growth and learning that this prestigious university offers.",0,0,0,1,0,0,0,0
"Today was a typical day on campus, filled with noise from every direction. As I walked to my first class, the sound of construction echoed through the air, making it difficult to concentrate. The bustling cafeteria was no better, with students chatting loudly and clattering trays. Even the library couldn't offer solace, as whispers and the constant clicking of keyboards filled the space. Despite the constant noise, I managed to find moments of peace in between, reminding myself to stay focused and determined to overcome these daily hassles.",0,0,0,1,0,0,0,0
"Today was an exhausting day at DLSU. With too many responsibilities piling up, I felt overwhelmed. From attending back-to-back classes, finishing assignments, and studying for exams, I struggled to find a moment of respite. The pressure to excel academically while juggling extracurricular activities took a toll on me. However, I powered through, reminding myself that these challenges are what shape me into a well-rounded individual. At the end of the day, I may be tired, but I am proud to be a DLSU student, ready to face whatever comes my way.",0,0,0,1,0,0,0,0
"Today was a whirlwind of stress and responsibilities. From attending back-to-back classes and meeting project deadlines, to managing extracurricular commitments, it felt like there was never enough time. I found myself constantly juggling different tasks, struggling to stay organized and focused. Despite the overwhelming workload, I pushed through and reminded myself that this is all part of the journey. While it was undoubtedly challenging, I knew that these responsibilities were shaping me into a more resilient and capable individual.",0,0,0,1,0,0,0,0
"Today was quite a busy day for me. On top of attending classes and studying for upcoming exams, I had to fulfill my social obligations. I had promised a friend to help organize a charity event, so we spent hours brainstorming and planning the details. Later in the evening, I had to attend a birthday party of a close friend. It was a fun night, but I couldn't help but feel exhausted from juggling my academic responsibilities and social commitments. Nonetheless, I am grateful for the opportunity to contribute to a good cause and spend quality time with loved ones.",0,0,0,1,0,0,0,0
"Today was a typical day of juggling responsibilities as an undergraduate student at DLSU. The clock seemed to tick faster than ever, leaving me with not enough time to tackle all the tasks I needed to complete. Between attending back-to-back classes, rushing to submit assignments, and studying for upcoming exams, it felt like a race against time. Despite my best efforts to manage my schedule efficiently, the constant pressure of not having enough time was a daily hassle that seemed to linger over my shoulder.",0,0,0,1,0,0,0,0
"As a busy undergraduate student at DLSU, my day is often filled with various responsibilities and tasks that demand my attention. However, one recurring daily hassle that constantly plagues me is the feeling of not having enough time to do everything I need to. From attending classes, completing assignments, studying for exams, and engaging in extracurricular activities, it seems like there are never enough hours in the day. This constant time crunch forces me to prioritize and manage my time efficiently, often sacrificing leisure activities and personal time. Nonetheless, I strive to stay organized and make the most out of each day, despite this ongoing challenge.",0,0,0,1,0,0,0,0
"Today was a typical day at DLSU, filled with lectures and assignments. However, amidst the academic chaos, social obligations added another layer of stress. My friends insisted on attending a party tonight, but I had an important project deadline looming over my head. Juggling between academics and maintaining friendships became a challenging task. Eventually, I compromised and joined them for a while, but left early to complete my project. It's days like these when finding a balance between social life and responsibilities becomes an art.",0,0,0,1,0,0,0,0
