Narrative,General Hassles,Inner Concerns,Financial Concerns,Time Pressures,Environmental Hassles,Family Hassles,Health Hassles,Academic Hassles
"Today was a typical day in my life as an undergrad at DLSU, filled with the usual daily hassles. One of the major challenges I faced was not having enough money for my wants, particularly entertainment and recreation. It's frustrating to see my friends enjoying outings and movies while I have to sacrifice those experiences due to financial constraints. However, I try to find joy in little things, like spending time with friends on campus or exploring free activities around the city. Despite the lack of funds, I remind myself that this phase is temporary and that someday I'll be able to enjoy all the entertainment and recreation I desire.",0,0,1,0,0,0,0,0
"Today was another busy day as an undergraduate student at DLSU. Balancing my studies and part-time job has been quite challenging, especially when it comes to financial security. I constantly worry about covering my tuition fees, buying textbooks, and meeting daily expenses. However, I remain determined and motivated to succeed. Despite the daily hassle of financial insecurity, I am grateful for the opportunities provided by my education and the support from my family and friends.",0,0,1,0,0,0,0,0
"So, today was just another typical day as an undergraduate student at DLSU. Waking up early, I grabbed my backpack and headed to class. As I walked through the campus, I couldn't help but notice all the tempting entertainment and recreational activities happening around me. The only problem was, I never seemed to have enough money to indulge in these wants. It's frustrating, but hey, at least I have my studies to keep me occupied. One day, I'll have the means to enjoy all the fun things this campus has to offer.",0,0,1,0,0,0,0,0
"So, today was one of those days when I found myself struggling with the daily hassles of being an undergraduate student at DLSU. As I woke up, I realized that I didn't have enough money to cover my basic necessities. The thought of not being able to afford food, clothing, transportation, housing, or even healthcare weighed heavily on my mind. It's frustrating to see my peers enjoying their college life while I constantly worry about making ends meet. But despite these challenges, I remain determined to work hard and find a way to overcome these financial setbacks.",0,0,1,0,0,0,0,0
"Today was a challenging day as a student at DLSU. I woke up feeling overwhelmed with the constant worry of not having enough money for basic necessities. My stomach grumbled as I walked past the food stalls on campus, unable to afford a decent meal. I wore the same worn-out clothes as yesterday, and my worn-out shoes were struggling to keep up with my busy schedule. Public transportation fares kept increasing, making it harder to commute to school. The thought of not being able to afford proper healthcare or a stable housing situation weighed heavily on my mind. But despite these daily hassles, I remain determined to continue my education and find a way to overcome these financial struggles.",0,0,1,0,0,0,0,0
"Today was a typical day filled with the usual struggles of being a broke college student. As I walked through the university campus, I couldn't help but feel envious of my friends who were able to indulge in entertainment and recreation. With not enough money in my pocket, I had to resist the urge to join them in their fun activities. Instead, I focused on finding free alternatives to keep myself entertained, reminding myself that my financial limitations were only temporary.",0,0,1,0,0,0,0,0
"Today was just another typical day as an undergraduate student at DLSU. As I woke up, the constant worry about financial security nagged at the back of my mind. With tuition fees, daily expenses, and the pressure to maintain a decent lifestyle, it felt like a never-ending battle. However, I refused to let this obstacle dampen my spirits. I reminded myself that perseverance and hard work would eventually lead to a brighter future. Despite the daily hassle, I remained focused and determined to overcome this challenge and achieve my goals.",0,0,1,0,0,0,0,0
"So, like, today was such a stressful day for me. I couldn't stop worrying about the money I owe. It's been bugging me for a while now, and it's starting to take a toll on my mental health. I kept thinking about how I'm going to pay it off, and it's been giving me major anxiety. I really hope I can find a way to sort this out soon because it's becoming a major hassle in my life.",0,0,1,0,0,0,0,0
"So, my day started off pretty rough. I woke up with concerns about owing money. The looming deadline for my tuition payment was causing me a lot of stress. As I made my way to campus, these worries weighed heavily on my mind, making it hard to focus on my classes. Throughout the day, I couldn't shake off the nagging feeling of financial uncertainty. It was a constant hassle that overshadowed everything else, making me long for a solution to this predicament.",0,0,1,0,0,0,0,0
"Today was just like any other day, filled with the usual daily hassles that come with being an undergraduate student. One of the biggest challenges I faced was not having enough money for basic necessities. It was a constant struggle to afford food, clothing, transportation, housing, and healthcare. I had to carefully budget every penny to make ends meet, often sacrificing some of my needs. Despite these financial difficulties, I remained determined to pursue my education and hoped for a better future.",0,0,1,0,0,0,0,0
"So, it was just another typical day in my life as an undergraduate student at DLSU. As usual, I woke up with a knot in my stomach, worrying about not having enough money for basic necessities. The thought of not being able to afford proper food, clothing, transportation, housing, and healthcare weighed heavily on my mind. It's a constant struggle, juggling between part-time jobs and studying, just to make ends meet. But despite the daily hassle, I remain determined to persevere and work hard to overcome these financial challenges, hoping for a brighter future ahead.",0,0,1,0,0,0,0,0
"So, today started off with concerns about owing money. I woke up to a text message from my friend reminding me about the money I borrowed from him for last night's dinner. It completely slipped my mind! Feeling guilty, I immediately messaged him, apologizing for the delay in repayment and assuring him that I would return the money as soon as possible. It's frustrating to deal with unexpected expenses and forgetfulness, but I'm determined to sort it out and learn from this experience.",0,0,1,0,0,0,0,0
"Today was another hectic day as an undergraduate student at DLSU. Waking up to the reality of financial insecurity weighed heavily on my mind. Calculating my expenses, I realized how limited my resources were. The constant struggle to balance academics and part-time work seemed never-ending. However, amidst the challenges, I found solace in the support of friends and the determination to overcome this hurdle. With unwavering faith, I reminded myself that these hardships would only make my future success all the more rewarding.",0,0,1,0,0,0,0,0
"Today was a typical day in my life as an undergraduate student at DLSU, filled with its usual daily hassles. Financial security remained a constant concern, as I navigated through the day with limited resources. From carefully budgeting my meals to searching for affordable textbooks and part-time job opportunities, the struggle to maintain a stable financial footing became an integral part of my routine. Despite these challenges, I persevered, reminding myself that this phase was temporary and that my education was worth every penny.",0,0,1,0,0,0,0,0
"So, today started off with concerns about owing money. As an undergraduate student, managing finances can be quite challenging. But instead of dwelling on it, I decided to focus on my studies and seek ways to earn extra income. Despite the hassle, I pushed through the day with determination and a positive mindset. With the support of my friends and family, I know I can overcome this obstacle and turn it into a valuable learning experience.",0,0,1,0,0,0,0,0
"Today was a typical day at DLSU, but my mind was preoccupied with concerns about money for emergencies. As an undergraduate student, unexpected expenses often arise, and I constantly worry about being unprepared. Whether it's a sudden medical bill or a broken laptop, I constantly feel the need to save more to ensure I can handle any unforeseen circumstances. It's a daily hassle that weighs on my mind, but it also motivates me to work harder and be financially responsible.",0,0,1,0,0,0,0,0
"So, today was one of those days where I couldn't help but worry about money for emergencies. As an undergraduate student at DLSU, unexpected expenses always seem to pop up at the most inconvenient times. Whether it's a sudden need for textbooks or a medical emergency, it's always a constant concern. Despite my tight budget, I try my best to save a little each month in case of any unforeseen circumstances. It's a constant juggling act, but I know that being prepared is crucial.",0,0,1,0,0,0,0,0
"So, today was quite a rollercoaster of a day. Woke up to the usual hustle and bustle, but my mind was preoccupied with concerns about money for emergencies. As a broke college student, it's always a nagging worry. On my way to class, my phone suddenly died, leaving me panicking about how I would afford a new one. Thankfully, I found a small job opportunity on campus that might just save the day. Fingers crossed, this could be my ticket to financial stability and peace of mind.",0,0,1,0,0,0,0,0
"So, today was quite a rollercoaster ride for me. As an undergrad student at DLSU, one of my daily hassles revolves around concerns about owing money. You see, tuition fees, textbooks, and other expenses can really add up. Today, I had a moment of panic when I realized I forgot to pay my phone bill, and the due date was fast approaching. However, after a quick call to my parents, they assured me they would take care of it. Phew! It's a relief to have such supportive parents who understand the struggles of being a student.",0,0,1,0,0,0,0,0
"Today was one of those days where everything seemed to go wrong. Waking up to an empty wallet, I realized I didn't have enough money to cover my basic necessities. Skipping breakfast, I rushed to catch the crowded train, praying I wouldn't get caught without a ticket. As classes went by, my growling stomach became a constant reminder of my financial struggles. With each passing hour, the weight of not being able to afford proper healthcare or even a decent meal seemed to crush me. But amidst these challenges, I remained determined to find a way to overcome these daily hassles and create a better future for myself.",0,0,1,0,0,0,0,0
"Today was just another challenging day as an undergraduate student at DLSU. Financial security remains a constant hassle, with tuition fees, transportation expenses, and daily necessities constantly weighing on my mind. Juggling part-time jobs and squeezing every penny has become the norm. Despite the struggles, I remain determined to pursue my education and secure a better future. With every hurdle I overcome, I am one step closer to achieving my goals.",0,0,1,0,0,0,0,0
"So, today has been quite a day. I woke up with concerns about owing money hanging over my head. As an undergraduate student from DLSU, managing finances can sometimes be a hassle. I spent the morning crunching numbers and devising a budget plan to ensure I stay on top of my expenses. It's frustrating at times, but I know it's all part of the journey towards independence and success. Despite the daily hassles, I'm determined to make the most out of my time at DLSU and emerge stronger from these challenges.",0,0,1,0,0,0,0,0
"So, it's another typical day for me as an undergraduate student at DLSU. As I wake up, the first hassle that greets me is the constant worry about not having enough money to cover my basic necessities. From struggling to afford a decent meal to finding affordable clothing and transportation options, financial constraints seem to always loom over my head. It's a daily battle to make ends meet, but I try to stay positive and motivated, knowing that my education will lead me to a brighter future.",0,0,1,0,0,0,0,0
"Today was a typical day in my life as an undergraduate student at DLSU, filled with its fair share of daily hassles. As I woke up and prepared for the day ahead, a lingering worry weighed on my mind - not having enough money for my wants, particularly entertainment and recreation. While my academic pursuits kept me occupied, the desire to unwind and enjoy some leisure activities constantly reminded me of my financial limitations. Nonetheless, I remained determined to find affordable ways to have fun, reminding myself that success lies not only in material extravagance but also in embracing life's simple pleasures.",0,0,1,0,0,0,0,0
"Today was a typical day as an undergraduate student at DLSU, but it came with its fair share of daily hassles. As I woke up, I realized I didn't have enough money for entertainment and recreation, which left me feeling a bit down. However, I reminded myself that academics should be my priority and that I could find joy in simple pleasures. So, I spent the day studying in the library and catching up with friends over cheap coffee. Although my wants were not fulfilled, I still managed to make the most of my day in a less extravagant way.",0,0,1,0,0,0,0,0
"So, today was quite a hassle for me as an undergraduate student from DLSU. I couldn't help but constantly worry about owing money. With tuition fees, textbooks, and daily expenses, it feels like a never-ending cycle of financial stress. It's tough to focus on my studies when financial concerns are constantly at the back of my mind. But, I try to stay positive and motivated, knowing that education is an investment in my future.",0,0,1,0,0,0,0,0
"Today, as an undergraduate student from DLSU, my day started with the constant reminder of financial security. Waking up to unpaid bills and the pressure to make ends meet, I embarked on my daily journey to campus. Amidst the hustle and bustle of classes and assignments, the worry of not being able to afford textbooks or even a decent meal lingered in the back of my mind. However, I remained determined, knowing that education is the key to a brighter future.",0,0,1,0,0,0,0,0
"Today was a typical day as an undergraduate student at DLSU, filled with the usual daily hassles. Unfortunately, one of the major challenges I faced was not having enough money for basic necessities. It was disheartening to constantly worry about affording food, clothing, transportation, housing, and healthcare. This financial strain added immense stress to my already demanding academic life. Nevertheless, I tried to remain optimistic, seeking support from friends and exploring possible solutions such as part-time jobs. Despite these hardships, I remained determined to overcome these obstacles and continue pursuing my dreams.",0,0,1,0,0,0,0,0
"So, it was just another typical day in the life of a struggling undergraduate student at DLSU. I woke up with the nagging worry of not having enough money to cover my basic necessities. As I rushed to class, I skipped breakfast to save some cash. Throughout the day, I couldn't help but constantly worry about how I would afford my next meal, transportation, and even healthcare expenses. It's a constant battle to make ends meet, but I try to stay positive and hopeful that things will get better soon.",0,0,1,0,0,0,0,0
"Today was another challenging day as an undergraduate student at DLSU. The constant struggle of not having enough money for basic necessities like food, clothing, transportation, and housing seemed to weigh heavily on my mind. I found myself constantly juggling between prioritizing my education and trying to make ends meet. It's disheartening to see my peers enjoying a carefree college life while I worry about healthcare expenses and the rising cost of living. Nonetheless, I remain determined to persevere and find a way to overcome these daily financial hassles.",0,0,1,0,0,0,0,0
"So, today started off like any typical day for me as an undergraduate student at DLSU. As I hurriedly got ready for my morning classes, I couldn't help but feel a constant concern about money for emergencies lingering in the back of my mind. With limited financial resources, unexpected expenses can feel overwhelming. However, I reminded myself to stay positive and focused on my studies, hoping that someday these concerns would be a thing of the past.",0,0,1,0,0,0,0,0
"Today was quite a struggle as I battled the perpetual issue of not having enough money for my wants, particularly entertainment and recreation. As an undergraduate student from DLSU, my budget is tight, and splurging on fun activities is a luxury I can rarely afford. While my friends enjoyed the latest movies or indulged in delicious meals, I had to opt for more affordable alternatives. However, I reminded myself that this financial constraint is temporary, and the satisfaction of working hard towards my goals will eventually outweigh these daily hassles.",0,0,1,0,0,0,0,0
"So, today was just another day as an undergrad student at DLSU. As I rushed to my first class, concerns about money for emergencies kept nagging at the back of my mind. Being on a tight budget, unexpected expenses like medical bills or car repairs seemed like a nightmare. However, I reminded myself that worrying wouldn't solve anything and focused on making the most out of my day.",0,0,1,0,0,0,0,0
"Today was another hectic day at school. As an undergrad student at DLSU, I had to juggle my classes, assignments, and extracurricular activities. On top of that, concerns about money for emergencies have been weighing on my mind. I constantly worry about unexpected expenses that might arise, from medical emergencies to unforeseen academic expenses. It's frustrating to be limited by financial constraints, but I try my best to stay focused and work hard, hoping that someday these worries will be a thing of the past.",0,0,1,0,0,0,0,0
"Today was another typical day as an undergraduate student at DLSU. I woke up feeling excited for the day ahead, but as I checked my wallet, I realized that I didn't have enough money for my entertainment and recreational needs. It was quite disappointing, as I had been looking forward to catching a movie with my friends after a long week of studying. However, I reminded myself that there are other ways to have fun without spending too much. So instead, we decided to have a movie night at home, making the best out of our limited resources. It turned out to be a memorable and enjoyable evening, proving that sometimes, the simplest pleasures can bring the most happiness.",0,0,1,0,0,0,0,0
"So, today started off like any other day for me as an undergraduate student from DLSU. Waking up early, getting ready for class, and rushing to catch the shuttle. But amidst the hustle and bustle, concerns about money for emergencies kept nagging at the back of my mind. As I listened to the lecture, I couldn't help but worry about unexpected expenses and how I would manage them. It's a constant source of stress, but I try to stay positive and hopeful that things will work out somehow.",0,0,1,0,0,0,0,0
"Today was quite a rollercoaster. Waking up late, I rushed to catch my morning class, only to realize I forgot my wallet at home. The fear of not having any money for emergencies haunted me throughout the day. After class, I received an unexpected call from my sister, informing me that our dog had fallen ill and required immediate medical attention. Panic set in as I realized I didn't have enough funds to cover the vet bills. It's moments like these that remind me of the constant concerns about money for emergencies that plague my daily life as an undergraduate student.",0,0,1,0,0,0,0,0
"Today was a typical day as an undergraduate student at DLSU. As usual, I woke up early, attended my classes, and worked on assignments. However, a daily hassle that constantly lingered over me was not having enough money for entertainment and recreation. It was frustrating to see my friends enjoying outings and fun activities while I had to limit my spending. Nonetheless, I reminded myself that education was my priority, and I needed to make sacrifices. So, I focused on my studies, hoping that better days would come when I could indulge in the things I enjoyed without financial worries.",0,0,1,0,0,0,0,0
"Today was just like any other day for me as an undergraduate student at DLSU. I woke up feeling the weight of financial insecurity on my shoulders. Thoughts of tuition fees, daily expenses, and the ever-increasing cost of living constantly loom in my mind. As I went through the day, I couldn't help but worry about how I would manage to make ends meet. Despite the challenges, I remain determined to pursue my dreams and find ways to secure a brighter future for myself.",0,0,1,0,0,0,0,0
"So, today was quite a rollercoaster. Woke up late, rushed to class, only to realize I forgot my wallet at home. Panic mode activated! My mind immediately went to concerns about money for emergencies. What if something happened and I needed cash? Thankfully, I spotted a friend who lent me some. Phew! Lesson learned: always double-check before leaving the house. Money matters can be such a hassle, but having supportive friends makes it a little easier.",0,0,1,0,0,0,0,0
"So, today was quite a hassle. I woke up with concerns about owing money, as my student loan payment was due. It was stressful trying to figure out how to manage my finances while juggling my studies. I had to constantly remind myself to stay focused and not let this worry consume me. Thankfully, I was able to find a part-time job that would help ease the financial burden. It's a constant struggle, but I'm determined to overcome it and continue pursuing my dreams.",0,0,1,0,0,0,0,0
"Today was a typical day at DLSU, filled with classes, assignments, and the constant hustle and bustle of student life. However, there was an underlying concern that nagged at me throughout the day - owing money. As a broke undergraduate student, the weight of unpaid bills and mounting debts constantly loomed over me. It was difficult to focus on my studies when financial worries clouded my mind. Nevertheless, I pushed through, determined to find a solution and alleviate this daily hassle.",0,0,1,0,0,0,0,0
"As a DLSU undergraduate student, financial security is a daily hassle that constantly plays on my mind. Balancing tuition fees, transportation expenses, and daily necessities becomes challenging. I often find myself meticulously planning my budget, searching for part-time jobs, and applying for scholarships to alleviate the financial burden. Despite the constant worry, I remain determined and focused on my studies, knowing that the sacrifices I make today will pave the way for a brighter future tomorrow.",0,0,1,0,0,0,0,0
"Today was a typical day at DLSU, filled with academic pursuits and the usual daily hassles. As an undergraduate student, one of the main challenges I face is not having enough money for my wants, especially when it comes to entertainment and recreation. It can be frustrating to see my friends enjoying fun activities while I have to limit myself due to financial constraints. However, I try to stay positive and make the most out of the free or inexpensive options available, such as exploring the campus, attending student organization events, or simply spending quality time with friends. Despite the financial limitations, I strive to find joy in the little things and appreciate the experiences that don't require a hefty price tag.",0,0,1,0,0,0,0,0
"Today was another challenging day as an undergraduate student at DLSU. Waking up to the reality of not having enough money for basic necessities is a constant struggle. Skipping meals and relying on the kindness of friends for sustenance has become the norm. The lack of funds for transportation makes every journey to and from campus a daunting task. The burden of not being able to afford proper clothing and housing weighs heavily on my mind. Health concerns linger, as healthcare expenses seem like a luxury. Amidst these daily hassles, I strive to stay focused on my studies, hoping that one day, these financial difficulties will be a thing of the past.",0,0,1,0,0,0,0,0
"So, today was quite a rollercoaster of a day. Woke up feeling a little worried about money for emergencies - being an undergrad student, it's always a concern. Rushed to class, barely making it on time. As if that wasn't enough, my laptop decided to crash during an important presentation. Panicking, I had to borrow a classmate's laptop to salvage the situation. Later, I realized I left my wallet at home and had to beg a friend for lunch money. Thankfully, the day ended on a positive note when I found out I won a scholarship that will ease some of my financial worries. Phew!",0,0,1,0,0,0,0,0
"Today was just another typical day as an undergraduate student at DLSU. As I woke up this morning, concerns about money for emergencies immediately flooded my mind. With tuition fees, books, and daily expenses, saving up for unexpected situations seemed impossible. However, I reminded myself to stay positive and focused on finding part-time work opportunities and exploring scholarship options. Despite the daily hassle, I remained determined to overcome this financial hurdle and achieve my academic goals.",0,0,1,0,0,0,0,0
