Narrative,Dissatisfaction with academic performance,Challenges with instructors,Discontent with current academic responsibilities,Concerns regarding academic transitions,Difficulties with peers or classmates,Challenges in managing group projects,Getting late to class
"Today was a tough day at DLSU. I couldn't help but feel dissatisfied with my academic performance. The overwhelming workload and challenging exams left me questioning my abilities. It's frustrating to see my efforts not translating into the desired results. However, I'm determined to overcome this hurdle and strive for improvement. Tomorrow is a new day, and I'll use this dissatisfaction as fuel to work harder and smarter.",1,0,0,0,0,0,0
"Today was quite a challenging day at DLSU. I woke up dissatisfied with my academic performance lately. Feeling overwhelmed with assignments and exams, I struggled to find motivation to push through the day. Despite attending classes and seeking help, I couldn't shake off the nagging feeling of disappointment. However, I reminded myself that setbacks are part of the learning process and tomorrow is a new opportunity to improve.",1,0,0,0,0,0,0
"Today was a rough day for me at DLSU. I couldn't shake off the dissatisfaction with my academic performance. It felt like no matter how much effort I put into my studies, I couldn't achieve the grades I aspired for. The constant feeling of falling short weighed heavily on me, making me question my abilities. But instead of wallowing in self-pity, I reminded myself to stay resilient, seek help when needed, and never give up on my pursuit of knowledge. Tomorrow is a new day, and I'm determined to turn this dissatisfaction into motivation for improvement.",1,0,0,0,0,0,0
"Today was a tough day at DLSU. I couldn't help but feel dissatisfied with my academic performance. The constant pressure to excel in every subject can be overwhelming. I spent hours studying for an upcoming exam, only to find out that I didn't perform as well as I had hoped. It's frustrating to put in so much effort and not see the desired results. However, I know that setbacks are a part of the learning process, and I won't let this discourage me from striving harder in the future.",1,0,0,0,0,0,0
"Today was a challenging day at DLSU. I woke up with a nagging feeling of dissatisfaction with my academic performance. As I walked to class, I couldn't help but question if I was doing enough. The constant pressure to excel weighed heavily on my shoulders. In lectures, I struggled to concentrate, feeling overwhelmed by the fear of failure. Despite my efforts, I still felt like I fell short. This dissatisfaction lingered throughout the day, serving as a constant reminder of the need to push myself harder.",1,0,0,0,0,0,0
"Today was just one of those days. I woke up feeling overwhelmed with dissatisfaction about my academic performance. It seemed like no matter how hard I studied, my grades just didn't reflect my efforts. The constant pressure to excel was weighing me down, making it hard to stay motivated. But despite the frustration, I reminded myself to keep pushing forward and not let this setback define me.",1,0,0,0,0,0,0
"Today was a tough day at DLSU. I couldn't help but feel dissatisfied with my academic performance. No matter how hard I studied for that math quiz, I still didn't get the grade I wanted. It's frustrating when you put in so much effort and don't see the desired results. But I won't let this setback bring me down. I'll use it as motivation to work even harder and seek help if needed. After all, it's just a bump in the road towards success.",1,0,0,0,0,0,0
"Today was such a frustrating day. I couldn't help but feel dissatisfied with my academic performance. It seems like no matter how much effort I put into my studies, I always fall short of my own expectations. The constant pressure to excel and the fear of disappointing my parents and myself is weighing me down. It's a never-ending cycle of self-doubt and disappointment. I hope tomorrow brings a fresh start and a renewed sense of confidence in my abilities.",1,0,0,0,0,0,0
"My day started with a heavy sigh as I logged into the university portal to check my grades. Dissatisfaction with my academic performance washed over me like a stormy sea. Despite putting in countless hours of studying and sacrificing my social life, my efforts seemed futile. Thoughts of self-doubt clouded my mind, but I reminded myself that a single setback wouldn't define me. Determined to improve, I charted a plan to seek help from professors and explore new study techniques. As the day progressed, I found solace in knowing that this hurdle was just a stepping stone towards growth and success.",1,0,0,0,0,0,0
"Today was a tough day at DLSU. I couldn't shake off the dissatisfaction I felt with my academic performance. Despite putting in hours of studying, I still struggled to grasp certain concepts. It was frustrating to see my efforts not reflecting in my grades. Doubts began to creep in, making me question my abilities. However, I reminded myself that setbacks are a part of the learning process, and I must persevere. Determined to improve, I vowed to seek help from professors and classmates to overcome this hurdle.",1,0,0,0,0,0,0
"Today was such a frustrating day for me. I couldn't help but feel dissatisfied with my academic performance. I struggled to understand the concepts discussed in class and felt lost during the lectures. It seemed like no matter how much effort I put into studying, my grades never reflected my hard work. This constant dissatisfaction with my academic performance left me feeling demotivated and questioning my abilities. I hope tomorrow brings a better day in terms of learning and understanding.",1,0,0,0,0,0,0
"Today was one of those days where dissatisfaction with my academic performance weighed heavily on my mind. Despite putting in the effort, I couldn't seem to grasp the concepts in my math class. Frustration seeped into my bones as I sat in the lecture, feeling overwhelmed and lost. Determined to improve, I sought help from my professor after class, hoping for guidance. Although disheartened, I reminded myself that setbacks are temporary and that with perseverance, I can overcome this hurdle.",1,0,0,0,0,0,0
"Today was such a frustrating day! I couldn't help but feel dissatisfied with my academic performance at DLSU. Despite putting in hours of studying, I still struggled to grasp some concepts in my classes. It's disheartening to see my grades suffer, especially when I know I'm capable of more. I can't help but wonder if I'm doing something wrong or if I'm simply not cut out for this. I need to find a way to overcome this hurdle and regain my confidence.",1,0,0,0,0,0,0
"Today was a challenging day as I found myself dissatisfied with my academic performance. Despite my efforts, I couldn't seem to grasp the concepts in my calculus class. It was frustrating to see my peers excelling while I struggled. Feeling disheartened, I realized the need to seek additional help and make changes to my study routine. It's just a bump on the road, and I'm determined to overcome this hurdle and improve my academic performance.",1,0,0,0,0,0,0
"Today was a tough day at DLSU. I couldn't help but feel dissatisfied with my academic performance. Despite putting in hours of study, I couldn't grasp certain concepts in my engineering class. It's frustrating to see my efforts go in vain. I know I need to seek help and put in extra effort, but today, this dissatisfaction loomed over me, reminding me that I still have a long way to go. But hey, tomorrow is a new day, and I won't let this setback define me.",1,0,0,0,0,0,0
"Today has been a rollercoaster of emotions. Waking up with a sense of dissatisfaction with my academic performance has clouded my entire day. The constant nagging feeling that I could have done better in my recent exams has been eating away at me. It's frustrating to put in so much effort and not see the desired results. Nonetheless, I am determined to use this dissatisfaction as fuel to work harder and improve my performance in the future. It's just a bump in the road, and I won't let it define me.",1,0,0,0,0,0,0
"Today has been a real struggle. I woke up feeling dissatisfied with my academic performance. It seems like no matter how hard I study, I can't seem to achieve the grades I desire. This constant dissatisfaction is starting to take a toll on my motivation and self-confidence. It's frustrating to put in so much effort and not see the results I want. I'm determined to find a way to improve and overcome this hurdle.",1,0,0,0,0,0,0
"Today was not a great day for me. I couldn't help but feel dissatisfied with my academic performance. I struggled to fully understand the concepts in my classes, and my grades have been slipping lately. It's frustrating because I know I can do better, but I just can't seem to find my groove. I spent the day feeling discouraged and worrying about how this would affect my future. Hopefully, tomorrow will be a better day.",1,0,0,0,0,0,0
"So today was just one of those days where I couldn't help but feel dissatisfied with my academic performance. No matter how hard I tried, it seemed like I just couldn't grasp the concepts in my math class. The frustration kept building up as I struggled to understand the equations and solve the problems. It's moments like these that make me question my abilities and wonder if I'm cut out for this course. But hey, tomorrow is a new day and I'll continue to push myself and seek help until I overcome this hurdle.",1,0,0,0,0,0,0
"Today was a rough day at DLSU. I had an overwhelming feeling of dissatisfaction with my academic performance. It seemed like no matter how hard I studied or prepared for exams, my grades just didn't reflect my efforts. It was frustrating to see my classmates effortlessly excel while I struggled to keep up. This constant disappointment only fueled my determination to work harder and prove myself, but it was definitely a hassle that weighed heavily on my mind throughout the day.",1,0,0,0,0,0,0
"Today was such a frustrating day. I woke up feeling dissatisfied with my academic performance. The pressure to excel is overwhelming, and I can't help but feel like I'm falling short. Despite putting in countless hours of studying, my grades don't seem to reflect my efforts. It's disheartening to see my classmates doing well while I struggle to keep up. I need to find a way to improve and regain my confidence, but for now, this dissatisfaction lingers, casting a shadow over my day.",1,0,0,0,0,0,0
"Today was a tough day for me. I couldn't shake off my dissatisfaction with my academic performance. It felt like no matter how hard I studied, I couldn't achieve the grades I desired. The constant pressure to excel was overwhelming, and it weighed heavily on my mind throughout the day. I couldn't fully enjoy my classes or engage with my peers, as the disappointment in myself loomed over me. It's moments like these that make me question my abilities and wonder if I'm truly cut out for this journey.",1,0,0,0,0,0,0
"Today was a rather frustrating day at DLSU. My dissatisfaction with my academic performance has been weighing heavily on my mind. Despite putting in countless hours of studying, I still couldn't seem to grasp the concepts in my math class. It's disheartening to constantly feel like I'm falling behind. I can't help but wonder if all my efforts are in vain. I guess it's time to seek help and find a way to improve my performance.",1,0,0,0,0,0,0
"Today was such a frustrating day. I couldn't help but feel dissatisfied with my academic performance. It seems like no matter how hard I try, my grades just won't improve. I spent hours studying for my exams, only to receive disappointing results. It's disheartening to see my efforts go to waste. I can't help but wonder if I'm just not cut out for this. I'm determined to turn things around, but it's definitely a daily hassle that weighs heavily on my mind.",1,0,0,0,0,0,0
"So, today was another day of dissatisfaction with my academic performance. I woke up feeling overwhelmed by the amount of work I had to do and the upcoming exams. As I sat in class, I couldn't help but feel lost and confused. The constant pressure to excel and meet expectations was weighing me down. Despite my efforts, I still struggled to grasp some concepts. It's frustrating to constantly compare myself to my peers and feel like I'm falling behind. It's a daily hassle that leaves me feeling deflated and questioning my abilities. I hope tomorrow brings a better day.",1,0,0,0,0,0,0
"Today was such a frustrating day. I woke up feeling down, dissatisfied with my academic performance. Despite my efforts, I couldn't seem to achieve the grades I desired. It seemed like no matter how much time I invested in studying, it was never enough. This constant dissatisfaction loomed over me, making it hard to focus and enjoy my day. I hope tomorrow brings a fresh start and a better outlook on my academic journey.",1,0,0,0,0,0,0
"Today was a tough day at DLSU. I couldn't help but feel dissatisfied with my academic performance. The constant pressure to excel and the fear of disappointing my professors weighed heavily on me. Despite my efforts, I couldn't shake off the feeling of falling short. It's frustrating to see my peers effortlessly acing exams while I struggle to keep up. But I won't let this setback define me. Tomorrow is a new day, and I will work harder to overcome this dissatisfaction and strive for success.",1,0,0,0,0,0,0
"Today was quite a rollercoaster. Woke up feeling dissatisfied with my academic performance, as the stress of exams and assignments seemed never-ending. Dragging myself to class, I struggled to focus, constantly doubting my abilities. The disappointment grew as I received a subpar grade on a recent paper. However, instead of wallowing in self-pity, I chose to view it as a learning opportunity, determined to improve. With renewed motivation, I sought guidance from professors and dedicated extra hours to studying. Though dissatisfied, I refuse to let it define me. Tomorrow is a new day, and I'll strive to do better.",1,0,0,0,0,0,0
"Today was one of those days where my dissatisfaction with academic performance really got to me. I spent hours studying for my math exam, but when I received my grade, it was far from what I had hoped for. It's frustrating to put in so much effort and not see the desired outcome. However, I won't let this setback define me. I'll learn from my mistakes, seek help if needed, and strive to improve. After all, it's just one exam, and there's still plenty of opportunities to excel.",1,0,0,0,0,0,0
"Today was just one of those days where I couldn't shake off the dissatisfaction with my academic performance. I had spent countless hours studying for my exams, but the results didn't reflect my efforts. It's disheartening to see my hard work go in vain. However, I won't let this setback define me. I'll use it as fuel to push myself further and strive for better outcomes in the future.",1,0,0,0,0,0,0
"Today was quite a challenging day at DLSU. Dealing with instructors who seemed disinterested and unresponsive made it difficult to grasp the concepts during lectures. Their lack of clarity and inability to answer questions left me feeling frustrated and lost. It's disheartening when the people responsible for guiding your education fall short. Nonetheless, I remained determined to find alternative resources and seek help from peers to overcome these obstacles.",0,1,0,0,0,0,0
"Today was quite a challenging day at DLSU. Dealing with instructors who seemed to be on a mission to make our lives difficult was definitely a hassle. From confusing instructions to unreasonable deadlines, it felt like a constant uphill battle. However, as resilient students, we managed to navigate through these challenges, seeking guidance from classmates and utilizing available resources. Despite the hassles, we remained determined to make the most out of our education and overcome any obstacles that came our way.",0,1,0,0,0,0,0
"Today was quite a challenging day at DLSU. Dealing with instructors who had conflicting schedules and unresponsive emails made it difficult to clarify doubts and seek guidance. It was frustrating to juggle between different subject requirements and not receiving prompt feedback. However, I managed to overcome these challenges by seeking help from classmates and utilizing online resources. Despite the hassles, I remain determined to excel and make the most out of my undergraduate experience at DLSU.",0,1,0,0,0,0,0
"Today was a challenging day at DLSU. Dealing with instructors proved to be quite a hassle. One professor assigned a mountain of readings and expected us to finish them overnight. Another instructor dropped a surprise quiz without prior notice. It feels like they forget we have other courses too. It's frustrating when they don't consider our workload. Despite the challenges, I managed to keep my cool and tackle these hurdles head-on. It's all part of the undergraduate journey, after all.",0,1,0,0,0,0,0
"Today was quite a challenging day at DLSU. Dealing with instructors who seem to have forgotten what it's like to be an undergraduate student was quite a hassle. Their lack of understanding and empathy towards our struggles made it difficult to approach them for help or clarification. It's frustrating when they dismiss our concerns or simply brush them off as insignificant. Hopefully, tomorrow will bring a more supportive and understanding environment.",0,1,0,0,0,0,0
"Today was quite a challenging day at DLSU. Dealing with some instructors proved to be a hassle. One of them assigned a heavy workload without considering our already overloaded schedule, while another seemed uninterested in providing clarification during class. It's frustrating when we strive for academic excellence, but encounter obstacles with instructors who fail to support our learning journey. Nevertheless, as determined undergraduates, we strive to adapt and find alternative ways to excel in spite of these challenges.",0,1,0,0,0,0,0
"Today was quite a challenging day at DLSU. Dealing with instructors who seem to have no concept of time was a real hassle. One professor arrived 30 minutes late, leaving us waiting and wasting precious class time. Another failed to upload important lecture materials, leaving us scrambling to catch up. It's frustrating when these small issues disrupt our learning experience. I hope tomorrow brings more organized and punctual instructors.",0,1,0,0,0,0,0
"Today was quite challenging with my instructors at DLSU. It felt like they were all on a mission to overwhelm us with assignments and deadlines. The constant barrage of readings, quizzes, and projects made it difficult to manage my time effectively. It seemed as though they forgot that we have other subjects to handle as well. Despite the hurdles, I persevered and tried my best to keep up. It's moments like these that test my resilience as an undergraduate student, but I know that with determination, I can conquer any challenge that comes my way.",0,1,0,0,0,0,0
"Today was a typical day at DLSU, filled with various challenges. One of the primary daily hassles I encountered was dealing with instructors. The struggle to understand their expectations and the pressure to perform well in their classes can be overwhelming. It's frustrating when they assign excessive workloads or fail to provide clear instructions. Nevertheless, I try to stay resilient and seek help from classmates or tutors to navigate through these obstacles. Despite the challenges, I remain determined to make the most out of my education and overcome these hurdles along the way.",0,1,0,0,0,0,0
"Today was a tough day at DLSU. I encountered some challenges with instructors, who seemed uninterested in providing clear explanations during class. It was frustrating trying to decipher their vague instructions and understand their rushed lectures. I wished they would take the time to ensure we grasped the concepts fully. Despite this hurdle, I persevered and sought help from classmates and online resources to overcome these obstacles. It's moments like these that remind me of the importance of self-motivation and resourcefulness in navigating through my undergraduate journey.",0,1,0,0,0,0,0
"Today was a challenging day at DLSU. Dealing with instructors who have diverse teaching styles and expectations proved to be a constant hassle. From one instructor who assigns excessive workload without clear instructions, to another who rushes through the lessons, it was difficult to keep up. However, I managed to navigate through these challenges by seeking clarifications and seeking support from classmates. Despite the daily hassles, I remain determined to excel in my studies and make the most out of my undergraduate experience.",0,1,0,0,0,0,0
"Today was quite a challenging day at DLSU. Dealing with instructors who seem to have an endless supply of assignments and deadlines has become a daily hassle. It feels like they forget that we are undergraduate students juggling multiple courses and responsibilities. But hey, it's all part of the university experience, right? Time to buckle down and conquer these challenges head-on.",0,1,0,0,0,0,0
"Today was quite challenging as I encountered some issues with my instructors. One of them seemed unapproachable, making it difficult to seek clarification on topics. Additionally, another instructor provided vague instructions for an assignment, causing confusion among the students. These challenges made it challenging to fully grasp the lesson and complete my tasks efficiently. Despite these hassles, I remain determined to overcome them and make the most out of my academic journey.",0,1,0,0,0,0,0
"Today was quite a challenging day at DLSU as I faced some issues with my instructors. One of them seemed unapproachable and dismissive, making it difficult to seek clarification on certain topics. Another instructor was consistently late for class, causing disruptions and a loss of valuable learning time. These challenges made it tough to fully engage and grasp the content. However, I remained resilient and sought help from classmates and online resources to overcome these obstacles. It's days like these that test my patience and adaptability as a student.",0,1,0,0,0,0,0
"Today was an eventful day at DLSU, filled with the usual challenges with instructors. In my first class, the professor unexpectedly changed the due date for our research paper, causing panic among the students. Later, in my second class, the instructor rushed through the lecture, making it difficult to grasp the key concepts. Despite these challenges, I managed to stay focused and sought clarification from classmates. It's days like these that teach me resilience and the importance of adaptability in navigating the academic journey.",0,1,0,0,0,0,0
"Today was quite challenging as I faced some hurdles with my instructors at DLSU. One of them assigned an overwhelming amount of readings without considering our other course loads. Another instructor seemed disinterested in answering our questions, leaving us confused and frustrated. It's tough when communication and understanding become barriers to our education. However, I'm determined to overcome these challenges and make the most out of my undergraduate journey.",0,1,0,0,0,0,0
"Today was quite a challenging day at DLSU. Dealing with instructors who seem to have different expectations for assignments can be quite a hassle. It's frustrating when you put in your best effort, only to receive feedback that doesn't align with what was initially communicated. Nevertheless, I will keep pushing forward and try to communicate my concerns to ensure a smoother learning experience for myself and my classmates.",0,1,0,0,0,0,0
"Today was a bit of a struggle as I encountered some challenges with my instructors. First, one of them assigned a mountain of readings overnight, leaving me feeling overwhelmed and stressed. Then, during my online class, I had trouble fully understanding the concept being taught due to the instructor's fast-paced delivery. Despite these hassles, I managed to cope by seeking help from classmates and making use of online resources. Although it was a tough day, I'm determined to overcome these obstacles and continue striving for success.",0,1,0,0,0,0,0
"Today was a rather challenging day at DLSU. Dealing with instructors who seemed to have forgotten about the existence of a life outside academics was quite a hassle. From piling up assignments with unrealistic deadlines to incomprehensible lectures, it felt like a never-ending battle. But amidst the chaos, I managed to find solace in the support of my fellow students. Together, we navigated through the challenges, reminding ourselves that this too shall pass.",0,1,0,0,0,0,0
"Today was a challenging day at DLSU as I encountered some difficulties with my instructors. First, my math professor rushed through the lesson, making it hard to grasp the concepts. Then, my history teacher assigned an overwhelming amount of readings without providing clear instructions. Lastly, my communication professor was dismissive of our questions, making it difficult to clarify doubts. These challenges with instructors created a sense of frustration and hindered my learning experience. I hope tomorrow brings a better academic environment.",0,1,0,0,0,0,0
