"Today was a challenging day at DLSU. Dealing with instructors who seem to have different teaching styles and expectations can be quite overwhelming. It's difficult to keep up with their demands and adapt to their preferences. Some instructors are strict and demand perfection, while others are more laid-back. Trying to navigate through these varying approaches can be quite a hassle, but I remain determined to make the most out of my undergraduate experience.",0,1,0,0,0,0,0
"Today, I had another one of those challenging days at DLSU. Dealing with instructors who seem to have no regard for our time and efforts can be quite frustrating. From last-minute changes in deadlines to confusing instructions, it feels like they are playing a game of hide and seek with our sanity. But hey, we're resilient students, and we'll keep pushing through these daily hassles because we know that in the end, the knowledge we gain is worth it all.",0,1,0,0,0,0,0
Today was another day filled with challenges with my instructors. It seems like they are always in a rush and barely have time to answer our questions or explain concepts thoroughly. It's frustrating to constantly feel lost and helpless in class. I wish they would take more time to understand that we are still learning and need their guidance. It's a constant struggle to keep up with their fast-paced teaching style and meet their high expectations. I hope things get better soon.,0,1,0,0,0,0,0
"Today was quite a challenging day at DLSU. Dealing with instructors who are not always accessible or responsive can be quite frustrating. It often feels like a hassle to reach out to them for clarifications or to discuss any concerns. It's disheartening when you need guidance or feedback and they seem distant. However, despite these challenges, I try to remain proactive and seek assistance from classmates or other resources. It's all a part of the journey towards success!",0,1,0,0,0,0,0
"Today was quite a challenging day at DLSU. Dealing with instructors who seemed disinterested in our success made it difficult to stay motivated. Their lack of clarity in explaining concepts left us feeling confused and frustrated. It's disheartening when you're eager to learn, but the teaching quality falls short. Despite these daily hassles, I remain determined to make the most out of my education and seek alternative ways to grasp the material.",0,1,0,0,0,0,0
"Today was a bit of a rollercoaster. I had a tough time understanding my instructors during our online classes. The poor internet connection made it even harder to grasp the concepts they were explaining. It was frustrating not being able to ask questions or clarify my doubts in real-time. Despite these challenges, I tried my best to stay motivated and proactive, seeking additional resources and reaching out to classmates for support. It's a constant struggle, but I'm determined to make the most out of my education regardless of the obstacles.",0,1,0,0,0,0,0
"Today was quite a challenging day at DLSU. Dealing with instructors who seem to have no regard for our busy schedules can be quite frustrating. The constant changes in deadlines and unexpected assignments only add to the stress. It's disheartening when they don't take the time to hear our concerns or accommodate our needs as students. However, despite these daily hassles, I try my best to remain focused and determined to succeed.",0,1,0,0,0,0,0
"Today was a challenging day at DLSU. I had a few hassles with instructors, which made my day quite stressful. One instructor assigned an overwhelming amount of readings, leaving me struggling to keep up. Additionally, another instructor seemed unapproachable and dismissive of my questions. It made me feel frustrated and unheard. However, despite these challenges, I remained determined to overcome them and make the most out of my day at DLSU.",0,1,0,0,0,0,0
"Today was quite a challenging day at DLSU. Dealing with instructors who seemed distant and unapproachable was a hassle. It was difficult to clarify doubts or seek guidance as they appeared too busy or disinterested. This lack of support made it harder to grasp certain concepts and caused unnecessary stress. However, I remained determined to overcome these obstacles, seeking help from classmates and online resources. Despite the challenges, I learned to be proactive and resilient, striving to make the most out of my education at DLSU.",0,1,0,0,0,0,0
"Today was a bit rough at DLSU. I had a couple of challenges with instructors. First, my math professor was not clear in explaining a concept, and it left me feeling confused and frustrated. Then, my English instructor assigned a difficult reading that I struggled to comprehend. These hassles made me realize the importance of seeking help and clarifying doubts. Despite the challenges, I am determined to overcome them and make the most out of my education at DLSU.",0,1,0,0,0,0,0
"Today was just one of those days. I woke up feeling discontent with my current academic responsibilities. The never-ending pile of readings, assignments, and exams seemed overwhelming. I couldn't help but feel frustrated and exhausted. However, I pushed through the day, reminding myself that this is just a temporary phase. I managed to complete some tasks and even found time to relax and unwind. Tomorrow is a new day, and I am determined to tackle my academic responsibilities with a refreshed mindset.",0,0,1,0,0,0,0
"Today was just another day filled with the usual daily hassles. I woke up feeling discontent with my current academic responsibilities. The never-ending pile of assignments and deadlines seemed overwhelming. As I rushed to class, I realized I had forgotten to print out an important document for a presentation. With a sinking feeling, I knew I would have to face the wrath of my professor. The day seemed to drag on, with each class bringing new challenges and frustrations. I couldn't wait for the day to end and find solace in the comfort of my bed.",0,0,1,0,0,0,0
"Today was just another day filled with academic responsibilities that I can't seem to be content with. The constant stream of assignments, readings, and exams has left me feeling overwhelmed and drained. It feels like a never-ending cycle of stress and pressure. I wish I could find some balance and enjoyment in my studies, but for now, I'll just have to push through and hope for a better day tomorrow.",0,0,1,0,0,0,0
"Today has been a whirlwind of emotions. I woke up feeling discontent with my current academic responsibilities. The endless assignments, exams, and readings seem to consume my every waking moment. It's overwhelming, and I can't help but question if this is truly the path I want to pursue. But amidst the chaos, I remind myself of the bigger picture and the future rewards that education holds. So, with newfound determination, I tackle my tasks head-on, hoping that this momentary dissatisfaction will fuel my drive to excel.",0,0,1,0,0,0,0
"Today was another day filled with discontentment with my current academic responsibilities. The never-ending pile of assignments and readings seemed to be suffocating me. It felt like I was constantly drowning in a sea of deadlines and expectations. The pressure to perform well and meet everyone's expectations was overwhelming. I longed for a break, a moment to breathe and find solace in something other than academics. But amidst all the chaos, I reminded myself to stay determined and push through these daily hassles, knowing that this too shall pass.",0,0,1,0,0,0,0
"Today was just one of those days where I couldn't help but feel discontent with my current academic responsibilities. The pile of assignments, readings, and projects seemed overwhelming, leaving me feeling drained and unmotivated. It felt like a never-ending cycle of stress and exhaustion. As I sat in the library, surrounded by textbooks and notes, I couldn't help but long for a break from the constant pressure. But despite it all, I reminded myself to stay focused and persevere. After all, these challenges are part of the journey towards my future goals.",0,0,1,0,0,0,0
"Today has been quite a challenging day for me as a DLSU undergraduate student. I woke up feeling discontent with my current academic responsibilities. The pile of assignments and projects seemed overwhelming, causing me to question if I could handle it all. However, I reminded myself to stay optimistic and focused on taking one step at a time. Despite the initial frustration, I managed to tackle some tasks and gained a sense of accomplishment. It's a reminder that even amidst daily hassles, perseverance and a positive mindset can make a difference.",0,0,1,0,0,0,0
"So today was just another day of discontent with my current academic responsibilities. The never-ending stream of assignments, exams, and projects is slowly sucking the life out of me. I woke up this morning feeling overwhelmed and dreading the long list of tasks that awaited me. The pressure to perform well and meet deadlines is suffocating. I can't help but wonder if this is what college life is all about – constant stress and never having a moment of respite. I long for the days when learning was a joy and not a burden.",0,0,1,0,0,0,0
"Today was just one of those days where I couldn't help but feel discontent with my current academic responsibilities. The never-ending pile of assignments, the overwhelming pressure to perform well, and the constant struggle to balance my social life with my studies seemed to weigh heavily on me. As I sat in the library, surrounded by textbooks and notes, I couldn't help but long for a break from it all. But despite the frustrations, I reminded myself that this is just a phase and that hard work always pays off in the end.",0,0,1,0,0,0,0
"Today was just another day of discontent with my current academic responsibilities. It feels like I'm drowning in a sea of assignments and exams. The never-ending cycle of studying, attending lectures, and completing projects has left me feeling overwhelmed and drained. It's challenging to find the motivation to keep going, but I know I have to push through. I'll take a deep breath, put on my game face, and tackle these academic hurdles head-on.",0,0,1,0,0,0,0
"Today was just another day filled with academic responsibilities that left me feeling incredibly discontent. The never-ending pile of assignments, readings, and exams seemed to consume every waking moment. It felt like I was drowning in a sea of deadlines, unable to catch my breath. The constant pressure to perform well and meet expectations weighed heavily on my shoulders. As an undergraduate student at DLSU, I knew that this was just a part of the journey, but it didn't make it any easier. I longed for a break, a moment to escape from the relentless demands of my studies. But for now, I had no choice but to push through, hoping that someday it would all be worth it.",0,0,1,0,0,0,0
"Today was another busy day at DLSU, but I couldn't help feeling discontent with my current academic responsibilities. The never-ending pile of assignments and readings seemed overwhelming, leaving me feeling stressed and exhausted. As I rushed from one class to another, I yearned for a moment of respite. It's challenging to balance academics with personal life, and I couldn't shake off the feeling of being trapped in a never-ending cycle. However, I reminded myself that perseverance and determination are key, and that this phase too shall pass.",0,0,1,0,0,0,0
"Today was just another day filled with my usual academic responsibilities. But to be honest, I couldn't help but feel discontent with my current workload. The endless readings, assignments, and exams seemed to pile up, leaving me feeling overwhelmed and stressed. It felt like a never-ending cycle of studying and trying to meet deadlines. I yearned for a break, a moment to catch my breath and escape the constant pressure. But for now, I had no choice but to soldier on, hoping that one day, I would find some respite from this academic chaos.",0,0,1,0,0,0,0
"Today was another challenging day at DLSU. I couldn't help but feel discontent with my current academic responsibilities. The never-ending pile of assignments and the constant pressure to excel were taking a toll on me. It seemed like I was drowning in a sea of papers and deadlines. I yearned for a moment of respite, a chance to breathe and escape from this overwhelming routine. But amidst all the chaos, I reminded myself of my goals, my passion for learning, and the opportunities that lay ahead. Despite the daily hassles, I knew that my hard work would eventually pay off.",0,0,1,0,0,0,0
"Today was quite a hassle. Waking up early for my classes, I couldn't help but feel discontent with my current academic responsibilities. The never-ending pile of assignments and readings seemed overwhelming, leaving me longing for a break. Despite my frustration, I pushed through the day, attending lectures and participating in group discussions. As the day came to an end, I reminded myself that this temporary discomfort is just a part of the journey towards my dreams, motivating me to keep going.",0,0,1,0,0,0,0
"Today was just one of those days where I couldn't help but feel discontent with my current academic responsibilities. The never-ending pile of assignments and readings seemed to be suffocating me. It's frustrating to constantly juggle between classes, group projects, and exams. I yearn for a break, even just a short moment to catch my breath and regain my motivation. But alas, I must persevere and push through, reminding myself that this is just a temporary hurdle in my educational journey.",0,0,1,0,0,0,0
"Today was another day of discontent with my current academic responsibilities. The piles of readings and assignments seemed never-ending, causing me to feel overwhelmed and stressed. It felt like there was not enough time in the day to complete everything. Despite my best efforts, I couldn't shake off the feeling of being suffocated by the weight of my coursework. It was a constant struggle to find motivation and maintain focus. I longed for a break from the never-ending cycle of deadlines and responsibilities, hoping for a day when I could finally catch my breath.",0,0,1,0,0,0,0
"Today was just another day filled with academic responsibilities that left me feeling completely discontented. I struggled to find motivation to complete my never-ending assignments and study for upcoming exams. The weight of expectations and constant pressure to perform well was beginning to take its toll. As I sat in the library, drowning in a sea of textbooks and notes, I couldn't help but wonder if there was more to life than this never-ending cycle of academics.",0,0,1,0,0,0,0
"Today was just another day filled with the usual daily hassles. I woke up feeling discontent with my current academic responsibilities. The pile of assignments and readings seemed never-ending, and I couldn't help but feel overwhelmed. Despite my best efforts to stay on top of things, it felt like I was drowning in a sea of deadlines. The constant pressure to perform well academically was taking a toll on my mental and emotional well-being. I longed for a breather, a moment of respite from the never-ending cycle of studying and completing tasks.",0,0,1,0,0,0,0
"Today was just another day filled with the same old academic responsibilities that seemed to have no end. I couldn't help but feel discontent with the never-ending assignments, readings, and exams. It felt like I was drowning in a sea of deadlines and expectations. As an undergraduate student at DLSU, the pressure to excel was immense. I longed for a break, a moment of respite from the constant academic hustle. But I knew I had to soldier on, pushing through the daily hassles to eventually reap the rewards of my hard work.",0,0,1,0,0,0,0
"Today was just another day filled with academic responsibilities that I can't seem to be content with. The never-ending pile of readings, assignments, and exams is starting to take a toll on me. It feels like I'm drowning in a sea of deadlines and expectations. I yearn for a break, a moment to breathe and rejuvenate. But alas, there's no time for that. The hustle and bustle of university life continues, leaving me discontented and longing for some respite.",0,0,1,0,0,0,0
"Today was just another day filled with academic responsibilities that I couldn't help but feel discontented about. The load of assignments, readings, and exams seemed never-ending. It felt like I had no time for myself or to pursue my other interests. It's frustrating to constantly be tied down by the demands of my courses, leaving little room for personal growth and exploration. I long for a break from this monotonous routine and a chance to truly enjoy my undergraduate journey.",0,0,1,0,0,0,0
"Today has been quite a hassle. I woke up feeling discontent with my current academic responsibilities. The never-ending pile of readings, assignments, and exams seems overwhelming. It's hard to find the motivation to keep pushing through. But despite the frustration, I remind myself that this is just a temporary phase. I know that with determination and perseverance, I can overcome these challenges and come out stronger. So, I take a deep breath, gather my thoughts, and dive back into my studies, hoping for a better tomorrow.",0,0,1,0,0,0,0
"Today was one of those days when I couldn't help but feel discontent with my current academic responsibilities. The overwhelming workload seemed to pile up endlessly, and I couldn't find the motivation to tackle it all. It felt like a never-ending cycle of readings, assignments, and exams. As I sat in the library, surrounded by stacks of books, I couldn't help but yearn for a break from this constant academic pressure. I longed for a day where I could just relax and not worry about deadlines or grades. But for now, I had to push through and find a way to manage my discontentment.",0,0,1,0,0,0,0
"Today was just another day filled with the usual academic responsibilities that left me feeling discontented. The constant barrage of assignments, readings, and exams seemed never-ending, making it difficult to find joy in my studies. The pressure to excel and meet expectations was overwhelming, leaving me longing for a moment of respite. Despite the challenges, I reminded myself to stay focused and persevere, knowing that this journey would eventually lead me to my goals.",0,0,1,0,0,0,0
"Today was just another day at DLSU, filled with the usual hustle and bustle. However, I couldn't shake off my discontent with my current academic responsibilities. The never-ending pile of readings, assignments, and exams seemed to be suffocating me. Despite my efforts to manage my time efficiently, I couldn't help but feel overwhelmed. As I sat in class, my mind wandered, questioning if this was truly the path I wanted to pursue. I longed for a break from the constant pressure and the chance to explore my passions beyond academics.",0,0,1,0,0,0,0
"Today was a bit of a struggle. I woke up feeling discontent with my current academic responsibilities. The never-ending pile of readings, assignments, and exams was weighing heavily on my mind. It seemed like there was always something new to tackle, leaving me feeling overwhelmed and stressed. Despite my best efforts to stay on top of things, it felt like I was constantly playing catch-up. I knew I had to find a way to better manage my time and prioritize my tasks, but for now, I couldn't help but feel frustrated with the never-ending cycle of academic demands.",0,0,1,0,0,0,0
"Today was just another day filled with discontent with my current academic responsibilities. The never-ending pile of assignments and projects seemed to be suffocating me. I couldn't help but feel overwhelmed and exhausted. It felt like I was drowning in a sea of papers and deadlines. The constant pressure to perform well and meet expectations weighed heavily on my shoulders. I longed for a break, a moment to catch my breath and escape from this academic chaos.",0,0,1,0,0,0,0
"Today was another day filled with academic responsibilities that left me feeling quite discontent. The never-ending pile of readings and assignments seemed to taunt me, reminding me of the constant pressure to perform well. Despite my efforts to stay organized and on top of things, it felt like I was always one step behind. As the day went on, I couldn't help but wonder if this relentless cycle of stress and dissatisfaction would ever come to an end.",0,0,1,0,0,0,0
"Today was one of those days where I couldn't help but feel discontent with my current academic responsibilities. The overwhelming amount of assignments, projects, and exams seemed to suffocate me, leaving little room for anything else. It felt like a never-ending cycle of studying and stress, with no time for relaxation or pursuing my other interests. As an undergraduate student at DLSU, I longed for a day when I could break free from this constant pressure and truly enjoy my college experience.",0,0,1,0,0,0,0
"Today was quite a challenging day for me as I found myself grappling with concerns regarding academic transitions. As an undergraduate student at DLSU, I am constantly faced with the pressure to adapt to new subjects, professors, and teaching styles. It can be overwhelming at times, but I remind myself that every hurdle I overcome brings me closer to growth and success. Despite the daily hassles, I remain determined to embrace these academic transitions and make the most out of my university experience.",0,0,0,1,0,0,0
"Today was quite a hectic day for me as I tackled various concerns regarding academic transitions. I found myself struggling to adapt to the new online learning setup, which led to confusion during virtual classes. Additionally, I faced difficulties in adjusting to the increased workload and managing my time effectively. Despite these daily hassles, I remained determined to overcome these challenges and make the most out of my undergraduate journey at DLSU.",0,0,0,1,0,0,0
"Today was quite a hectic day. As an undergraduate student at DLSU, academic transitions have been a constant concern. From adjusting to online classes to grappling with unfamiliar concepts, it has been a rollercoaster ride. The struggle to stay motivated and maintain a work-life balance has become increasingly challenging. However, with the support of my professors and peers, I strive to navigate these transitions with resilience and determination.",0,0,0,1,0,0,0
"Today was a rollercoaster of emotions as I navigated through the concerns regarding academic transitions. The constant changes in schedules and modes of learning have left me feeling overwhelmed and unprepared. From struggling to adapt to online classes to facing technical glitches during exams, it feels like a never-ending battle. However, with the support of my professors and fellow students, I am determined to overcome these obstacles and make the most out of my undergraduate journey at DLSU.",0,0,0,1,0,0,0
"Today, as an undergraduate student at DLSU, my day was filled with concerns regarding academic transitions. Waking up early and rushing to catch the bus, I found myself worried about the upcoming shift from face-to-face classes to online learning. Navigating through different platforms and adjusting to a new mode of instruction seemed overwhelming. Additionally, the constant fear of technical glitches during exams and the struggle to maintain focus without physical classroom interaction added to my daily hassles. However, with determination and support from my peers, I managed to overcome these concerns and adapt to this new normal.",0,0,0,1,0,0,0
"Today was quite a challenging day for me as an undergraduate student at DLSU. I couldn't help but feel overwhelmed with concerns regarding academic transitions. From adjusting to online classes to navigating through unfamiliar platforms, it has been quite a struggle to adapt. Nonetheless, with the support of my professors and fellow students, I am determined to overcome these obstacles and make the most out of my university experience.",0,0,0,1,0,0,0
"Today was a rollercoaster of emotions as I navigated through the concerns regarding academic transitions. From the overwhelming workload to adjusting to online classes, it felt like an uphill battle. However, with the support of my professors and classmates, I managed to overcome the challenges. Although it was daunting, this experience taught me resilience and adaptability. Despite the daily hassles, I am determined to make the most out of my undergraduate journey at DLSU.",0,0,0,1,0,0,0
"Today was quite a hectic day at DLSU. As an undergraduate student, I faced numerous concerns regarding academic transitions. The sudden shift to online classes has been challenging, with technical glitches and poor internet connections causing frustration. Moreover, adjusting to the new learning environment has been overwhelming, as deadlines and expectations pile up. Despite these daily hassles, I remain determined to adapt and make the most of my education at DLSU.",0,0,0,1,0,0,0
"Today was a rollercoaster of emotions as I navigated the concerns regarding academic transitions. From adjusting to online classes to struggling with the sudden workload, it felt like a never-ending battle. Zoom fatigue and technical difficulties added to the frustration. However, with the support of my professors and peers, I managed to find my footing. Despite these daily hassles, I am determined to make the most out of my undergraduate journey at DLSU.",0,0,0,1,0,0,0
