"Today was quite challenging at school. I faced some difficulties with my peers or classmates. It seemed like there was a constant clash of ideas during group discussions, making it hard to reach a consensus. Additionally, some classmates were dismissive of others' opinions, leading to a tense atmosphere. However, I tried my best to maintain a positive attitude and foster effective communication. Despite the hassles, I believe these challenges will help me grow and develop valuable skills in teamwork and conflict resolution.",0,0,0,0,1,0,0
"Today was quite a rollercoaster. Dealing with group projects, as usual, proved to be a challenge. Coordinating schedules, balancing workloads, and ensuring everyone is on the same page can be exhausting. It's frustrating when some team members don't pull their weight or procrastinate until the last minute. But hey, it's all part of the university experience, right? Despite the daily hassles, we managed to push through and deliver a decent outcome. Can't wait for tomorrow's adventures!",0,0,0,0,0,1,0
"Today was another challenging day at DLSU. Managing group projects is always a hassle, and today was no exception. Coordinating with my teammates, scheduling meetings, and ensuring everyone completes their assigned tasks can be quite overwhelming. It's frustrating when some members don't contribute equally or fail to meet deadlines. However, despite these challenges, I try to maintain a positive attitude and find ways to motivate my group. It's a constant learning experience, teaching me the importance of effective communication and teamwork.",0,0,0,0,0,1,0
"Today was a typical day at DLSU, filled with the usual challenges in managing group projects. My teammates and I struggled to coordinate our schedules and find a common time to meet. We faced difficulties in assigning tasks and ensuring everyone's contribution was equal. Additionally, communication issues arose, as some members were unresponsive or had conflicting ideas. Despite these hassles, we managed to pull through and complete our project, learning valuable lessons in teamwork and time management along the way.",0,0,0,0,0,1,0
"Today was another hectic day at DLSU. Managing group projects has always been a challenge, and today was no different. Coordinating schedules, dividing tasks, and ensuring everyone meets the deadlines seemed like an uphill battle. Despite the occasional clashes and differences in work ethics, we managed to pull through. It's frustrating at times, but I guess that's what college life is all about - learning to work with different personalities and overcoming obstacles as a team.",0,0,0,0,0,1,0
"Today was a typical day in my life as an undergraduate student at DLSU. One of the daily hassles that I encountered was the challenges in managing group projects. It's always a struggle to coordinate and collaborate with my group mates, especially when everyone has different schedules and priorities. From finding a common time to meet to delegating tasks and ensuring everyone contributes equally, it can be quite frustrating at times. However, despite the challenges, we managed to overcome them and successfully complete our project. It's all part of the learning experience here at DLSU.",0,0,0,0,0,1,0
"Today was quite a rollercoaster! Dealing with group projects proved to be more challenging than I anticipated. Coordinating schedules, brainstorming ideas, and dividing tasks seemed like an uphill battle. Everyone had different priorities, and it was difficult to find common ground. Despite the frustrations, we managed to find a way to work together, pushing through the hurdles. Although it tested my patience, I realized that overcoming these challenges ultimately strengthened our bond and taught us the importance of effective communication and compromise.",0,0,0,0,0,1,0
"Today was another typical day at DLSU, filled with the usual challenges in managing group projects. Coordinating with my teammates proved to be a hassle, as conflicting schedules and miscommunication hindered our progress. Additionally, finding a suitable meeting place on campus was no easy task. Despite these hurdles, we persevered and managed to complete our project successfully. It was a valuable learning experience, teaching me the importance of effective communication and adaptability in a team setting.",0,0,0,0,0,1,0
"Today was a typical day as an undergrad at DLSU, filled with the usual daily hassles. One of the biggest challenges I faced was managing group projects. Coordinating with teammates, finding a common meeting time, and ensuring everyone contributed equally was quite a hassle. It felt like herding cats at times, but we managed to pull through. Despite the challenges, I learned valuable teamwork and communication skills that will undoubtedly benefit me in the future.",0,0,0,0,0,1,0
"Today was quite a challenging day at DLSU. My group project seemed to be never-ending, with conflicting schedules and differing opinions. Managing everyone's expectations and finding a common ground was a constant struggle. However, we pushed through and successfully completed our task, learning valuable lessons in teamwork and compromise along the way. Despite the hassles, it's moments like these that make me appreciate the growth and resilience that university life brings.",0,0,0,0,0,1,0
"Today was a typical day at DLSU, filled with the usual hustle and bustle. One of the challenges I faced was managing group projects. Coordinating with my teammates, finding a common schedule, and dividing tasks proved to be quite a hassle. Despite the initial struggle, we eventually found our rhythm and worked together efficiently. It's moments like these that remind me of the importance of communication and teamwork, skills that will undoubtedly serve me well in the future.",0,0,0,0,0,1,0
"Today was a typical day as an undergraduate student at DLSU, filled with the usual daily hassles. One of the challenges I faced was managing group projects. Coordinating schedules, dealing with conflicting ideas, and ensuring everyone contributed equally proved to be quite a task. However, we managed to overcome these challenges through effective communication and compromise. Although group projects may be demanding, they also provide valuable opportunities for growth and collaboration.",0,0,0,0,0,1,0
"Today was a challenging day at DLSU. I had to deal with the usual hassle of managing group projects. Coordinating with my teammates, finding a common time to meet, and assigning tasks turned out to be quite a struggle. It seemed like everyone had their own priorities and schedules. Despite the difficulties, we managed to overcome the obstacles and complete our project successfully. These group projects are definitely a test of patience and teamwork, but they also teach valuable skills that will be useful in the future.",0,0,0,0,0,1,0
"Today was another challenging day at DLSU as I tackled the never-ending struggle of managing group projects. Coordinating with my teammates, finding time to meet, and dividing tasks proved to be a hassle. It seemed like we were always on different pages, making progress slow and frustrating. However, despite the difficulties, we managed to push through and accomplish our goals. These challenges may be exhausting, but they also teach us valuable lessons in teamwork and perseverance.",0,0,0,0,0,1,0
"Today was another challenging day at DLSU. Group projects have always been a hassle, with different schedules and conflicting ideas. It's frustrating trying to coordinate everyone's efforts and keep the project on track. There's always that one person who doesn't contribute or constantly misses meetings. It's a constant battle to motivate and manage the team. Despite the challenges, we keep pushing forward, realizing that these group projects are preparing us for the real world, where teamwork is essential.",0,0,0,0,0,1,0
"Today was another challenging day at DLSU. Managing group projects has become a constant hassle. Coordinating with teammates who have different schedules and conflicting ideas is proving to be quite the task. It's frustrating when someone doesn't pull their weight, leaving the rest of us to pick up the slack. It's a constant battle to ensure everyone is on the same page and working towards the same goal. But despite the challenges, I'm determined to make the most out of these group projects and learn valuable teamwork skills along the way.",0,0,0,0,0,1,0
"Today was a typical day at DLSU, filled with the usual challenges in managing group projects. My teammates and I struggled to find a common meeting time due to conflicting schedules. Additionally, coordinating everyone's contributions became problematic as some members failed to meet deadlines. Despite these hurdles, we persevered and successfully completed our project, learning valuable lessons in teamwork and time management along the way. It was a tough day, but definitely a rewarding one.",0,0,0,0,0,1,0
"Today was another challenging day as an undergraduate student at DLSU. Group projects have become a daily hassle, as managing different personalities and schedules is not an easy task. It's frustrating when some members are not as committed or don't contribute equally. However, I believe these challenges are opportunities for personal growth and development. Despite the difficulties, I am determined to navigate through these group projects and learn valuable lessons in teamwork and time management.",0,0,0,0,0,1,0
"Today was a typical day at DLSU, filled with the usual challenges in managing group projects. We had a meeting to discuss our progress, but it was difficult to coordinate everyone's schedules. Once we finally gathered, there were disagreements on the direction of our project, causing tension within the group. We also faced the common issue of some members not pulling their weight, leaving the burden on the rest of us. Despite these hassles, we managed to find a compromise and make progress. Group projects can be a hassle, but with determination and teamwork, we can overcome any challenge.",0,0,0,0,0,1,0
"Today was quite a rollercoaster! My day started with a group meeting for a project, and boy, managing group projects is no cakewalk. Trying to align everyone's schedules and ideas was a challenge in itself. Different work ethics and conflicting opinions made it difficult to move forward smoothly. However, after some intense discussions and compromise, we finally managed to find a middle ground. It's moments like these that remind me of the importance of effective communication and teamwork in overcoming daily hassles.",0,0,0,0,0,1,0
"Today was quite a hectic day at DLSU. Dealing with the challenges of managing group projects has been a constant hassle. Coordinating schedules, finding common ground, and ensuring equal contribution from team members are just a few of the hurdles I faced. It felt like a juggling act, trying to keep everyone on track and motivated. However, despite the occasional frustrations, seeing the final outcome and the team's growth made it all worthwhile.",0,0,0,0,0,1,0
"Today was another typical day as an undergraduate student at DLSU. One of the daily hassles I encountered was the challenges in managing group projects. It seemed like pulling everyone together and ensuring everyone's commitment to the task was a never-ending battle. Coordinating schedules, dividing tasks, and dealing with varying levels of dedication proved to be quite a headache. Nonetheless, we persevered and managed to make some progress, reminding me that teamwork truly requires patience, compromise, and effective communication.",0,0,0,0,0,1,0
"Today was quite a hassle as my group project hit a roadblock. Managing group projects is always challenging, especially when coordinating with different schedules and personalities. We had trouble finding a common meeting time, which led to delays in our progress. Additionally, there were disagreements on how to approach certain tasks, causing tension within the group. Despite these challenges, we managed to find a compromise and push through together. It's days like these that remind me of the importance of effective communication and teamwork in accomplishing our goals.",0,0,0,0,0,1,0
"I woke up this morning feeling overwhelmed by the challenges in managing group projects. It's always a struggle to find a time that works for everyone's schedules, and coordinating tasks is like herding cats. Today, we had a meeting scheduled, but half the group didn't show up, leaving us frustrated and behind schedule. Despite the setbacks, we pushed through, dividing the workload and communicating online. It's exhausting, but we're learning valuable lessons in teamwork and time management. As an undergraduate student from DLSU, these group project hassles are a constant reminder of the real-world challenges we'll face in our future careers.",0,0,0,0,0,1,0
"As an undergrad student from DLSU, group projects have become one of the daily hassles I encounter. Juggling different schedules, coordinating tasks, and ensuring equal contributions from each member can be quite challenging. It often feels like herding cats, as everyone has their own ideas and opinions. However, despite the occasional conflicts and setbacks, these challenges have taught me valuable lessons in teamwork, patience, and compromise. Ultimately, overcoming these hurdles leads to a stronger bond within the group and a sense of accomplishment when we successfully complete our projects.",0,0,0,0,0,1,0
"Today was quite a hassle at DLSU. Managing group projects turned out to be more challenging than I anticipated. Coordinating schedules and finding a common meeting time was like herding cats. Some group members seemed to disappear into thin air, making it difficult to delegate tasks. But despite the frustrations, we managed to come together and produce a decent outcome. It's days like these that remind me of the importance of patience and flexibility in group work.",0,0,0,0,0,1,0
"Today was quite a hectic day at DLSU. As an undergraduate student, one of the daily hassles that I encountered was the challenges in managing group projects. Trying to coordinate everyone's schedules and finding a common meeting time proved to be quite a task. Additionally, ensuring that everyone was equally contributing and meeting deadlines was another challenge. However, despite these obstacles, we managed to pull through and complete our project successfully. It was definitely a learning experience in teamwork and communication.",0,0,0,0,0,1,0
"Today was quite a challenging day at DLSU. Managing group projects is always a hassle, especially when everyone has different schedules and commitments. Coordinating meetings and finding a common time for discussions was a struggle. Additionally, some group members lacked dedication and effort, making it difficult to achieve our shared goals. Despite these challenges, we pushed through and managed to complete our tasks. It's a constant battle, but we learn valuable lessons about teamwork and perseverance along the way.",0,0,0,0,0,1,0
"Today was quite a rollercoaster ride. Managing group projects has always been a challenge, but today took it to a whole new level. Coordinating schedules, dealing with conflicting ideas, and ensuring everyone stays on track seemed like an uphill battle. However, despite the frustrations, we managed to find common ground and work together towards our goal. It may have been a hassle, but it taught me the importance of effective communication and compromise.",0,0,0,0,0,1,0
"Today was another challenging day in managing group projects. It seemed like everyone had their own ideas and it was difficult to find a common ground. Communication was a struggle as well, with members not responding to messages or not showing up for meetings. It was frustrating trying to coordinate everyone's schedules and make progress. Despite the hassles, we managed to push through and accomplish some tasks. Tomorrow is a new day, hopefully with fewer obstacles in our path.",0,0,0,0,0,1,0
"Today was another typical day as an undergraduate student at DLSU. I woke up early, bracing myself for the challenges in managing group projects. Coordinating with my team members, finding a common schedule, and dividing tasks proved to be quite a hassle. However, we managed to overcome these hurdles through effective communication and compromise. It wasn't an easy feat, but with determination and teamwork, we successfully completed our project. Despite the daily hassles, I am grateful for the valuable lessons learned and the resilience developed through these experiences.",0,0,0,0,0,1,0
"So, picture this: I wake up to the sound of my alarm blaring, realizing that I overslept again. In a state of panic, I hastily get dressed and grab my backpack, rushing out the door. As I sprint towards the university, my heart races, knowing that I'm going to be late for class. Dodging people along the way, I finally arrive at the lecture hall, panting and disheveled. Sneaking in quietly, I take a seat at the back, hoping the professor won't notice my tardiness. Another day, another hassle, but at least I made it.",0,0,0,0,0,0,1
"So, like, today was one of those days where I just couldn't catch a break. I woke up late and ended up getting stuck in traffic, making me late for my morning class. Ugh, the struggle is real. I rushed into the classroom, feeling all flustered and embarrassed, while the professor gave me that disappointed look. I hate that feeling of being the last one to arrive. But hey, at least I made it, right? I just hope this day gets better from here on out.",0,0,0,0,0,0,1
"Rushing through the bustling streets of Manila, I found myself caught in the daily hassle of getting late to class. As I sprinted towards the university gates, my heart pounded in my chest, fearing the consequences of tardiness. Sweat dripped down my forehead, my mind racing with thoughts of missed lectures and disappointed professors. Finally reaching the classroom, I slipped into my seat, gasping for breath, hoping to blend in unnoticed. Lesson learned: never underestimate the notorious Manila traffic when planning my daily commute.",0,0,0,0,0,0,1
"I woke up to a blaring alarm, realizing I had overslept yet again. Panic rushed through me as I scrambled to get ready for class. My heart raced as I hurriedly brushed my teeth and threw on some clothes. As I rushed out the door, I cursed my bad luck, knowing that being late to class meant missing important discussions and risking my grade. With each passing minute, my anxiety grew, and I vowed to set multiple alarms from now on to avoid this daily hassle.",0,0,0,0,0,0,1
"Today was such a whirlwind! I woke up late and rushed to get ready for class. As luck would have it, the MRT broke down just as I reached the station. Frantically, I hailed a cab, but the traffic seemed insurmountable. Finally, I arrived at DLSU, panting and disheveled, only to find out that my professor had already started the lecture. Lesson learned: never underestimate the traffic in Manila.",0,0,0,0,0,0,1
"I woke up with a jolt, realizing that I had overslept. Panic surged through me as I rushed to get ready for class. My heart raced as I sprinted across campus, hoping to make it in time. Unfortunately, the universe seemed to conspire against me; the elevator was painfully slow, and the traffic was unbearable. Breathless and disheveled, I entered the classroom, catching the disapproving glances of my professor and the smirks of my punctual classmates. It was yet another day of getting late to class, a hassle that seemed to haunt me relentlessly.",0,0,0,0,0,0,1
"As an undergrad at DLSU, my day started off with the all too familiar hassle of getting late to class. Despite setting multiple alarms, I somehow managed to oversleep. Rushing through my morning routine, I dashed out the door in a frenzy, praying that I wouldn't miss the lecture. Dodging other students along the way, I reached the classroom just in the nick of time, panting and disheveled. Lesson learned, I vowed to be more diligent in managing my time to avoid this daily hassle in the future.",0,0,0,0,0,0,1
"I woke up in a frenzy, realizing I overslept. Rushing through my morning routine, I hastily grabbed my books and dashed out the door. As I sprinted towards the university, my heart pounded with anxiety. Dodging students along the way, I finally arrived at class, breathless and disheveled. My professor gave me a stern look, but I sighed in relief. Despite the hassle of being late, I made it just in time.",0,0,0,0,0,0,1
"Man, today was a total mess! I woke up late and ended up getting late to class. Rushing through the crowded streets, I couldn't catch a break. Traffic was insane, and the MRT was packed like sardines. Finally, I reached the campus, but my classroom was on the sixth floor, and the elevator decided to take its sweet time. Sprinting up the stairs, I stumbled into class, panting and completely out of breath. Late again, but hey, at least I made it!",0,0,0,0,0,0,1
"So there I was, rushing through the crowded hallways of DLSU, my heart racing as I realized I was running late for my morning class. Dodging students left and right, I sprinted up the stairs, hoping to make it on time. Panting and slightly disheveled, I burst into the classroom just as the professor was about to start. As I collapsed into my seat, I silently cursed the traffic that had caused this daily hassle. Another day, another battle against time at DLSU.",0,0,0,0,0,0,1
"Man, today was a complete disaster! I woke up late and ended up getting late for my morning class. Rushing through the crowded streets, I struggled to catch the bus, only to find it packed like sardines. Finally, I arrived at the university, panting and disheveled, only to realize that my class had already started. I sheepishly sneaked into the lecture hall, hoping to go unnoticed. What a way to start the day!",0,0,0,0,0,0,1
"So, there I was, rushing through the crowded streets of Manila, trying to make it to my morning class on time. As luck would have it, the usually dependable jeepney I boarded decided to break down right in the middle of heavy traffic. Frustrated and anxious, I decided to take matters into my own hands and hopped off the vehicle. Sprinting through the bustling streets, dodging pedestrians left and right, I finally arrived at the lecture hall, panting and disheveled, just as the professor began his lecture. Lesson learned: always leave earlier to avoid the daily hassle of getting late to class.",0,0,0,0,0,0,1
"Today was quite hectic for me. As usual, I got caught up in the morning rush and ended up getting late to class. It seemed like the whole world conspired against me, from the never-ending traffic to the crowded train. I sprinted through the corridors, hoping to make it on time, my heart pounding. Finally, I reached my classroom, panting and disheveled, only to be greeted by the professor's stern gaze. It was definitely not the ideal way to start the day, but I managed to catch my breath and dive into the lesson.",0,0,0,0,0,0,1
"Today was a total disaster. I woke up late, feeling like I had just been hit by a train. Rushing to get ready, I stubbed my toe on the edge of my bed. As if that wasn't enough, I missed my usual bus and had to endure the notorious Manila traffic. By the time I reached the classroom, my professor was already halfway through the lecture. I slumped into my seat, feeling defeated. Getting late to class is definitely not the best way to start the day.",0,0,0,0,0,0,1
"So, here's how my day went: I woke up feeling groggy, realizing I had overslept and was running late for my first class. Frantically, I threw on some clothes and rushed out the door, but of course, I couldn't catch a jeepney for what felt like ages. Finally, one came, but traffic was horrendous. I anxiously watched the clock ticking away, knowing I was going to be late. As I rushed into the classroom, breathless and flustered, my professor gave me a disapproving look. It was not the best start to the day, but hey, at least I made it to class eventually.",0,0,0,0,0,0,1
"Today was a typical day at DLSU, but it started off with a small hiccup. I found myself getting late to class due to the heavy traffic on the way. As I rushed through the hallways, my heart raced, fearing that I might miss out on important discussions. However, I managed to sneak into the classroom just in time, slightly out of breath but relieved. Lesson learned: always leave a few minutes earlier to avoid the daily hassle of being late.",0,0,0,0,0,0,1
"Oh man, today was such a mess! I woke up late and ended up getting late to class. Rushing through the crowded streets, I sprinted towards the university, hoping to make it in time. The elevator took ages, and I finally reached my classroom, only to find the professor had already started the lecture. Sliding into my seat, I couldn't help but feel flustered and embarrassed. Lesson learned: never hit the snooze button again!",0,0,0,0,0,0,1
"So, today was just one of those days where everything seemed to go wrong. I woke up late, scrambling to get ready for class. Running through the crowded streets, I could feel my heart racing, knowing that I was going to be late. As I reached the classroom, catching my breath, I sneaked in hoping not to disturb the professor. It was a hassle to start the day in such a rush, but hey, at least I made it to class.",0,0,0,0,0,0,1
