Narrative,Concerns about medical treatment,Physical illness,Side effects of medication,Concerns about health in general,Concerns about bodily functions
"So, today was quite a hassle. I woke up with concerns about my medical treatment. You see, I've been dealing with a nagging injury for a while now, and it's been affecting my daily activities. I spent the morning trying to get an appointment with my doctor, but their schedule was fully booked. Frustrated, I decided to seek a second opinion. Hopefully, I can find a solution soon because this injury is really starting to impact my studies and overall well-being.",1,0,0,0,0
"So, today was a pretty typical day for me as an undergraduate student at DLSU. I woke up with concerns about my medical treatment, as I've been dealing with a nagging health issue lately. It's been a hassle trying to schedule appointments with doctors and find the right treatment plan. Throughout the day, I found myself distracted by worries about my health, making it a bit harder to focus on my studies. But, despite these daily hassles, I managed to make it through the day and get some work done.",1,0,0,0,0
"Today started off with concerns about my medical treatment. I had been experiencing persistent headaches, and the medication prescribed by my doctor didn't seem to be working. This made me worry about the underlying cause of my pain. I decided to reach out to my doctor again to discuss alternative treatments or seek a second opinion. Dealing with health issues while managing my studies can be quite challenging, but I'm determined to prioritize my well-being.",1,0,0,0,0
"Today, as I went about my day as an undergraduate student at DLSU, I couldn't help but worry about my medical treatment. The constant concern about my health and the uncertainty of my condition weighed heavily on my mind. It became a hassle to focus on my studies as I constantly questioned whether I was doing enough to take care of myself. Despite the daily hassles, I managed to push through and find solace in the support of my friends and the comforting atmosphere of the university.",1,0,0,0,0
"Today was a typical day at DLSU, filled with lectures and assignments. However, my mind was preoccupied with concerns about my medical treatment. I couldn't help but worry about the upcoming doctor's appointment and the possible side effects of the prescribed medication. It was challenging to concentrate on my studies, but I reminded myself to stay positive and trust the medical professionals. Despite these worries, I managed to get through the day, hoping for a positive outcome in my health journey.",1,0,0,0,0
"Today was quite a stressful day for me. I woke up with concerns about my ongoing medical treatment. The medication I have been prescribed doesn't seem to be working, and I'm worried about the side effects it may have. I spent a large part of the day researching alternative treatments and seeking advice from friends and family. It's frustrating to navigate through this medical journey, but I'm determined to find a solution that works for me.",1,0,0,0,0
"Today was a pretty hectic day at DLSU. Between rushing to class, completing assignments, and catching up with friends, I couldn't help but worry about my medical treatment. It's been a constant concern lately, as I'm unsure if I'm on the right track. However, I managed to push those worries aside and focus on my tasks for the day. Although it was a struggle, I reminded myself that I am capable of handling these daily hassles and that worrying won't solve anything.",1,0,0,0,0
"So, today was quite a hassle. I've been dealing with concerns about my medical treatment. It's been a constant worry on my mind, as I've been experiencing some health issues lately. I've been juggling between attending classes and scheduling doctor's appointments, trying to find a diagnosis and the right course of action. It's been exhausting and stressful, constantly feeling uncertain about my health. But I'm determined to find a solution and not let it hinder my studies. Fingers crossed for a better day tomorrow.",1,0,0,0,0
"Today was quite challenging as I dealt with concerns about my medical treatment. I had been experiencing persistent headaches, and it was worrying me. I decided to visit the school clinic, but they couldn't provide a proper diagnosis. Frustrated, I scheduled an appointment with a specialist outside of campus. The wait was long, and the medical fees were a burden, making me question if it was the right decision. Nonetheless, I made a vow to prioritize my health and hope for a positive outcome.",1,0,0,0,0
"So, today has been quite a hectic day for me. Apart from the usual hustle and bustle of being an undergraduate student at DLSU, I've been dealing with concerns about my medical treatment. It's been a constant worry in the back of my mind, making it challenging to focus on my studies. However, I've managed to push through, seeking support from friends and family along the way. Despite the daily hassles, I remain determined to excel academically and prioritize my health.",1,0,0,0,0
"So, today was quite a hassle-filled day for me. Amidst the piles of assignments and exams, I couldn't help but worry about my medical treatment. The uncertainty and concerns about my health kept lingering in my mind throughout the day, distracting me from focusing on my studies. It's frustrating when something as essential as your well-being becomes an additional stressor in your already hectic student life. But hey, I guess that's just the reality of being an undergraduate student at DLSU.",1,0,0,0,0
"Today was quite a hectic day for me. Aside from the usual hustle and bustle of being an undergraduate student at DLSU, I couldn't help but feel concerned about my ongoing medical treatment. Thoughts about appointments, medication, and test results were constantly running through my mind, making it challenging to concentrate on my studies. However, I reminded myself to take it one step at a time and stay positive, knowing that I have a support system that will guide me through this journey.",1,0,0,0,0
"Today started off with concerns about my medical treatment. I've been dealing with a persistent cough for a while now, and it's been affecting my daily activities. I scheduled an appointment with the university clinic to get it checked. However, the long wait time and the uncertainty about the diagnosis added to my worries. I couldn't focus on my classes, constantly worrying about my health. Hopefully, the doctor's visit will provide some clarity and a solution to my ongoing medical issue.",1,0,0,0,0
"Today has been quite a hassle. I woke up with concerns about my medical treatment. The doctor prescribed me some medications, but they seem to be causing more harm than good. I decided to reach out to a friend studying medicine for advice. Thankfully, she was able to offer some helpful insights and recommended that I consult another doctor for a second opinion. It's a relief to know that I have someone to turn to in times like this.",1,0,0,0,0
"So, today was quite a rollercoaster. I woke up with concerns about my medical treatment. I've been experiencing some persistent headaches lately and it's starting to worry me. After class, I decided to finally visit the university clinic to get checked. The long waiting time and the uncertainty of what the doctor might say added to my stress. Thankfully, the doctor assured me that it was just stress-related and prescribed some medication. It's a relief to know that it's nothing serious, but I still can't help but worry. Guess I'll have to take it easy and prioritize self-care from now on.",1,0,0,0,0
"Today was quite a hassle-filled day for me. In addition to my usual hectic schedule as an undergraduate student at DLSU, I had concerns about my medical treatment. I had to rush to the clinic to get my prescription refilled, but the long waiting time tested my patience. Moreover, I had to deal with the frustration of navigating through the confusing healthcare system. Despite these daily hassles, I managed to stay positive and focused on my studies.",1,0,0,0,0
"Today was quite a challenging day. I woke up with concerns about my medical treatment. I've been experiencing some unusual symptoms lately, and it's been bothering me. I couldn't focus on my classes as I constantly worried about my health. It's frustrating not having clear answers and feeling helpless. Hopefully, I'll be able to schedule a doctor's appointment soon to address these concerns and find some peace of mind.",1,0,0,0,0
"Today was a rollercoaster of emotions. I woke up with concerns about my medical treatment, unsure if I was on the right path to recovery. The constant worry weighed heavily on my mind throughout the day, making it difficult to focus on my studies. I reached out to my family and friends for support, seeking their guidance and reassurance. Despite the hassle, I remained determined to overcome this hurdle and not let it hinder my progress as an undergraduate student at DLSU.",1,0,0,0,0
"So today started off with concerns about my medical treatment. I had an appointment at the university clinic for a follow-up on my medication, but the line was ridiculously long. I ended up waiting for almost two hours just to see the doctor. It was frustrating, especially since I had other things to do. However, the doctor was kind and understanding, which made the hassle a little more bearable. Despite the inconvenience, I'm grateful for the quality healthcare provided on campus.",1,0,0,0,0
"Today was a pretty hectic day at DLSU. Amidst the hustle and bustle, I couldn't help but worry about my upcoming medical treatment. Thoughts about the procedure and its potential outcomes consumed my mind, making it difficult to focus on my classes. I reached out to my friends for support, and their comforting words helped ease my concerns, reminding me that everything would be alright. Though the day had its hassles, their unwavering support provided me with the strength to face my medical journey with courage and optimism.",1,0,0,0,0
"Today was such a stressful day. I woke up with concerns about my medical treatment. I've been experiencing some health issues lately, and the uncertainty about the diagnosis has been weighing on my mind. I spent the whole morning researching and reading about possible causes and treatment options. It's frustrating not having all the answers, but I'm determined to find a solution. Hopefully, I can get some clarity soon and find the right treatment to alleviate my worries.",1,0,0,0,0
"Today was a typical day at DLSU, filled with the usual hustle and bustle. However, amidst the chaos, I couldn't help but worry about my ongoing medical treatment. Thoughts of doctors' appointments, medication schedules, and potential side effects constantly plagued my mind. It's difficult to focus on studies when concerns about my health loom in the background. Nevertheless, I push through, reminding myself that education is my ticket to a brighter future, regardless of these daily hassles.",1,0,0,0,0
"So, today was quite a hassle. I woke up with concerns about my medical treatment. The prescribed medication doesn't seem to be working, and I'm worried about the side effects it might have. I spent the morning researching alternative treatments and consulting with my doctor. The uncertainty and frustration of not finding a solution right away made my day quite stressful. Hoping for a better outcome tomorrow. Fingers crossed!",1,0,0,0,0
"Today was quite a stressful day for me. Apart from the usual academic load, I found myself constantly worrying about my medical treatment. Dealing with the uncertainty of my condition and the effectiveness of the prescribed medication has been overwhelming. It's hard to focus on my studies when my health is constantly on my mind. I hope I can find some peace of mind soon and get back to enjoying my college life without these concerns lingering in the back of my head.",1,0,0,0,0
"So, today started off with concerns about my medical treatment. I've been dealing with this nagging pain for a while now, and it's been affecting my daily activities. I finally decided to seek professional help, but the thought of medical procedures and potential side effects is making me anxious. Despite my worries, I gathered the courage to visit the doctor and discuss my concerns. The doctor was understanding and reassured me that we would find the best solution together. It might not have been the easiest start to the day, but taking that step towards better health was definitely worth it.",1,0,0,0,0
"Today was quite a hectic day at DLSU. Between attending classes, studying for exams, and completing assignments, I couldn't help but worry about my medical treatment. The lingering concerns about my health kept distracting me throughout the day, making it difficult to focus. It's frustrating to deal with these worries while trying to keep up with my academic responsibilities. I hope I can find some peace of mind soon and focus on my studies without any interruptions.",1,0,0,0,0
"Today was a rollercoaster of emotions. I woke up with concerns about my medical treatment, wondering if it's really helping me or if I should explore other options. Despite the cloud of worry hanging over me, I managed to push through the day. From attending classes and completing assignments to meeting up with friends, I found solace in their company. Although my concerns still lingered, distracting myself with the hustle and bustle of university life provided a temporary relief.",1,0,0,0,0
"Today was quite a hassle for me. I woke up with concerns about my ongoing medical treatment. The doctor's instructions seemed confusing, and I couldn't help but worry if I was doing everything right. I decided to call the clinic, but they couldn't provide immediate clarification. It left me feeling frustrated and anxious. I knew I had to find a way to address my concerns, maybe by seeking a second opinion or scheduling another appointment. Dealing with medical uncertainties can be overwhelming, but I'm determined to find a resolution and prioritize my well-being.",1,0,0,0,0
"Today was quite a stressful day for me. I've been dealing with concerns about my medical treatment. The doctor recommended a new medication, but I can't help but worry about the potential side effects. It's been causing me a lot of anxiety and sleepless nights. I'm constantly researching and seeking second opinions, hoping to find some reassurance. It's just another hurdle I have to face as a student, but I'm determined to prioritize my health and find the best solution.",1,0,0,0,0
"Today was quite a hassle. I woke up with concerns about my medical treatment. The doctor's instructions were confusing, and I couldn't help but worry if I was doing everything right. I decided to call the clinic to clarify, but they put me on hold for what felt like ages. Finally, when I got through, the receptionist couldn't provide the answers I needed. Frustrated, I decided to seek a second opinion. Hopefully, I can find a healthcare professional who can address my concerns more clearly.",1,0,0,0,0
"Today started off with a terrible physical illness that left me feeling weak and nauseous. I had to drag myself out of bed and force myself to attend class. Throughout the day, I struggled to concentrate on my lectures and participate in discussions. The constant discomfort made it nearly impossible to focus on my studies. Despite my best efforts, the physical illness proved to be a significant hurdle in my day, making everything feel more challenging and exhausting.",0,1,0,0,0
"Today has been quite a challenging day for me as I woke up feeling under the weather. Battling a physical illness, I struggled to focus during my classes and complete my assignments. Despite my best efforts, fatigue and discomfort kept creeping in, making it difficult to concentrate. Thankfully, my professors were understanding and supportive, providing me with extensions and offering guidance. Despite the setback, I pushed through, reminding myself that my health should always come first.",0,1,0,0,0
"Today, as an undergraduate student at DLSU, my day was marred by the unwelcome visitor of physical illness. Waking up with a pounding headache and aching body, I dragged myself out of bed and trudged through the day. Despite the overwhelming fatigue, I pushed through classes, feeling like a zombie. The constant need to blow my nose and the irritating cough made it difficult to concentrate. I longed for the comfort of my bed, but the demands of academia kept me going. Physical illness may have slowed me down, but it didn't stop me from soldiering on.",0,1,0,0,0
"Today started off rough as I woke up feeling under the weather. Battling a physical illness made it challenging to focus during my classes, and I found myself struggling to keep up with the lecture. Throughout the day, I constantly had to deal with a runny nose, a pounding headache, and an overall feeling of fatigue. Despite the discomfort, I managed to push through and complete my assignments, but it was undoubtedly a hassle trying to function normally with my physical health taking a toll.",0,1,0,0,0
"Today started off rough as I woke up with a pounding headache and a stuffy nose. Despite feeling physically ill, I dragged myself to class, hoping to power through the day. However, my energy levels plummeted and my concentration waned. It was a constant struggle to pay attention and actively participate in discussions. Frustration settled in as I realized how much I was missing out on due to this physical setback. Nevertheless, I pushed through, reminding myself that tomorrow is a new day and that my health will improve with time.",0,1,0,0,0
"Today started off rough as I woke up with a pounding headache and a scratchy throat. Battling physical illness, I dragged myself to class, trying to keep up with the lectures through my foggy mind. The constant sniffling and sneezing made it hard to concentrate, and all I wanted was to crawl back into bed. Despite feeling under the weather, I pushed through the day, reminding myself that this too shall pass.",0,1,0,0,0
"Today was a tough day for me. I woke up feeling under the weather, with a pounding headache and a stuffy nose. It was hard to focus on my classes as my physical illness kept distracting me. Despite my best efforts to stay engaged and take notes, the constant need to blow my nose and the throbbing pain in my head made it challenging. I'm grateful for the understanding of my professors, who allowed me to take it easy and catch up on missed lectures later.",0,1,0,0,0
"Today started off rough. I woke up with a pounding headache and a stuffy nose, feeling completely under the weather. Dragging myself to class was a challenge, as every step felt like a marathon. Concentrating in lectures seemed impossible with my throbbing head. I pushed through, trying to keep up with my classmates, but my physical illness persisted. The day felt long and exhausting, with each task becoming a mountain to climb. All I could think about was crawling into bed and getting some much-needed rest.",0,1,0,0,0
"Today has been quite a challenging day for me. I woke up feeling under the weather, battling a stubborn cold. Despite my physical illness, I mustered up the energy to attend my classes at DLSU. Navigating through the bustling campus with a constantly runny nose was no easy task, but I pushed through. Thankfully, my friends were understanding and offered their support. Despite the discomfort, I managed to make it through the day and even complete my assignments. Despite the physical setback, I'm determined to not let this illness hinder my academic pursuits.",0,1,0,0,0
"Today started off as a typical day at DLSU, but unfortunately, I woke up feeling physically ill. I dragged myself to class, trying to focus on the lecture while battling a pounding headache and a runny nose. It was a struggle to concentrate and actively participate in discussions. After class, I decided to seek medical attention at the university clinic. The doctor prescribed medication and advised rest. Despite feeling unwell, I pushed through the day, reminding myself that it's just a temporary setback. I'm grateful for the support of my friends and professors who understood my situation and offered their help.",0,1,0,0,0
"Today was not my day. I woke up feeling completely under the weather, battling a physical illness. Every step felt like a struggle, and my body was aching all over. Despite my best efforts to push through, I had to admit defeat and miss my morning classes. It was frustrating to have my plans derailed by my own body, but I knew that taking care of my health was a priority. Hoping for a speedy recovery, I spent the rest of the day resting and nursing myself back to health.",0,1,0,0,0
"Today started off rough as I woke up with a pounding headache and a sore throat. Dragging myself to class, I struggled to concentrate and participate in discussions. The physical illness made it hard to keep up with the fast-paced lectures, and I felt drained of energy. Despite my best efforts, I couldn't escape the discomfort, but I pushed through the day, hoping for a speedy recovery.",0,1,0,0,0
"Today was not my lucky day. I woke up feeling awful, my head pounding and my body aching. It was definitely not the best way to start the day. Dragging myself out of bed, I mustered enough energy to attend my morning classes. My physical illness made it hard to concentrate and participate in class discussions. I couldn't wait for the day to be over so I could finally crawl back into bed and rest.",0,1,0,0,0
"Today started off rough as I woke up feeling under the weather. Battling a nasty physical illness, I dragged myself to class, my body protesting with every step. Concentrating on lectures became an arduous task as my pounding headache and incessant cough took center stage. Despite my best efforts, my energy levels plummeted, forcing me to retreat to my bed earlier than usual. Today's hurdle reminded me of the importance of self-care and the need to prioritize my health above all else.",0,1,0,0,0
"Today started off rough as I woke up feeling under the weather. It seems like a nasty bug decided to pay me a visit. Dragging myself to class was a struggle, as my body felt weak and my head was pounding. Concentrating on lectures felt nearly impossible. Thankfully, my understanding professors allowed me to leave early. Resting in bed, sipping on warm tea, and hoping for a speedy recovery became my main agenda for the day. Physical illness may have disrupted my plans, but I remain hopeful for a healthier tomorrow.",0,1,0,0,0
"Today was a tough day for me as I woke up feeling under the weather, battling a physical illness. Despite my body feeling weak, I pushed myself to attend classes at DLSU. It was a constant struggle to concentrate with a pounding headache and a stuffy nose. However, I persevered and managed to make it through the day, determined to not let this setback hinder my studies. Although physically drained, my determination to succeed remained unwavering.",0,1,0,0,0
"It was just another ordinary day at DLSU until an unexpected physical illness struck. As I rushed to my morning class, a sudden wave of dizziness and nausea overwhelmed me. The hustle and bustle of the university suddenly became a blur as I struggled to make sense of my surroundings. With a heavy heart, I had to make the tough decision of skipping classes and seeking medical attention, disrupting my carefully planned day. It was a stark reminder that even amidst the daily grind of being a student, our bodies could remind us of their vulnerability.",0,1,0,0,0
"Today was a tough day for me. I woke up feeling under the weather, battling a physical illness that left me weak and exhausted. Dragging myself out of bed, I struggled to focus on my classes, constantly battling a pounding headache and a persistent cough. Despite my best efforts, I couldn't shake off the discomfort that accompanied me throughout the day. It was a constant reminder that sometimes, life throws unexpected hurdles our way, making it difficult to fully embrace the day's challenges.",0,1,0,0,0
"Today started off on a rough note as I woke up feeling under the weather. Battling a physical illness, I dragged myself to class, trying my best to stay focused despite the pounding headache and constant sniffles. It was a struggle to stay engaged, but I pushed through, determined not to let sickness defeat me. As the day progressed, I longed for the comfort of my bed, hoping that rest would aid in my recovery. Physical illness may have slowed me down, but it didn't dampen my spirit to conquer the challenges that came my way.",0,1,0,0,0
"Today was a rough day for me. I woke up with a pounding headache and a sore throat, making it difficult to focus on my classes. I dragged myself through the day, constantly sniffling and coughing. It was frustrating to have my physical illness hinder my productivity and enjoyment. Despite my best efforts, I couldn't shake off the discomfort, which made me yearn for a speedy recovery.",0,1,0,0,0
"Today started off on a rough note as I woke up feeling under the weather. Battling a physical illness, I dragged myself to class, struggling to focus on the lectures. My head throbbed, making it difficult to comprehend the concepts being discussed. Even though I pushed through the day, my body constantly reminded me of its weakness. Despite the obstacles, I managed to complete my tasks, although not as efficiently as I would have liked. Hoping for a speedy recovery, I look forward to a healthier day tomorrow.",0,1,0,0,0
