"Today has been a rough day for me. I woke up feeling under the weather, battling a pounding headache and a fever. Dragging myself to class was a struggle, but I didn't want to miss any important lessons. Throughout the day, I found it difficult to concentrate, constantly feeling fatigued and sneezing uncontrollably. It's frustrating when physical illness interrupts my daily routine and hampers my ability to fully engage in my studies. I can only hope that tomorrow brings better health and a more productive day.",0,1,0,0,0
"Today was a rough day for me. I woke up feeling dreadful, battling a nasty physical illness. My head was pounding, my body ached, and I could barely muster the energy to get out of bed. Dragging myself to class was a challenge, and concentrating on the lectures seemed impossible. All I wanted was to crawl back under the covers and rest. Dealing with this physical illness was a major hassle, disrupting my day and leaving me longing for a quick recovery.",0,1,0,0,0
"Today was a tough day at DLSU. I woke up with a terrible headache and a runny nose, making it difficult to concentrate in class. I struggled to take notes, constantly sneezing and sniffling. The physical illness made it hard for me to fully engage in discussions and participate in group activities. Despite my discomfort, I pushed through the day, hoping to feel better soon. As I left campus, I couldn't help but long for a good night's sleep to recover from this pesky illness.",0,1,0,0,0
"Today started off rough as I woke up feeling under the weather. Battling a physical illness, I dragged myself to class, my body feeling heavy and my mind foggy. Concentrating on lectures became a struggle, and I couldn't help but feel frustrated with my weakened state. Despite the setback, I pushed through the day, determined to not let this physical ailment dampen my spirit. With each passing hour, I reminded myself that this too shall pass, eagerly awaiting the moment when I could finally rest and recover.",0,1,0,0,0
"Today was a challenging day as I battled physical illness. Waking up with a sore throat and a pounding headache, I dragged myself to class, my body feeling weak. Concentrating on lectures became an uphill battle, and I struggled to keep up with the pace. Despite feeling drained, I pushed through the day, determined not to let my illness hinder my progress. As the day wore on, my fatigue grew, making even the simplest tasks seem overwhelming. Nevertheless, I persevered, reminding myself that this too shall pass.",0,1,0,0,0
"Today started off rough. I woke up with a pounding headache and a stuffy nose, feeling absolutely terrible. Dragging myself out of bed, I mustered the strength to attend my morning classes. The physical illness made it difficult to concentrate, and I found myself struggling to keep up with the lecture. All I wanted was to crawl back into bed and rest, but I pushed through the day, hoping to recover soon.",0,1,0,0,0
"Today started off on a rough note as I woke up with a pounding headache and a stuffy nose. Despite feeling physically ill, I dragged myself to class, trying my best to pay attention to the lecture while battling the discomfort. The constant sneezing and fatigue made it difficult to concentrate. As the day progressed, I couldn't shake off the feeling of exhaustion, but I pushed through, determined to complete my tasks. It was a challenging day, but I'm proud of myself for not letting my physical illness hinder my productivity.",0,1,0,0,0
"Today has been quite a struggle for me. I woke up with a pounding headache and a sore throat, feeling physically ill. Dragging myself out of bed, I mustered enough energy to attend my morning classes. Concentration seemed impossible as my body ached with every movement. Despite my discomfort, I managed to push through the day, longing for the moment I could crawl back into bed. Physical illness truly can be a hassle, but I am determined to rest and recover, hoping for a better day tomorrow.",0,1,0,0,0
"Today was a rough day for me as I woke up feeling incredibly sick. My head was pounding, and my body felt weak. It was a struggle to even get out of bed, but I had classes to attend. Throughout the day, I battled a constant cough and sneezing fits, making it difficult to concentrate in class. Despite feeling physically drained, I pushed through the day with determination, hoping that a good night's rest would help me recover.",0,1,0,0,0
"Today was a typical day for me at DLSU, but I couldn't escape the side effects of my medication. As I sat in class, trying to concentrate, the drowsiness hit me like a wave. I struggled to keep my eyes open, fighting to stay engaged in the lecture. Later, during lunch, I experienced a sudden bout of nausea, forcing me to skip my meal. It's frustrating to deal with these daily hassles, but I remind myself that it's a small price to pay for my health.",0,0,1,0,0
"So, I woke up this morning feeling groggy and slow, thanks to the side effects of the medication I've been taking for my allergies. As if that wasn't enough, throughout the day, I constantly struggled with a dry mouth and dizziness. It's frustrating because I'm finding it hard to concentrate on my lectures and participate in class discussions. But hey, it's just another day in the life of a student dealing with the pesky side effects of medication. Hopefully, these hassles will fade away soon, and I can focus on my studies without any hindrances.",0,0,1,0,0
"So, today started off with the annoying side effects of my medication. As soon as I woke up, I felt groggy and had a pounding headache. I struggled to focus during my morning classes, constantly battling drowsiness. To make matters worse, I experienced nausea and an upset stomach during lunch, which made it impossible to enjoy my meal. Despite these daily hassles, I managed to push through the day, relying on sheer determination and a strong cup of coffee to keep me going.",0,0,1,0,0
"So, today started off with the usual hustle and bustle of a typical day at DLSU. But as I sat in class, I couldn't help but feel the side effects of my medication kicking in. The drowsiness hit me like a ton of bricks, making it a struggle to stay focused. Despite my best efforts, I found myself dozing off, missing important parts of the lecture. It's frustrating dealing with these side effects, but I'm determined to push through and make the most out of my day.",0,0,1,0,0
"So, today started off with the usual hustle and bustle of being an undergrad at DLSU. However, the side effects of my medication decided to make their presence known. As I rushed to class, I couldn't help but feel a little drowsy and groggy. Trying to stay focused during lectures became a struggle, as I battled the foggy-headedness and occasional bouts of nausea. Despite these daily hassles, I managed to power through the day and make the most of my time on campus. Time management and a positive mindset truly became my allies amidst the side effects of my medication.",0,0,1,0,0
"So, today started off pretty rough. I woke up feeling groggy and tired due to the side effects of my medication. It's been giving me these headaches that won't seem to go away. I struggled to concentrate in class, feeling drowsy and finding it difficult to comprehend what the professor was saying. Even my friends noticed my lack of energy and enthusiasm. But hey, it's just one of those days, and I'm determined to power through it.",0,0,1,0,0
"Today has been quite a hassle-filled day for me. The side effects of my medication have really taken a toll on my energy levels. I felt drowsy and lethargic throughout the day, making it difficult to concentrate on my lectures and complete my assignments. It was frustrating to constantly battle fatigue and the urge to take a nap. Despite this setback, I managed to push through and get my work done, but I can't wait for these side effects to subside so I can regain my usual vigor and focus.",0,0,1,0,0
"Today was a rollercoaster ride. Dealing with the side effects of my medication was a hassle. It started with a pounding headache that refused to subside, making it hard to concentrate during my classes. On top of that, I battled with nausea, which made it difficult to enjoy my meals. Despite these challenges, I managed to push through the day, seeking solace in the company of understanding friends. Despite the daily hassles, I remain determined to overcome these side effects and continue my journey as a DLSU undergraduate student.",0,0,1,0,0
"So, today started off with a typical college morning rush. I popped my daily medication pill and rushed to catch the early morning shuttle to DLSU. As the day progressed, I couldn't help but notice the annoying side effects of my medication kicking in. The constant drowsiness made it hard to concentrate during lectures, and my dry mouth made it feel like I had swallowed a desert. Despite these daily hassles, I pushed through my classes, reminding myself that these side effects were just temporary inconveniences on my journey towards better health.",0,0,1,0,0
"So, today was just one of those days where the side effects of my medication decided to make an appearance. As I sat in class, trying to concentrate on the lecture, the drowsiness hit me like a ton of bricks. My eyelids felt heavy, and I struggled to keep them open. I couldn't help but yawn repeatedly, drawing strange looks from my classmates. It was a constant battle to stay awake and engaged throughout the day, but I managed to power through, determined not to let these pesky side effects ruin my academic journey.",0,0,1,0,0
"So, today was quite a rollercoaster. Woke up feeling groggy due to the side effects of my medication. Stumbled through my morning routine, trying to shake off the drowsiness. As the day progressed, I battled with a pounding headache and occasional nausea. Despite these setbacks, I soldiered on and attended my classes. It wasn't easy, but I managed to push through the day, constantly reminding myself that these side effects were temporary. Now, I'm looking forward to a restful night's sleep, hoping tomorrow will be a better day.",0,0,1,0,0
"Today was quite a challenging day for me. I had to deal with the side effects of my medication, which made me feel dizzy and nauseous throughout the day. Despite feeling under the weather, I managed to attend my classes and complete my assignments. It was tough to stay focused, but I pushed through. I am grateful for the support of my friends and the understanding of my professors. Although these side effects are a hassle, I know they are temporary, and I am determined to overcome them.",0,0,1,0,0
"Today has been quite a day for me. I woke up feeling groggy and exhausted due to the side effects of my medication. It's been a constant struggle to stay focused and alert throughout the day. Despite this setback, I managed to push through my classes and complete my assignments. It's frustrating dealing with these daily hassles, but I'm determined to keep going and not let them hold me back.",0,0,1,0,0
"Today was quite a hassle. I woke up feeling groggy and nauseous due to the side effects of my medication. It made it difficult to concentrate during class, and I struggled to stay awake. The constant drowsiness made it challenging to participate in discussions and take proper notes. Despite the inconvenience, I managed to push through the day, hoping these side effects would soon subside.",0,0,1,0,0
"Today was a challenging day as I dealt with the side effects of my medication. The drowsiness hit me hard during my morning lecture, making it difficult to stay focused. As I rushed to submit an assignment online, my hands trembled uncontrollably due to the medication's effects. Despite these hassles, I pushed through the day, relying on caffeine to combat the fatigue. It's tough dealing with these side effects, but I'm determined to manage them while pursuing my education.",0,0,1,0,0
"So, today was a rollercoaster ride of a day for me. Waking up groggy from the side effects of my medication, I stumbled through my morning routine. As I struggled to focus during lectures, the drowsiness persisted, making it a challenge to stay engaged. By the time I reached my evening class, the medication-induced dizziness kicked in, causing me to stumble while walking. Despite these daily hassles, I managed to power through the day, reminding myself that it's just a temporary inconvenience in my pursuit of a better health.",0,0,1,0,0
"Today was quite a hassle-filled day for me. I woke up feeling groggy due to the side effects of the medication I'm currently taking. It made it difficult for me to concentrate during my classes, and I had to constantly fight off drowsiness. On top of that, the medication also caused me to have a dry mouth, which was quite uncomfortable. Despite these hurdles, I managed to push through and complete my tasks for the day. I can't wait to finish this course of medication and get back to feeling like my usual self.",0,0,1,0,0
"So today was quite a hassle-filled day. I woke up feeling groggy and drowsy, thanks to the side effects of the medication I'm taking for my allergies. I stumbled through my morning routine, constantly battling a foggy mind. As I headed to class, I found myself struggling to concentrate, my head feeling heavy and my thoughts scattered. It was frustrating having to fight through this mental haze, but I pushed on, determined to make the most of my day despite the challenging side effects.",0,0,1,0,0
"So today started off with the usual rush to get ready for class. As I grabbed my medication, I couldn't help but dread the side effects that awaited me. Throughout the day, I battled the drowsiness and lack of focus caused by my medication. It was a constant struggle to stay alert during lectures and participate in discussions. Despite these daily hassles, I managed to push through and make the most of my day at DLSU.",0,0,1,0,0
"Today was a typical day at DLSU, filled with various challenges. Aside from juggling classes and extracurricular activities, I had to deal with the side effects of my medication. The drowsiness caused by it made it difficult to concentrate during lectures, and I found myself struggling to keep my eyes open. Despite this hurdle, I pushed through the day, relying on caffeine to stay awake. It wasn't easy, but I managed to get through my classes with determination and a bit of extra effort.",0,0,1,0,0
"So, today was quite a rollercoaster ride for me. As an undergraduate student from DLSU, I had my fair share of daily hassles. One of them being the side effects of my medication, which really took a toll on my day. I felt drowsy and sluggish throughout my classes, struggling to stay focused. It was frustrating as I couldn't fully engage in discussions or concentrate on my studies. However, I managed to push through with the support of my classmates and the determination to overcome these hurdles.",0,0,1,0,0
"Today was a challenging day as I grappled with the side effects of my medication. As I sat through lectures, the drowsiness kicked in, making it difficult to concentrate. I also experienced bouts of dizziness, which made navigating through crowded hallways a daunting task. Despite these hassles, I persevered, seeking solace in the support of my friends. Together, we laughed off the clumsiness and found ways to stay focused. Although the side effects may have hindered me, they didn't define my day. I powered through, determined to make the most of my undergraduate journey.",0,0,1,0,0
"So, like any typical day, I woke up groggy and lethargic due to the side effects of my medication. Dragging myself out of bed, I stumbled through the morning routine, struggling to stay focused in class. As the day progressed, the drowsiness persisted, making it difficult to concentrate on lectures and participate actively. Despite the constant battle with the medication's side effects, I managed to push through the day, eagerly anticipating a good night's rest to start afresh tomorrow.",0,0,1,0,0
"Today has been a rollercoaster of a day. Waking up, I immediately felt the side effects of my medication kicking in. The drowsiness made it difficult to focus during my morning classes. As the day went on, I battled through fatigue and a constant headache, trying to keep up with the demands of university life. Despite the challenges, I persevered, finding small moments of relief amidst the chaos. Although these side effects can be a hassle, I remind myself that they are a small price to pay for managing my health and pursuing my education.",0,0,1,0,0
"Today was a challenging day. Dealing with the side effects of medication felt like a never-ending battle. The drowsiness made it hard to focus in class, and the constant nausea made it difficult to enjoy my meals. Despite these daily hassles, I pushed through and managed to complete my assignments. As I lay in bed, I reminded myself that this journey towards better health will be worth it in the end.",0,0,1,0,0
"Today was quite a challenging day for me. As an undergraduate student at DLSU, I had to deal with the side effects of my medication. I felt drowsy and had difficulty concentrating during class, making it hard to actively participate. Despite these obstacles, I pushed through and managed to complete my assignments. It was a constant struggle to stay alert, but I reminded myself that it was just a temporary hurdle on my road to success.",0,0,1,0,0
"So, today was quite a rollercoaster ride. I woke up feeling groggy and drowsy due to the side effects of my medication. It took me forever to get out of bed and even longer to get ready for class. During the lectures, I struggled to stay awake and focused. I could feel my energy levels dropping rapidly. Despite my best efforts, I couldn't shake off the dizziness and nausea. Thankfully, I managed to survive the day with the support of my friends and a lot of determination. But man, do I miss the days when I didn't have to deal with these pesky side effects.",0,0,1,0,0
"Today was a rollercoaster ride for me. The side effects of my medication hit me like a ton of bricks. I felt drowsy and had difficulty concentrating during my morning classes. As if that wasn't enough, I experienced a sudden bout of nausea during lunchtime. Despite these hurdles, I managed to push through the day, constantly reminding myself that it's just a temporary phase. It's frustrating, but I know these side effects are a small price to pay for my overall well-being.",0,0,1,0,0
"Today was a rough day. The side effects of my medication kicked in, and I felt drowsy and dizzy throughout the day. It was hard to concentrate during class, and I even dozed off a couple of times. The constant headache added to my frustration, making it difficult to focus on my assignments. Despite these challenges, I pushed through, taking short breaks whenever needed. Hopefully, these side effects will subside soon, and I can get back to my usual routine without any hindrances.",0,0,1,0,0
"So, today started off with the usual hustle and bustle of a typical day at DLSU. However, the side effects of my medication decided to make an unexpected appearance. As I struggled to stay focused in class, a foggy haze clouded my mind, making it difficult to comprehend the lectures. Despite my best efforts, fatigue and drowsiness persisted throughout the day, causing me to yawn uncontrollably and struggle to keep my eyes open. It was undoubtedly a challenging day, but I managed to push through, counting down the hours until I could finally rest and let the side effects subside.",0,0,1,0,0
"Today was a typical day at DLSU, but my mind was clouded with concerns about my health. I couldn't shake off the worry about my stamina, especially with the mounting stress from exams and assignments. It felt like my body was running on empty, and I couldn't find the time to prioritize self-care amidst the hustle and bustle of university life. Despite the nagging concern, I pushed through the day, hoping to find a moment to address my health issues soon.",0,0,0,1,0
"Today has been quite a rollercoaster. Waking up with a sore throat and a pounding headache, concerns about my health started to consume my thoughts. Should I go to the clinic? Or tough it out and hope it goes away? As the day progressed, my worries intensified. Every cough and sniffle made me question if it was something more serious. Despite trying to focus on my classes, concerns about my overall health weighed heavily on my mind, making it difficult to concentrate. Hoping tomorrow brings some relief.",0,0,0,1,0
"Today started off with the usual hustle and bustle of being an undergraduate student at DLSU. As I rushed to my first class, concerns about my health lingered in the back of my mind. The stress of exams and assignments often takes a toll on my overall well-being. I made a mental note to take breaks and prioritize self-care throughout the day. Despite the daily hassles, I remained determined to overcome these obstacles and make the most out of my college experience.",0,0,0,1,0
"Today was a typical day filled with the usual hustle and bustle of university life. However, a constant concern about my health lingered in the back of my mind. As an undergraduate student, I often find myself neglecting self-care amidst the demands of academics and extracurricular activities. The lack of exercise and proper nutrition has taken a toll on my overall well-being. But, amidst all the daily hassles, I am determined to prioritize my health and find a balance between my responsibilities and taking care of myself.",0,0,0,1,0
"Today was quite a challenging day for me. As an undergraduate student from DLSU, I had my fair share of daily hassles, including concerns about health in general. Waking up with a scratchy throat, I couldn't help but worry about falling sick amidst the demanding workload. Throughout the day, I constantly reminded myself to stay hydrated, eat nutritious meals, and take short breaks to avoid burning out. Despite these concerns, I managed to push through and complete my tasks, hoping that tomorrow would bring a healthier and less worrisome day.",0,0,0,1,0
"Today was just one of those days when I couldn't shake off my concerns about my health. My mind kept wandering to all the things that could go wrong. I worried about the quality of the food I ate, the lack of exercise I had been getting, and the constant fatigue I felt. It's frustrating to have these thoughts constantly nagging at me, but I guess it's a reminder to take better care of myself. Hopefully, tomorrow will be a better day.",0,0,0,1,0
"So, today was one of those days when I couldn't help but worry about my health. I woke up feeling a bit under the weather, with a headache and a scratchy throat. It's always a hassle because I have classes to attend and assignments to complete. I managed to drag myself out of bed and make it to campus, but the constant concern about my health lingered in the back of my mind throughout the day. I made sure to drink lots of water and take breaks whenever I could. Despite the hassles, I'm determined to prioritize my health and find ways to stay on top of my game.",0,0,0,1,0
"Today has been quite a hassle-filled day for me. As an undergraduate student from DLSU, my concerns about health have been lingering in the back of my mind. With the ongoing pandemic, staying healthy has become a top priority. From constantly sanitizing my hands to wearing a mask all day, it's become a daily routine. However, the fear of contracting the virus still lingers, making every step outside my dorm a nerve-wracking experience. Despite these concerns, I try to stay positive and take every precaution necessary to ensure my well-being.",0,0,0,1,0
"Today was a typical day at DLSU, filled with the usual hustle and bustle. Amidst the rush, I couldn't help but have concerns about my health in general. The stress of juggling assignments, exams, and extracurricular activities often takes a toll on my well-being. It's a constant struggle to find time for exercise and maintain a balanced diet. Nevertheless, I remind myself to prioritize self-care amidst the chaos, knowing that a healthy body and mind are essential for success in both my academic and personal life.",0,0,0,1,0
"Today was quite a hectic day for me. Aside from my regular classes and assignments, I couldn't help but worry about my health. Lately, I've been experiencing constant headaches and fatigue, which made it difficult for me to focus. I kept questioning if I was getting enough sleep or if my diet was causing these issues. It's frustrating to deal with these concerns while trying to keep up with my academics. Hopefully, I can find some time soon to address these health issues and put my mind at ease.",0,0,0,1,0
"So, today started off like any other day. Woke up feeling groggy and tired, but also a little concerned about my health in general. I've been neglecting my exercise routine lately, and it's starting to take a toll on me. I need to find a way to incorporate some physical activity into my daily schedule. Maybe I'll try going for a walk during breaks or taking the stairs instead of the elevator. It's important to prioritize my health, even amidst the hustle and bustle of university life.",0,0,0,1,0
"So, my day started off with concerns about my health in general. I woke up feeling groggy and lethargic, which made me worry if I was coming down with something. Despite my best efforts to eat healthy and exercise regularly, it seemed like my body was betraying me. As I got ready for the day, I couldn't help but wonder if I needed more rest or if there was something else going on. It's frustrating when you try your best to take care of yourself, yet your body doesn't always cooperate.",0,0,0,1,0
