"Today was one of those days where my personal energy levels were at an all-time low. Dragging myself out of bed, I stumbled through the day, feeling like a zombie. Despite my best efforts, I couldn't shake off the exhaustion that seemed to weigh me down. It was a constant battle to stay focused in my classes and complete my assignments. As the day wore on, I realized the importance of self-care and vowed to prioritize my well-being, knowing that replenishing my personal energy is essential for a productive and fulfilling day.",0,0,0,0,0,0,0,0,0,1,0,0,0
"Today was a struggle. Waking up early for a full day of classes drained the little personal energy I had left. My mind felt foggy, and my body begged for rest. As the day progressed, it became harder to concentrate and participate actively. The exhaustion seemed to seep into every fiber of my being, making it difficult to stay motivated. Despite the challenges, I pushed through, reminding myself that this lack of energy was only temporary.",0,0,0,0,0,0,0,0,0,1,0,0,0
"Today was an exhausting day. Waking up early for classes left me with not enough personal energy to get through the day. The constant rush from one lecture to another drained me physically and mentally. Even during breaks, I struggled to find the motivation to socialize or participate in extracurricular activities. It's frustrating when you want to enjoy your day, but your energy levels simply won't allow it. Hopefully, a good night's rest will recharge me for tomorrow's challenges.",0,0,0,0,0,0,0,0,0,1,0,0,0
"Today was one of those days where personal energy seemed to be running on empty. Dragging myself out of bed, I struggled to stay focused during my morning classes at DLSU. The lack of energy made even the simplest tasks feel like an uphill battle. Despite my best efforts, I couldn't shake off the exhaustion that seemed to weigh me down. I longed for a burst of motivation to get me through the day, but for now, it seemed like my personal energy was running on fumes.",0,0,0,0,0,0,0,0,0,1,0,0,0
"Today was one of those days where personal energy seemed to be running low. Dragging myself out of bed, I barely had the motivation to get ready for class. Throughout the day, my lack of energy made it difficult to concentrate and participate in discussions. Even the simplest tasks felt like a chore, leaving me feeling drained and unproductive. It was a constant battle to push through, but I reminded myself that tomorrow is a new day, filled with opportunities for a fresh burst of energy.",0,0,0,0,0,0,0,0,0,1,0,0,0
"Today was a tough day at DLSU. Not enough personal energy made it difficult to focus during my lectures. The heavy workload and constant pressure drained me, leaving me exhausted. Despite my efforts to stay motivated, the fatigue made it challenging to retain information and actively participate in discussions. However, I pushed through, reminding myself that these temporary obstacles are part of the journey towards achieving my goals.",0,0,0,0,0,0,0,0,0,1,0,0,0
"Today was a struggle. I woke up feeling drained, lacking personal energy to tackle the day ahead. Dragging myself to class felt like a never-ending battle against exhaustion. It was hard to concentrate, and even a simple task felt overwhelming. I tried to push through, but my energy levels remained low throughout the day. It was frustrating, as I couldn't fully engage in discussions or give my best effort. I hope tomorrow brings a renewed sense of vitality, so I can conquer the day with enthusiasm.",0,0,0,0,0,0,0,0,0,1,0,0,0
"Today was one of those days where personal energy seemed to be in short supply. Dragging myself out of bed, I trudged through the day, feeling lethargic and unmotivated. Every task, no matter how small, felt like a monumental challenge. I struggled to concentrate in class, my mind wandering to thoughts of a much-needed nap. Even the simplest interactions felt draining. It was a constant battle to push through the fatigue and find the energy to keep going. Hopefully, tomorrow will bring a renewed sense of vitality.",0,0,0,0,0,0,0,0,0,1,0,0,0
"Today was a typical day at DLSU, but my lack of personal energy made it quite a struggle. Dragging myself out of bed, I stumbled into class feeling drained. Despite trying to concentrate, my mind wandered and I couldn't fully engage with the lectures. Even a cup of coffee failed to energize me. By the time I reached the library to study, my eyelids felt heavy and my motivation dwindled. It's disheartening when your body refuses to cooperate, but I'll strive to recharge and conquer another day tomorrow.",0,0,0,0,0,0,0,0,0,1,0,0,0
"Today was one of those days where I woke up feeling drained, lacking personal energy to kick-start the day. Despite having a full night's sleep, I couldn't shake off the fatigue that weighed me down. Every task seemed to require an extra effort, making it challenging to concentrate in class and stay motivated. I realized that self-care and recharging are vital to maintain my energy levels. Hopefully, tomorrow will be a better day with a renewed sense of vigor.",0,0,0,0,0,0,0,0,0,1,0,0,0
"Today was one of those days where I just couldn't find enough personal energy to get through my classes. Dragging my tired self out of bed in the morning felt like a Herculean task. As the day wore on, I struggled to stay focused and engaged, my mind wandering off every now and then. Despite my best efforts, I found myself fighting off yawns and battling the urge to take a quick nap. It's frustrating when your body refuses to cooperate, but I'll push through and hope for a better, more energetic day tomorrow.",0,0,0,0,0,0,0,0,0,1,0,0,0
"As an undergraduate student at DLSU, my day is filled with concerns about getting ahead. From the moment I wake up, thoughts about assignments, exams, and projects occupy my mind. Rushing to catch the MRT, I worry about the competition for internships and future job prospects. Juggling multiple responsibilities, I constantly strive to excel academically while maintaining a social life. Despite these daily hassles, I remind myself that these challenges are what push me to grow and succeed in my journey as a student at DLSU.",0,0,0,0,0,0,0,0,0,0,1,0,0
"Today was just another day filled with concerns about getting ahead. As an undergraduate student from DLSU, the pressure to excel is always looming. From the moment I woke up, thoughts about assignments, exams, and projects flooded my mind. Racing against time became my routine, constantly striving to stay ahead of the game. Although it can be overwhelming, this daily hassle pushes me to work harder, grow as an individual, and embrace the challenges that come with pursuing higher education.",0,0,0,0,0,0,0,0,0,0,1,0,0
"Today was quite a hassle. As an undergraduate student from DLSU, concerns about getting ahead were constantly on my mind. From the moment I woke up, I worried about staying on top of my assignments and maintaining a competitive edge. Juggling multiple tasks throughout the day only added to the pressure. Despite the challenges, I pushed through, reminding myself that hard work and determination would pave the way for success. It may be tough, but I'm determined to overcome these daily hassles and thrive in my academic journey.",0,0,0,0,0,0,0,0,0,0,1,0,0
"Today was a typical day at DLSU, filled with concerns about getting ahead. As an undergraduate student, the pressure to excel in academics, participate in extracurricular activities, and secure internships loomed over me. Rushing from one class to another, I couldn't help but worry about the competitive job market and the need to stand out. It's a constant struggle, but I remind myself to embrace the challenges, stay focused, and make the most out of every opportunity that comes my way.",0,0,0,0,0,0,0,0,0,0,1,0,0
"Today was a typical day at DLSU, filled with concerns about getting ahead. As an undergraduate student, the pressure to excel academically is always on my mind. From worrying about upcoming exams to constantly comparing myself to my peers, the desire to stay ahead can be overwhelming. However, amidst these daily hassles, I remind myself that learning is a journey, and it's important to focus on personal growth rather than getting ahead of others.",0,0,0,0,0,0,0,0,0,0,1,0,0
"Today was another busy day at DLSU. As an undergraduate student, concerns about getting ahead constantly weighed on my mind. Balancing assignments, exams, and extracurricular activities seemed like an uphill battle. The pressure to excel and secure a bright future was ever-present. Despite the daily hassles, I remained determined to push through and make the most out of my college experience. With a positive mindset and unwavering commitment, I faced these concerns head-on, believing that hard work and perseverance would eventually pay off.",0,0,0,0,0,0,0,0,0,0,1,0,0
"Today was just like any other day at DLSU. As an undergraduate student, concerns about getting ahead are always on my mind. The constant pressure to excel academically, secure internships, and join extracurricular activities can be overwhelming. But I remind myself that every step I take brings me closer to my goals, and that perseverance is key. So, I tackle each day with determination, knowing that these daily hassles are just temporary challenges on my path to success.",0,0,0,0,0,0,0,0,0,0,1,0,0
"As an undergraduate student from DLSU, my day is filled with concerns about getting ahead. Every morning, I wake up with the nagging worry of falling behind my peers. The pressure to excel academically and secure internships or research opportunities weighs heavily on my mind. I constantly find myself juggling multiple assignments, attending meetings, and pushing myself to surpass expectations. It can be exhausting at times, but I remind myself that these challenges will ultimately shape me into a better, more resilient individual.",0,0,0,0,0,0,0,0,0,0,1,0,0
"Today was a typical day filled with concerns about getting ahead. As an undergraduate student at DLSU, the pressure to excel is always looming. I woke up early, eager to start my day, but couldn't help but worry about my upcoming exams and assignments. Throughout the day, thoughts of competition and the constant need to prove myself kept creeping into my mind. It's a daily hassle that often leaves me feeling overwhelmed, but I know that with determination and hard work, I can stay on track and strive for success.",0,0,0,0,0,0,0,0,0,0,1,0,0
"As an undergraduate student from DLSU, my day is often filled with concerns about getting ahead. From the moment I wake up, thoughts of upcoming exams and assignments consume my mind. The race to succeed and stand out in a highly competitive environment is ever-present. It's a constant battle to balance academics, extracurricular activities, and personal life. However, amidst the daily hassles, I remind myself that these challenges are opportunities for growth and development. I strive to stay focused, work hard, and embrace the journey towards achieving my goals.",0,0,0,0,0,0,0,0,0,0,1,0,0
"As a DLSU undergraduate, my day is often filled with concerns about getting ahead. The constant pressure to excel in academics, secure internships, and build a promising future can be overwhelming. Waking up early, attending back-to-back classes, and trying to retain an ocean of information becomes a daily struggle. However, amidst the chaos, I find solace in knowing that every challenge I face is a stepping stone towards achieving my goals. And with determination and perseverance, I am confident that I can tackle any obstacle that comes my way.",0,0,0,0,0,0,0,0,0,0,1,0,0
"Today has been a whirlwind of concerns about getting ahead. As an undergraduate student at DLSU, the pressure to excel is constantly looming over me. From juggling assignments, preparing for exams, and maintaining a decent GPA, it feels like a never-ending battle. I find myself constantly questioning if I am doing enough to secure a bright future. The fear of falling behind keeps me on my toes, pushing me to strive for academic success. Despite the daily hassles, I am determined to overcome these challenges and forge my path towards success.",0,0,0,0,0,0,0,0,0,0,1,0,0
"Today was just another hectic day at DLSU. As an undergraduate student, concerns about getting ahead constantly occupy my mind. From rushing to submit assignments to juggling multiple exams, it feels like a never-ending race. Amidst the chaos, I remind myself to stay focused and determined. Although it may be challenging, I know that these daily hassles are merely stepping stones towards achieving my goals and securing a brighter future. So, I take a deep breath, put on my game face, and embrace the grind, knowing that it will all be worth it in the end.",0,0,0,0,0,0,0,0,0,0,1,0,0
"As an undergraduate student at DLSU, my day is often filled with concerns about getting ahead. From the moment I wake up, the pressure to excel in academic pursuits looms over me. Whether it's worrying about upcoming exams, striving to maintain a high GPA, or constantly comparing myself to my peers, the pursuit of success can be overwhelming. Despite these daily hassles, I remind myself to focus on personal growth and enjoy the journey rather than just the destination.",0,0,0,0,0,0,0,0,0,0,1,0,0
"Today has been quite a whirlwind. As an undergraduate student at DLSU, concerns about getting ahead constantly consume my thoughts. From the moment I woke up, I found myself fretting about upcoming exams, assignments, and the pressure to excel in my chosen field. It's overwhelming, but I remind myself to take one step at a time. Despite the daily hassles, I try to stay focused and motivated, embracing the challenges that come my way.",0,0,0,0,0,0,0,0,0,0,1,0,0
"As an undergraduate student from DLSU, my day is often filled with concerns about getting ahead. From the moment I wake up, thoughts about studying, assignments, and exams flood my mind. The pressure to excel and secure a bright future can be overwhelming. However, amidst these daily hassles, I remind myself to take one step at a time, focusing on the present moment. I prioritize my tasks, seek support from friends, and practice self-care to maintain balance in my academic journey. Despite the challenges, I am determined to persevere and make the most out of my time at DLSU.",0,0,0,0,0,0,0,0,0,0,1,0,0
"Today was a typical day at DLSU, filled with concerns about getting ahead. As an undergraduate student, I constantly worry about keeping up with the workload, meeting deadlines, and staying competitive. The pressure to excel in academics and extracurricular activities can be overwhelming, causing stress and anxiety. However, I remind myself that these challenges are part of the journey towards personal and intellectual growth. Despite the daily hassles, I find solace in knowing that every hurdle I overcome brings me one step closer to achieving my goals.",0,0,0,0,0,0,0,0,0,0,1,0,0
"Today was another busy day as an undergraduate student at DLSU. As I rushed from one class to another, concerns about getting ahead constantly occupied my mind. Will I be able to stay on top of my assignments? Can I compete with my peers? These worries weighed heavily on me, making it difficult to fully enjoy the present moment. However, I reminded myself to take things one step at a time and trust in my abilities. Despite the daily hassles, I knew that as long as I gave my best effort, success would follow.",0,0,0,0,0,0,0,0,0,0,1,0,0
"As an undergraduate student from DLSU, my day is often filled with concerns about getting ahead. From the moment I wake up, the pressure to excel and stay competitive looms over me. Whether it's worrying about upcoming exams or struggling to keep up with the fast-paced lectures, the constant desire to stay ahead is a never-ending battle. But amidst all the stress, I remind myself that these challenges are what shape me into a resilient and determined individual, ready to face the real world head-on.",0,0,0,0,0,0,0,0,0,0,1,0,0
"Today was another busy day filled with concerns about getting ahead. As an undergraduate student at DLSU, the pressure to excel is always present. I found myself constantly worrying about my grades, internships, and future career prospects. It's a constant battle to stay on top of assignments, projects, and exams while trying to make time for extracurricular activities and personal growth. Despite the daily hassles, I remind myself that these concerns are necessary for personal and academic development, and that hard work will eventually pay off.",0,0,0,0,0,0,0,0,0,0,1,0,0
"Today was another busy day as an undergraduate student at DLSU. I woke up with concerns about getting ahead in my classes. The pressure to perform well and stay on top of my assignments weighed heavily on my mind. However, I reminded myself to take it one step at a time and focus on the tasks at hand. Despite the daily hassles, I am determined to make the most out of my time here and keep pushing forward towards my academic goals.",0,0,0,0,0,0,0,0,0,0,1,0,0
"As an undergraduate student at DLSU, my day is often filled with concerns about getting ahead. From the moment I wake up, thoughts about assignments, exams, and future career plans consume my mind. The pressure to stay competitive and excel in my studies can be overwhelming at times. However, I remind myself that these concerns are just a part of the journey towards success. I take a deep breath, focus on one task at a time, and trust that my hard work will pay off in the end.",0,0,0,0,0,0,0,0,0,0,1,0,0
"Today was just another day filled with concerns about getting ahead. As an undergraduate student at DLSU, the pressure to excel is constantly looming over me. From the moment I woke up, thoughts of internships, research opportunities, and post-graduation plans consumed my mind. It's a never-ending race to secure a successful future, and sometimes it feels overwhelming. But amidst all the worries, I remind myself to take a deep breath and focus on one step at a time. After all, Rome wasn't built in a day, and neither will my future.",0,0,0,0,0,0,0,0,0,0,1,0,0
"Today was a typical day as an undergraduate student at DLSU. As I woke up, concerns about getting ahead immediately flooded my mind. I pondered on how to excel academically, secure internships, and build a strong network. Throughout the day, I juggled attending classes, studying for quizzes, and researching potential opportunities. Despite the constant worries, I reminded myself to stay focused and motivated. After all, these concerns were just part of the journey towards a successful future.",0,0,0,0,0,0,0,0,0,0,1,0,0
"Today was another busy day at DLSU. As an undergraduate student, concerns about getting ahead constantly hover in my mind. From the moment I woke up, I worried about completing my assignments, preparing for upcoming exams, and finding ways to stand out among my peers. It feels like a never-ending race, but I remind myself to stay focused and determined. Despite these daily hassles, I know that each challenge I overcome brings me one step closer to achieving my goals.",0,0,0,0,0,0,0,0,0,0,1,0,0
"Today was a typical day at DLSU, filled with concerns about getting ahead. The pressure to excel in academics and secure a promising future constantly looms over us. As an undergraduate student, I find myself constantly worrying about internships, networking, and maintaining a competitive GPA. It's easy to get lost in the hustle and forget to enjoy the journey. However, I remind myself that success is not solely measured by academic achievements, but also by personal growth and experiences. So, amidst the daily hassles, I strive to find a balance and make the most out of my time at DLSU.",0,0,0,0,0,0,0,0,0,0,1,0,0
"As an undergraduate student from DLSU, my day is filled with concerns about getting ahead. From the moment I wake up, I worry about staying on top of my assignments, studying for exams, and managing my time effectively. The pressure to excel and secure a bright future is always at the back of my mind. It's a constant hustle to balance academics, extracurricular activities, and personal life. However, despite the daily hassles, I find solace in knowing that I am preparing myself for success and growth in the long run.",0,0,0,0,0,0,0,0,0,0,1,0,0
"As an undergraduate student at DLSU, my day is filled with concerns about getting ahead. From the moment I wake up, I am constantly reminded of the fierce competition and the need to excel in my studies. Whether it's rushing to finish assignments, preparing for exams, or trying to secure internships, there's always this underlying pressure to stay ahead of the game. It's a daily hassle that keeps me on my toes, but it also serves as a motivation to push myself harder and strive for success.",0,0,0,0,0,0,0,0,0,0,1,0,0
"Today was a typical day at DLSU, filled with concerns about getting ahead. I woke up anxious, thinking about my upcoming exams and the need to maintain a high GPA. As I rushed to class, I worried about the competition among my peers and the pressure to stand out. Throughout the day, I couldn't shake off the constant worry of falling behind. Despite these daily hassles, I reminded myself to stay focused and determined, knowing that hard work and perseverance would eventually pay off.",0,0,0,0,0,0,0,0,0,0,1,0,0
"Today was just another day filled with concerns about getting ahead. As an undergraduate student at DLSU, the pressure to excel is always on my mind. From the moment I woke up, thoughts of assignments, exams, and future career prospects consumed me. Racing against time, I rushed to classes, eagerly absorbing knowledge, hoping it would give me an edge. Amidst the chaos, I found solace in the support of my peers and the guidance of my professors. Despite the daily hassles, I remain determined to make the most of my education and forge a successful path ahead.",0,0,0,0,0,0,0,0,0,0,1,0,0
"Today was a typical day at DLSU, filled with classes, assignments, and the usual daily hassles. However, the fear of confrontation was constantly lurking in the back of my mind. Whether it was speaking up in class discussions or expressing my opinions in group projects, the fear of being judged or criticized held me back. It was frustrating, as I knew I had valid ideas to contribute but struggled to find the confidence to voice them. Nonetheless, I reminded myself to push through this fear, gradually taking small steps towards overcoming it.",0,0,0,0,0,0,0,0,0,0,0,1,0
"Today was a typical day at DLSU, filled with the usual hustle and bustle. However, one thing that always gets to me is my fear of confrontation. Whether it's speaking up in class or expressing my opinions, I find myself constantly hesitating. It's frustrating to constantly hold back, but I'm determined to overcome this obstacle and gain the confidence to confront my fears head-on.",0,0,0,0,0,0,0,0,0,0,0,1,0
"Today was quite an eventful day at DLSU. I woke up feeling anxious about attending a group meeting, fearing potential confrontation regarding our project's direction. As the meeting approached, I tried to gather courage and speak up confidently. Surprisingly, my teammates were understanding and open to my suggestions. Overcoming my fear of confrontation turned out to be a liberating experience, reminding me that it's essential to voice my opinions and concerns rather than letting fear hold me back.",0,0,0,0,0,0,0,0,0,0,0,1,0
"Today was a rollercoaster of emotions. As an undergraduate student at DLSU, my day started off with the usual hustle and bustle. However, a constant fear of confrontation loomed over me. During class discussions, I hesitated to voice my opinions, fearing judgment or disagreement. This fear constrained my growth and hindered meaningful interactions. Nevertheless, I reminded myself that growth requires stepping out of my comfort zone. With determination, I challenged myself to overcome this fear, slowly but surely.",0,0,0,0,0,0,0,0,0,0,0,1,0
"Today was a typical day at DLSU, filled with the usual hustle and bustle. However, my fear of confrontation made things a bit challenging. During a group project meeting, I had reservations about a teammate's idea but hesitated to voice my concerns. Later, I found myself stuck in the cafeteria line behind a person cutting in, but I couldn't muster the courage to speak up. Despite these daily hassles, I realized that overcoming my fear of confrontation is essential for personal growth and effective communication.",0,0,0,0,0,0,0,0,0,0,0,1,0
"Today was a typical day at DLSU, filled with classes and campus activities. However, one daily hassle that always weighs on my mind is the fear of confrontation. I find it difficult to speak up in class discussions or approach professors with my concerns. It's a constant battle to overcome this fear and find my voice. But despite the challenges, I am determined to push myself out of my comfort zone and grow as a student and individual.",0,0,0,0,0,0,0,0,0,0,0,1,0
"Today was a typical day at DLSU, filled with the usual hustle and bustle. As I made my way through the crowded hallways, I couldn't help but feel a sense of unease. The fear of confrontation loomed over me, making me hesitant to voice my opinions or stand up for myself. It's a constant struggle, navigating through the sea of different personalities, but I remind myself that growth comes from facing these fears head-on. So, today, I took a small step towards overcoming my fear and spoke up during a group discussion. It may seem insignificant, but it's progress, and that's what matters.",0,0,0,0,0,0,0,0,0,0,0,1,0
