Narrative,Regrets over past decision/s,Concerned about the meaning of life,Being lonely,Inability to express oneself,Fear of rejection,Trouble making decisions,Physical appearance,Not seeing people,Troubling thoughts about ones future,Not enough personal energy,Concerns about getting ahead,Fear of confrontation,Wasting time
"So, today was one of those days where I couldn't help but dwell on some regrets from the past. As an undergraduate student from DLSU, I couldn't help but think about the missed opportunities and decisions I wish I had made differently. It's frustrating to look back and think about what could have been. But, I guess it's all a part of the learning process. I'll just have to remind myself to focus on the present and make the most out of the opportunities that come my way.",1,0,0,0,0,0,0,0,0,0,0,0,0
"Today started off like any other day, but as I sat in my morning class, regrets over past decisions started to haunt me. I couldn't help but replay that moment when I chose the wrong major, doubting if it was the right path for me. Throughout the day, these regrets lingered, clouding my thoughts and making me question my choices. It's a constant battle, but I'm determined to find a way to overcome these regrets and make the most out of my time here at DLSU.",1,0,0,0,0,0,0,0,0,0,0,0,0
"Today has been quite a rollercoaster. As an undergraduate student at DLSU, I couldn't help but feel the weight of regrets over past decisions. It's funny how hindsight can be so painfully clear. From choosing the wrong major to missing out on opportunities, I can't help but wonder what my life would be like if I had made different choices. But I guess it's all part of growing up and learning from our mistakes. So, despite the regrets, I'll try to make the most out of every day and let go of what I can't change.",1,0,0,0,0,0,0,0,0,0,0,0,0
"Today was a rollercoaster of emotions. Waking up, I couldn't shake off the regrets from last night's decision to procrastinate on my project. As I rushed to class, I found myself questioning why I hadn't listened to my instincts earlier. The regret continued to linger, distracting me throughout the day. Lesson learned, I promised myself to trust my gut and make better choices moving forward.",1,0,0,0,0,0,0,0,0,0,0,0,0
"Today was another long day at DLSU. I couldn't help but feel a pang of regret as I walked past the library. I remembered the times I neglected my studies, choosing to procrastinate instead. Now, as I struggle to catch up with my coursework, I can't help but wish I had made better decisions in the past. Lesson learned: always prioritize my responsibilities and avoid the regrets that come with poor choices.",1,0,0,0,0,0,0,0,0,0,0,0,0
"Today started off with a cloud of regrets lingering over me. I couldn't help but think about the poor decision I made last semester, choosing the wrong elective. As I walked through the halls of DLSU, I couldn't help but feel a pang of disappointment. However, I reminded myself that mistakes are part of life and learning from them is crucial. With renewed determination, I promised myself to make better choices and not let regrets overshadow my present and future endeavors.",1,0,0,0,0,0,0,0,0,0,0,0,0
"Today started off with a heavy heart as I found myself drowning in regrets over past decisions. I couldn't help but replay those moments in my mind, questioning every choice I made. The weight of those regrets consumed me, clouding my thoughts and dampening my mood. It felt like a never-ending cycle of self-doubt. Despite the chaos within, I pushed through the day, hoping to find solace and learn from those regrets.",1,0,0,0,0,0,0,0,0,0,0,0,0
"Today started off with a heavy weight on my chest as I woke up with regrets over past decisions. I couldn't help but replay the moments in my mind, questioning my choices and wondering what could have been. The regret lingered throughout the day, making it hard to focus on my studies. But amidst the chaos of regret, I reminded myself that the past is behind me, and I must learn from those decisions to shape a better future.",1,0,0,0,0,0,0,0,0,0,0,0,0
"Today started off like any other day, but as I sat in my morning class, regrets over past decisions flooded my mind. I couldn't help but wonder if I had chosen the right major or if I had wasted my time on unnecessary commitments. The weight of these regrets followed me throughout the day, making it hard to focus on my tasks. It's a constant battle to remind myself that dwelling on the past won't change anything, but it's easier said than done.",1,0,0,0,0,0,0,0,0,0,0,0,0
"Today started off like any other day, with the burden of regrets from past decisions weighing heavily on my mind. As I walked through the bustling campus of DLSU, memories of missed opportunities and wrong choices flooded my thoughts. Each step felt like a reminder of the roads not taken and the chances I let slip away. It's a constant struggle to push past these regrets and focus on the present, but I'm determined to make the most of the opportunities that lie ahead.",1,0,0,0,0,0,0,0,0,0,0,0,0
"Today started like any other day, but it didn't take long for regrets to creep in. I couldn't help but dwell on past decisions that had led me astray. The weight of those choices hung heavily on my mind, causing a cloud of negativity to loom over me. It was a constant reminder of the paths I should have taken differently. As I navigated through the day, I vowed to learn from those regrets and make better decisions going forward, reminding myself that dwelling on the past would only hinder my progress.",1,0,0,0,0,0,0,0,0,0,0,0,0
"Today was just one of those days where regrets over past decisions haunted me. I couldn't help but dwell on the choices I made in the past and wonder if I could have done things differently. The weight of these regrets made it difficult to focus on my studies and enjoy the present moment. However, I reminded myself that dwelling on the past won't change anything. Instead, I decided to learn from my mistakes and use them as lessons for the future.",1,0,0,0,0,0,0,0,0,0,0,0,0
"Today was a typical day at DLSU, filled with the usual hustle and bustle. However, amidst the chaos, I found myself plagued by regrets over past decisions. As I sat in class, my mind wandered to the missed opportunities and wrong turns I had taken. The weight of these regrets hung heavily over me, clouding my thoughts and making it difficult to focus. I vowed to learn from my mistakes and make better choices in the future, determined to turn these regrets into valuable life lessons.",1,0,0,0,0,0,0,0,0,0,0,0,0
"Today was a rollercoaster of emotions. As an undergraduate student at DLSU, I couldn't help but feel regrets over past decisions. I questioned my choice of major, wondering if I should have pursued a different path. The constant self-doubt weighed heavily on my mind throughout the day, making it difficult to concentrate on my studies. However, I reminded myself that it's never too late to make a change and decided to seek guidance from my professors to explore other options.",1,0,0,0,0,0,0,0,0,0,0,0,0
"Today was just one of those days where regrets from past decisions haunted me. I couldn't help but think about that time I chose the wrong major, realizing now that it isn't the right fit for me. The constant questioning and self-doubt filled my mind, making it difficult to focus on my current studies. It's frustrating to know that I can't turn back time, but I'm determined to learn from this experience and make better decisions moving forward.",1,0,0,0,0,0,0,0,0,0,0,0,0
"Today started off with a heavy weight on my shoulders as regrets from past decisions crept into my mind. I couldn't help but dwell on the opportunities I had missed and the chances I wish I had taken. It was difficult to shake off the feeling of disappointment, but I reminded myself that dwelling on the past wouldn't change anything. Instead, I focused on learning from those mistakes and making better choices moving forward. After all, it's never too late to turn regrets into lessons.",1,0,0,0,0,0,0,0,0,0,0,0,0
"Today started off like any other day, but as I walked through the university gates, I couldn't help but feel a pang of regret over a past decision. The memory of choosing a major that didn't align with my true passion haunted me. Sitting in class, I couldn't shake the feeling of dissatisfaction, wishing I had followed my heart instead. It's a constant reminder of the importance of making choices that truly resonate with who I am.",1,0,0,0,0,0,0,0,0,0,0,0,0
"Today was one of those days where regrets over past decisions weighed heavily on my mind. As I walked through the corridors of DLSU, memories of missed opportunities and wrong choices flooded my thoughts. I couldn't help but wonder how different things would be if I had taken a different path. However, instead of dwelling on what could have been, I reminded myself that every decision has led me to where I am now. I vowed to learn from my mistakes and make the most of the present, determined to create a brighter future for myself.",1,0,0,0,0,0,0,0,0,0,0,0,0
"Today started off with a cloud of regrets over past decisions hovering above my head. I couldn't help but dwell on the choices I made during my freshman year at DLSU. The fear of missing out on opportunities and not making the most of my college experience consumed me. However, as the day progressed, I reminded myself to focus on the present and learn from my mistakes. Life is too short to live with regrets, and I am determined to make the most of my remaining time at DLSU.",1,0,0,0,0,0,0,0,0,0,0,0,0
"Today started off like any other day, but as I sat in class, my mind wandered back to a decision I made last semester. I couldn't help but feel regret and doubt about my choice of major. Thoughts of what could have been filled my head, distracting me from the lecture. It was a constant battle to stay focused and not let my regrets consume me. However, I reminded myself that dwelling on the past wouldn't change anything. Instead, I vowed to make the most of my current situation and find ways to explore my interests within my chosen field.",1,0,0,0,0,0,0,0,0,0,0,0,0
"Today started like any other day, with regrets over past decisions lingering in my mind. I couldn't help but think about the course I chose and whether it was the right fit for me. Doubts and what-ifs haunted me, making it hard to concentrate on my studies. But amidst the turmoil, I reminded myself that dwelling on the past won't change anything. Instead, I vowed to focus on the present and make the most out of my college experience, regardless of the choices I had made.",1,0,0,0,0,0,0,0,0,0,0,0,0
"Today started off like any other day, but as I sat in my first class, regrets from past decisions began to haunt me. I couldn't help but dwell on the opportunities I missed and the chances I didn't take. The weight on my shoulders grew heavier with each passing hour, making it difficult to focus on my studies. It's a constant reminder that life is filled with choices, and sometimes, the wrong ones can leave a lasting impact. But amidst the regrets, I'm determined to learn from my mistakes and make better decisions moving forward.",1,0,0,0,0,0,0,0,0,0,0,0,0
"Today, as I strolled through the vibrant corridors of DLSU, regrets over past decisions whispered in my ears. I couldn't shake off the feeling of remorse for not joining that club I had always wanted to be a part of. The missed opportunities and friendships haunt me. Nevertheless, I promised myself to make the most out of my remaining time here, embracing new experiences and never shying away from taking risks. After all, life is too short to dwell on regrets.",1,0,0,0,0,0,0,0,0,0,0,0,0
"Today started off with a heavy heart as regrets from past decisions consumed my thoughts. I couldn't help but replay the moments when I made choices that led me astray. The weight of those decisions lingered throughout the day, making it difficult to focus on my studies. However, I reminded myself that dwelling on the past won't change anything. Instead, I vowed to learn from my mistakes and make better decisions moving forward. It's a constant battle, but I'm determined to grow from my regrets and create a brighter future.",1,0,0,0,0,0,0,0,0,0,0,0,0
"Today started off with a tinge of regret as I woke up remembering the poor decision I made last night, staying up late binge-watching my favorite series. Now, I'm paying the price with heavy eyelids during my morning classes. I can't help but beat myself up for not prioritizing my sleep. Lesson learned the hard way, I promise myself to make better choices tonight.",1,0,0,0,0,0,0,0,0,0,0,0,0
"Today was just one of those days where regrets over past decisions weighed heavily on my mind. I couldn't help but think about the opportunities I let slip away and the chances I didn't take. It felt like a constant nagging in the back of my head, reminding me of what could have been. But instead of dwelling on these regrets, I tried to focus on making better choices moving forward, learning from my mistakes, and embracing the present moment. It's never too late to turn things around, and today was a reminder of just that.",1,0,0,0,0,0,0,0,0,0,0,0,0
"Today started off with a heavy weight of regret over a past decision I made. I couldn't help but dwell on the missed opportunities and what-ifs. As I walked through the DLSU campus, I realized that dwelling on the past only hinders my present growth. So, I made a conscious effort to let go of those regrets and focus on making better decisions moving forward. It's liberating to know that every new day brings a chance for redemption and growth.",1,0,0,0,0,0,0,0,0,0,0,0,0
"Today started off like any other day, but as I sat in my morning class, regrets from past decisions started to creep into my mind. I couldn't help but think about that major I switched out of last year, wondering if I made the right choice. Doubts clouded my thoughts, making it hard to focus on the lecture. I tried to push these regrets aside and remind myself that everything happens for a reason, but it's difficult not to dwell on what could have been.",1,0,0,0,0,0,0,0,0,0,0,0,0
"Today started off with a heavy heart as regrets over past decisions weighed me down. I couldn't help but think about the opportunities I missed and the chances I didn't take. It felt like a constant battle between what could have been and what is. However, amidst the regrets, I reminded myself to learn from those mistakes and use them as stepping stones towards a better future. It's never too late to make amends and create a new path for myself.",1,0,0,0,0,0,0,0,0,0,0,0,0
"Today was a typical day for me at DLSU, filled with the usual daily hassles. However, one thing that weighed heavily on my mind was the regrets over past decisions. As I walked through the campus, memories flooded back of missed opportunities and choices I wish I had made differently. It's a constant reminder that life doesn't come with a rewind button. Despite these regrets, I know I must learn from them and make better decisions moving forward.",1,0,0,0,0,0,0,0,0,0,0,0,0
"As an undergraduate student at DLSU, my days are often filled with numerous tasks and responsibilities. Today, amidst the hustle and bustle, I found myself pondering about the meaning of life. It's a question that has been on my mind lately, and it occasionally resurfaces, causing me to pause and reflect. While my day was filled with the usual academic challenges, this existential concern lingered in the background, reminding me to search for purpose amidst the chaos.",0,1,0,0,0,0,0,0,0,0,0,0,0
"As an undergrad from DLSU, my day was filled with the usual hustle and bustle. Amidst attending lectures and completing assignments, a recurring thought kept nagging at me - the meaning of life. It seemed like an insurmountable question, leaving me confused and concerned. But as the day progressed, I found solace in discussing this existential dilemma with friends, realizing that seeking meaning is a journey unique to each individual. Though the answer may elude me for now, I embraced the uncertainty and vowed to make the most out of my college experience, appreciating the little joys that come my way.",0,1,0,0,0,0,0,0,0,0,0,0,0
"As an undergraduate student from DLSU, my day is often filled with various daily hassles. Today, amidst the flurry of assignments and exams, I found myself increasingly concerned about the meaning of life. Thoughts about my purpose and existence swirled in my mind, adding an extra layer of complexity to my already hectic day. It's a never-ending quest for answers, but I remind myself to find solace in the journey, embracing the uncertainties as opportunities for growth.",0,1,0,0,0,0,0,0,0,0,0,0,0
"As an undergraduate student at DLSU, my day begins with the usual hustle and bustle of classes and assignments. Amidst the academic chaos, I find myself occasionally pondering about the meaning of life. It's a constant concern that lingers in the back of my mind, whispering existential questions. However, I try to push these thoughts aside and focus on the present moment, knowing that the answer to this profound inquiry lies in the journey itself.",0,1,0,0,0,0,0,0,0,0,0,0,0
"Today was just another ordinary day as an undergraduate student at DLSU. As I walked through the bustling hallways, a lingering thought bothered me - the meaning of life. It's a concern that often creeps into my mind, making me question my purpose in this vast universe. Yet, amidst the lectures and assignments, I pushed these existential thoughts aside, focusing on my studies. Although the search for meaning may continue to trouble me, I find solace in knowing that my journey at DLSU is shaping me into a better person, constantly guiding me towards my true purpose.",0,1,0,0,0,0,0,0,0,0,0,0,0
"Today started like any other day, with the usual hustle and bustle of being an undergraduate student at DLSU. However, amidst the chaos, I couldn't help but feel a nagging concern about the meaning of life. As I walked from one class to another, I pondered the purpose of my existence. It seems like such a daunting question to answer, especially in the midst of academic pressure. But perhaps, in the midst of all these daily hassles, I will eventually find the answers I seek.",0,1,0,0,0,0,0,0,0,0,0,0,0
"Today was just like any other day at DLSU, filled with the usual hustle and bustle. As I walked through the campus, my mind couldn't help but wander, and I found myself pondering about the meaning of life. The existential questions plagued my thoughts, leaving me feeling both curious and concerned. Amidst the daily hassles of assignments, classes, and social interactions, this existential dilemma added an extra layer of complexity to my day. However, I knew that in the midst of it all, I had to find a balance between seeking answers and embracing the present moment.",0,1,0,0,0,0,0,0,0,0,0,0,0
"Today was just like any other day as an undergraduate student at DLSU. As I rushed to my morning classes, I couldn't help but be concerned about the meaning of life. Amidst the hustle and bustle, the weight of existential questions lingered in my mind. Yet, as the day progressed and I engaged in lively discussions with classmates and passionate professors, I found solace in the pursuit of knowledge. Although the meaning of life may remain elusive, the valuable experiences and connections made at university continue to shape my journey, reminding me that sometimes the process is more important than the answer.",0,1,0,0,0,0,0,0,0,0,0,0,0
"Today was just like any other day as an undergraduate student at DLSU, but a constant nagging thought kept bothering me throughout the day - the meaning of life. In between attending classes, submitting assignments, and studying for exams, I couldn't help but ponder over this existential question. It seemed like a never-ending puzzle, and the more I thought about it, the more uncertain I became. Amidst the daily hassles, this question continued to linger in the back of my mind, reminding me of the infinite possibilities that life holds.",0,1,0,0,0,0,0,0,0,0,0,0,0
"As an undergraduate student at DLSU, my day is filled with typical daily hassles. Today, amidst tackling assignments and attending classes, I found myself pondering about the meaning of life. It's a recurring concern that often creeps into my mind, leaving me deep in thought. While it may seem like an existential burden, I believe it's an essential part of personal growth and self-discovery. So, I continue to navigate through my day, seeking answers and finding solace in the pursuit of knowledge and understanding.",0,1,0,0,0,0,0,0,0,0,0,0,0
"As an undergraduate student at DLSU, my day is filled with various daily hassles. Today, amidst my classes and assignments, I found myself pondering about the meaning of life. It's a question that often lingers in my mind, causing moments of introspection and contemplation. While juggling academic responsibilities, I couldn't help but wonder about the purpose and significance of my existence. Although it may seem like a mere hassle, this concern drives me to seek a deeper understanding of myself and the world around me.",0,1,0,0,0,0,0,0,0,0,0,0,0
"As an undergraduate student at DLSU, my day is always filled with various daily hassles. Today, I found myself deep in thought, concerned about the meaning of life. It's a question that often lingers in my mind, and at times, it can feel overwhelming. But amidst the chaos of assignments and deadlines, I remind myself to take a step back, breathe, and appreciate the journey. Life's meaning may not be crystal clear, but I believe that it unravels gradually through the experiences and connections we make along the way. So, I embrace the uncertainties, knowing that the search for meaning is just as important as the destination itself.",0,1,0,0,0,0,0,0,0,0,0,0,0
"As an undergraduate student from DLSU, my day begins with the usual hustle and bustle of classes and assignments. However, amidst the chaos, a constant nagging thought lingers in my mind - the meaning of life. It's a concern that often creeps in, making me question my purpose and the path I am on. While I navigate through the daily hassles, this existential pondering serves as a reminder to seek fulfillment and ensure my actions align with my values.",0,1,0,0,0,0,0,0,0,0,0,0,0
"As an undergraduate student at DLSU, my day is constantly filled with a multitude of daily hassles. Today, amidst my hectic schedule, I found myself pondering about the meaning of life. This existential concern weighed heavily on my mind, leaving me with a sense of unease. It's not uncommon for me to question the purpose and significance of my existence, especially during the moments when stress and academic pressures consume me. However, despite this constant internal struggle, I remind myself to find solace in the pursuit of knowledge and personal growth, hoping that ultimately, these endeavors will lead me to a clearer understanding of life's meaning.",0,1,0,0,0,0,0,0,0,0,0,0,0
"As an undergraduate student at DLSU, my day is often filled with a multitude of daily hassles. Today, amidst the hustle and bustle of classes and assignments, I found myself deeply concerned about the meaning of life. Thoughts of existentialism and purpose swirled in my mind, causing a slight distraction throughout the day. However, through the support of friends and the guidance of professors, I was able to find solace in the pursuit of knowledge and personal growth. Though the question of life's purpose still lingers, I am determined to embrace the journey and make the most out of my university experience.",0,1,0,0,0,0,0,0,0,0,0,0,0
"As an undergraduate student at DLSU, my day was filled with the usual hustle and bustle. Amidst attending lectures, submitting assignments, and socializing with friends, a constant concern lingered in my mind: the meaning of life. It weighed on my thoughts, leaving me pondering the purpose behind my actions. However, amidst the chaos, I found solace in engaging conversations with fellow students, discussing our aspirations and dreams. These moments reminded me that life's meaning lies in the pursuit of knowledge, personal growth, and the connections we forge along the way.",0,1,0,0,0,0,0,0,0,0,0,0,0
"As an undergrad at DLSU, my day is often packed with classes, assignments, and the usual hustle and bustle of university life. Today, amidst the chaos, I found myself pondering about the meaning of life. It's a common concern, I suppose, but one that often leaves me feeling overwhelmed. Despite the daily hassles, I realized that finding purpose lies not in the grand achievements, but in the little moments of connection, growth, and gratitude. And so, with this newfound perspective, I embraced the challenges of the day, knowing that each experience contributes to my journey of self-discovery.",0,1,0,0,0,0,0,0,0,0,0,0,0
"As an undergraduate student at DLSU, my day is always filled with countless daily hassles. Today, amidst the chaos of assignments and deadlines, I found myself pondering about the meaning of life. It's a common concern that often haunts me, especially when the pressures of academia overshadow everything else. While grappling with this existential question, I realized that perhaps the pursuit of knowledge and personal growth is what gives life its meaning.",0,1,0,0,0,0,0,0,0,0,0,0,0
