"Today was a typical day at DLSU, with its usual hustle and bustle. As an undergraduate student, one of the daily hassles I often encounter is being conscious of my physical appearance. The pressure to look presentable among my peers is always lingering in the back of my mind. From carefully selecting my outfit to ensuring my hair is on point, it can be exhausting. But amidst all the fuss, I remind myself that true beauty lies in confidence and embracing my individuality. So, I confidently strutted through the campus, knowing that my worth goes beyond physical appearance.",0,0,0,0,0,0,1,0,0,0,0,0,0
"Today was just one of those days where my physical appearance seemed to be working against me. I woke up with a stubborn pimple right in the middle of my forehead, making me feel self-conscious throughout the day. Then, as if that wasn't enough, my hair seemed to have a mind of its own, frizzing up in every direction despite my efforts to tame it. It's frustrating how something as trivial as physical appearance can affect our confidence and overall mood. But hey, at least tomorrow is a new day, and hopefully, a better hair day too.",0,0,0,0,0,0,1,0,0,0,0,0,0
"Today was a typical day at DLSU, filled with the usual daily hassles. As an undergraduate student, one of the constant concerns I face is my physical appearance. Rushing to my morning class, I couldn't help but feel self-conscious about my disheveled hair and tired eyes. Throughout the day, I caught glimpses of myself in the reflection of windows, constantly adjusting my shirt or fixing my messy hair. Although it may seem trivial, the pressure to maintain a presentable appearance amidst the chaos of university life can be quite challenging.",0,0,0,0,0,0,1,0,0,0,0,0,0
"Today was just one of those days where my physical appearance seemed to be my biggest hassle. As I walked into the lecture hall, I couldn't help but feel self-conscious about my disheveled hair and tired eyes. I couldn't shake off the feeling that everyone was judging me, even though I knew deep down that it was all in my head. Despite the hassle, I reminded myself that being present and engaged in my classes was far more important than any superficial concerns.",0,0,0,0,0,0,1,0,0,0,0,0,0
"Today has been quite a hassle. As an undergraduate student at DLSU, the pressure to maintain a presentable physical appearance is ever-present. It's a constant battle to wake up early, fix my hair, put on makeup, and choose an outfit that looks both stylish and appropriate. It's exhausting to constantly worry about how I look, but I guess that's just the reality of being a student in a fashion-conscious university like ours.",0,0,0,0,0,0,1,0,0,0,0,0,0
"Today was just one of those days where I couldn't help but feel conscious about my physical appearance. As I walked into campus, I couldn't shake off the feeling that everyone was judging me based on how I looked. I tried to brush it off and focus on my classes, but every time I caught a glimpse of myself in the mirror, I couldn't help but feel a pang of self-doubt. It's frustrating how something as superficial as physical appearance can affect my mindset and confidence. But I reminded myself that I am more than just my looks and continued on with my day.",0,0,0,0,0,0,1,0,0,0,0,0,0
"Today was one of those days where my physical appearance seemed to be working against me. I woke up with a bad case of bedhead that no amount of brushing could tame. As if that wasn't enough, I spilled coffee on my favorite shirt just minutes before heading out. To top it all off, I couldn't find my left shoe, so I had to wear mismatched sneakers. Walking around campus, I felt like a walking disaster, but hey, at least I learned to embrace the imperfect moments.",0,0,0,0,0,0,1,0,0,0,0,0,0
"Today was one of those days where my physical appearance seemed to be conspiring against me. As I rushed to get ready for class, I noticed a huge pimple had decided to make an unwelcome appearance on my forehead. No amount of concealer could hide it. To top it off, my hair seemed determined to have a mind of its own, refusing to cooperate no matter how much I tried to tame it. It was a constant struggle to feel confident amidst these pesky daily hassles, but I reminded myself that true beauty comes from within.",0,0,0,0,0,0,1,0,0,0,0,0,0
"Today started off with the usual struggle of deciding what to wear. I stood in front of my closet, scanning through the clothes, second-guessing my physical appearance. Will this outfit make me look too casual or too overdressed? Eventually, I settled for something simple, hoping it would make me feel confident throughout the day. It's frustrating how much time and energy we waste worrying about our physical appearance when there are more important things to focus on.",0,0,0,0,0,0,1,0,0,0,0,0,0
"Today started off with the usual hassle of physical appearance. I spent a good amount of time in front of the mirror, trying to make sure my hair looked presentable and my outfit was on point. It's always a struggle to strike that perfect balance between looking stylish and not appearing too overdressed for a typical day on campus. But hey, at least I managed to avoid any major fashion disasters today!",0,0,0,0,0,0,1,0,0,0,0,0,0
"Today was just one of those days where my physical appearance seemed to be the center of attention. I woke up with a bad case of bedhead, my hair sticking out in every direction. As if that wasn't enough, I spilled coffee on myself during breakfast, leaving an embarrassing stain on my shirt. Throughout the day, it felt like everyone was taking notice of my disheveled appearance. It's times like these when I wish I could just blend into the background and not have my physical flaws be so glaringly obvious.",0,0,0,0,0,0,1,0,0,0,0,0,0
"Today was just one of those days where my physical appearance seemed to be working against me. I woke up with a bad case of bed head, my hair sticking up in all directions. As if that wasn't enough, I couldn't find my favorite shirt and had to settle for something I wasn't too fond of. Walking to class, I couldn't help but feel self-conscious about my disheveled appearance. It's frustrating how something as trivial as my looks can affect my mood and confidence.",0,0,0,0,0,0,1,0,0,0,0,0,0
"So, it's just another typical day at DLSU. Rushing to get ready for class, I catch a glimpse of myself in the mirror and can't help but feel a pang of insecurity about my physical appearance. My hair seems to have a mind of its own, and my clothes don't seem to fit quite right. As I navigate through the bustling hallways, I can't shake the feeling that everyone's eyes are on me. But amidst the daily hustle and bustle, I remind myself that true beauty lies within, and that's what truly matters.",0,0,0,0,0,0,1,0,0,0,0,0,0
"Today was a typical day at DLSU, filled with the usual hustle and bustle. As an undergraduate student, one of the daily hassles I encountered was concerning my physical appearance. Rushing to make it to my morning class, I realized I had forgotten to fix my hair. I felt a pang of self-consciousness as I walked through the crowded hallways, hoping no one would notice my disheveled appearance. Despite this minor setback, I reminded myself that appearances aren't everything and focused on the more important aspects of my day.",0,0,0,0,0,0,1,0,0,0,0,0,0
"Today was a typical day at DLSU, but my physical appearance seemed to provoke some unnecessary attention. As I walked to my first class, I noticed people staring at my mismatched socks. It was embarrassing, but I shrugged it off. Later, in the cafeteria, someone made a comment about my unruly hair, making me feel self-conscious. Despite these minor hassles, I reminded myself to embrace my unique style and not let others define my worth.",0,0,0,0,0,0,1,0,0,0,0,0,0
"Today was one of those days where I couldn't help but feel self-conscious about my physical appearance. As I rushed to get ready for class, I couldn't shake off the nagging feeling that my outfit didn't quite fit right. Every mirror I passed seemed to emphasize my flaws. I tried to brush off the negativity and focus on my studies, but it was a constant battle against my own insecurities.",0,0,0,0,0,0,1,0,0,0,0,0,0
"Today was one of those days where I couldn't help but fret over my physical appearance. As I hurriedly got ready for class, I couldn't stand the sight of my unruly hair that refused to cooperate. My clothes felt a tad too tight, making me self-conscious about my figure. Despite these daily hassles, I reminded myself that my worth is not defined by how I look, but by my actions and character. With a boost of confidence, I walked into the day, ready to conquer whatever challenges came my way.",0,0,0,0,0,0,1,0,0,0,0,0,0
"Today was a typical day at DLSU, but my physical appearance decided to cause some trouble. As I rushed to my morning class, I realized my shirt had a stubborn coffee stain right in the center. I tried my best to cover it up with my backpack, but I couldn't help feeling self-conscious. Throughout the day, I caught people glancing at the stain, making me feel even more insecure. Lesson learned: always double-check my outfit before leaving the house.",0,0,0,0,0,0,1,0,0,0,0,0,0
"Today started off with the usual struggle of deciding what to wear. After rummaging through my closet, I settled on an outfit that made me feel confident and comfortable. However, as the day progressed, I couldn't help but feel self-conscious about my physical appearance. Whether it was catching a glimpse of myself in the mirror or comparing myself to others on campus, I constantly battled with insecurities. Despite these daily hassles, I reminded myself that my worth is not solely determined by my physical appearance, and that confidence comes from within.",0,0,0,0,0,0,1,0,0,0,0,0,0
"Today was another typical day at DLSU, filled with the usual hustle and bustle. However, one thing that bothered me was not seeing many familiar faces around campus. Being an undergraduate student, it's always comforting to see friendly faces and engage in a quick chat or exchange of smiles. The absence of these interactions made the day feel a bit lonelier and disconnected. Nonetheless, I remained hopeful that tomorrow would bring a chance to reconnect with my peers and experience the vibrant energy that fills our university.",0,0,0,0,0,0,0,1,0,0,0,0,0
"Today was a lonely day at DLSU. As I walked through the empty hallways, I missed the vibrant energy that students usually bring. The absence of classmates and friends made me realize how much I took their presence for granted. Not seeing people made me appreciate the lively atmosphere that they create, and I longed for the day when we could all gather again, filling these halls with laughter and chatter.",0,0,0,0,0,0,0,1,0,0,0,0,0
"Today was a rather lonely day. Not seeing people on campus made me realize how much I miss the hustle and bustle of university life. The empty hallways echoed with my footsteps, and the silence was deafening. I yearned for the lively conversations with friends, the laughter that filled the air, and the shared excitement of learning. Hopefully, soon enough, the campus will be teeming with life again, and the joy of being surrounded by fellow Lasallians will be restored.",0,0,0,0,0,0,0,1,0,0,0,0,0
"Today was just like any other day in quarantine. I woke up, attended my online classes, and spent the entire day staring at my laptop screen. It's frustrating not seeing people and missing out on the vibrant campus life. No more random conversations in the hallways or impromptu hangouts with friends. It feels lonely, and I can't wait for the day when we can all be together again, sharing laughter and making memories.",0,0,0,0,0,0,0,1,0,0,0,0,0
"Today was another day of online classes and it was quite frustrating not seeing people in person. The lack of face-to-face interaction made it difficult to connect with my classmates and professors. It felt isolating and I missed the lively discussions and friendly banter that used to fill the classrooms. Even though technology allowed us to communicate virtually, it just wasn't the same. I longed for the days when we could gather together, laugh, and learn from each other's presence.",0,0,0,0,0,0,0,1,0,0,0,0,0
"Today was another day of not seeing people. As an undergraduate student at DLSU, I miss the hustle and bustle of the university campus. Instead, my days are filled with online lectures and virtual meetings. It's hard to connect with classmates and professors through a screen, and the lack of face-to-face interactions leaves me feeling isolated. I yearn for the days when we can gather again, share laughs, and feel the energy of the campus. But until then, I'll continue navigating through this new normal, hoping for a brighter and more social future.",0,0,0,0,0,0,0,1,0,0,0,0,0
"Today was another day of online classes at DLSU, and once again, the daily hassle of not seeing people continued. As I sat in front of my laptop, I couldn't help but miss the vibrant atmosphere of the campus. The absence of familiar faces and the lack of impromptu conversations made the day feel somewhat empty. Though virtual interactions were convenient, they couldn't replace the joy of physically being surrounded by classmates and friends. I long for the day when we can all gather again, creating memories and experiencing the bustling energy that only a university campus can provide.",0,0,0,0,0,0,0,1,0,0,0,0,0
"Today was another day of online classes, and it felt strange not seeing people around campus. I miss the vibrant energy and the familiar faces that used to fill the hallways. Instead, I spent the day staring at a screen, interacting with classmates only through video calls. It's a constant reminder that the world has changed, and we have to adapt. But I can't help but long for the simple joy of bumping into friends and engaging in spontaneous conversations.",0,0,0,0,0,0,0,1,0,0,0,0,0
"Today started like any other day during this pandemic, with the familiar feeling of not seeing people. As an undergraduate student at DLSU, I miss the bustling campus life, the friendly faces, and the casual interactions with classmates and professors. It's a constant reminder of the new normal we find ourselves in. However, I try to stay positive, knowing that this too shall pass, and soon enough, I'll be back on campus, surrounded by the vibrant energy that makes DLSU so special.",0,0,0,0,0,0,0,1,0,0,0,0,0
"Today was quite a lonely day. Being an undergraduate student in DLSU, I experienced the hassle of not seeing people around campus. The once bustling hallways were now eerily empty, with only a few students scattered here and there. It felt strange not being able to engage in casual conversations or exchange smiles with familiar faces. The absence of human interaction created a sense of disconnection, reminding me of the importance of social connections in our daily lives.",0,0,0,0,0,0,0,1,0,0,0,0,0
"Today was quite an unusual day. Not seeing people around campus made it feel eerily quiet and empty. The bustling hallways, usually filled with students rushing to their classes, were devoid of life. It felt isolating, as if I was in a ghost town. It made me realize how much I took for granted the simple interactions I had with my peers. The absence of laughter and chatter left a void in my day, reminding me of the importance of human connection and the joy it brings to my college life.",0,0,0,0,0,0,0,1,0,0,0,0,0
"Today was another day of not seeing people. As an undergraduate student from DLSU, I found myself missing the bustling hallways and vibrant conversations with classmates. Online classes and virtual meetings have become the new norm, but it's just not the same. I long for the spontaneous interactions and impromptu hangouts that used to brighten my day. The isolation is taking a toll, but I hold onto hope that one day soon, I'll be able to see familiar faces and feel the warmth of human connection once again.",0,0,0,0,0,0,0,1,0,0,0,0,0
"Today was a rather lonely day. Being an undergraduate student from DLSU, I found it challenging not seeing people around campus. The once bustling hallways were now empty, devoid of laughter and chatter. It felt strange to walk through the silent corridors, missing the liveliness that fellow students brought. It dawned on me that these simple interactions were taken for granted. I longed to see familiar faces, engage in conversations, and feel the warmth of human connection. Not seeing people made me realize the significance of their presence in my daily life.",0,0,0,0,0,0,0,1,0,0,0,0,0
"Today was another day of online classes, which meant another day of not seeing people. It's strange how quickly I've gotten used to this new normal. I miss the hustle and bustle of campus life, the laughter of friends in between classes, and even the crowded hallways. It's easy to feel isolated and disconnected when you're staring at a screen all day. But I try to remind myself that this is just temporary, and one day soon, we'll all be back together, creating memories and filling the campus with life once again.",0,0,0,0,0,0,0,1,0,0,0,0,0
"Today was a rather lonely day at DLSU. Not seeing people around campus made the atmosphere feel different. The usually bustling hallways were eerily quiet, and the once lively canteen was now just a ghost town. It felt strange to walk to class without bumping into familiar faces or exchanging quick greetings. This new normal of social distancing has definitely taken a toll on the vibrant energy that used to fill the university grounds. I miss the liveliness, the laughter, and the connections made with fellow students. Hopefully, we will soon be able to see each other again and bring back the vibrant spirit of our campus.",0,0,0,0,0,0,0,1,0,0,0,0,0
"Today was another day of online classes and not seeing people. It's strange how much I took for granted the simple act of interacting with others. There's a void inside me that longs for the laughter and conversations that used to fill the hallways of our university. Zoom meetings and virtual discussions just aren't the same. I miss the energy of campus life, the camaraderie of my classmates, and the vibrant atmosphere that made me feel alive. But until things get back to normal, I'll keep hoping for the day when I can once again see familiar faces and feel the warmth of human connection.",0,0,0,0,0,0,0,1,0,0,0,0,0
"Today was another day of not seeing people. Being an undergraduate student at DLSU, I am used to the hustle and bustle of campus life. However, due to the ongoing pandemic, my days have become solitary and quiet. Zoom lectures and virtual group discussions have replaced the lively interactions with classmates and professors. Although technology connects us, I long for the days when we can gather on campus again, sharing laughs and engaging in face-to-face conversations. Until then, I continue to navigate the challenges of online learning, eagerly waiting for the day when I can see people again.",0,0,0,0,0,0,0,1,0,0,0,0,0
"Today was just like any other day at DLSU, filled with endless lectures and studying. However, one thing that bothered me was not seeing people around campus. The once bustling hallways and crowded cafeterias now felt empty and lonely. It was strange not bumping into friends or having impromptu conversations. The lack of human interaction made the day feel monotonous and isolated. I longed for the days when the campus was alive with laughter and chatter, reminding me that despite the daily hassles, the presence of people made it all worthwhile.",0,0,0,0,0,0,0,1,0,0,0,0,0
"Today was a rather lonely day at DLSU. I couldn't help but notice the absence of people around campus. The once bustling hallways and crowded classrooms were now eerily quiet. It's strange how the lack of human presence can make a place feel so desolate. I missed the laughter, the conversations, and the familiar faces that used to brighten my day. Not seeing people made me realize how much I took their company for granted.",0,0,0,0,0,0,0,1,0,0,0,0,0
"Today was another day of online classes, and as usual, I missed the feeling of being surrounded by people. It's strange how the absence of physical interaction can make you feel isolated. I long for those moments in between classes when I would chat with friends or bump into acquaintances in the hallways. Zoom meetings just aren't the same. I hope things go back to normal soon, so I can once again enjoy the company of others and feel the vibrant energy of campus life.",0,0,0,0,0,0,0,1,0,0,0,0,0
"Today was another day of solitude. With online classes and limited social activities, it feels like I'm living in a ghost town. Not seeing people has become a daily hassle, as the once bustling campus now feels empty and lifeless. I miss the laughter, the conversations, and the sense of connection that comes from being surrounded by friends. It's a constant reminder of how much I took for granted the simple joy of human interaction. But despite the loneliness, I try to stay positive and look forward to the day when I can once again be surrounded by the vibrant energy of my fellow students.",0,0,0,0,0,0,0,1,0,0,0,0,0
"Today was just like any other day at DLSU, bustling with activity. However, one daily hassle that I encountered was not seeing people. As an undergraduate student, I thrive on the energy and interactions with my peers. But due to the ongoing pandemic, the campus was relatively empty, and most of my classes were conducted online. It was disheartening to not experience the vibrant atmosphere I had grown accustomed to. Despite this hurdle, I made the most of my day, cherishing the few face-to-face interactions I had and finding solace in virtual connections.",0,0,0,0,0,0,0,1,0,0,0,0,0
"As an undergraduate student from DLSU, my day is filled with a mix of excitement and challenges. However, one daily hassle that often bothers me is not seeing people. With most of my classes being conducted online, I miss the vibrant atmosphere of campus life and the interactions with my classmates and friends. It's disheartening to spend my days in front of a screen, longing for the energy and connection that can only be found in face-to-face interactions. Nevertheless, I remain hopeful that someday soon, I will be able to reunite with my peers and experience the joy of shared laughter and camaraderie once again.",0,0,0,0,0,0,0,1,0,0,0,0,0
"Today was another day of online classes, and I couldn't help but feel a sense of loneliness. Not seeing people face-to-face has become a daily hassle. I miss the bustling hallways of DLSU, the laughter shared with friends during breaks, and the simple pleasure of engaging in conversations. Although technology has allowed us to stay connected virtually, it cannot replace the human connection and the warmth of physical presence. I long for the day when we can all gather again, creating memories and sharing experiences together.",0,0,0,0,0,0,0,1,0,0,0,0,0
"Today was another day of not seeing people. As an undergraduate student from DLSU, online classes have become the new norm, and it's starting to feel isolating. I miss the lively conversations with classmates before and after lectures, the shared laughter during group projects, and the simple joy of bumping into friends on campus. It's frustrating to navigate through this virtual world, longing for the genuine human connection that physical presence brings. However, I remain hopeful that one day, I will once again experience the warmth of being surrounded by people who share the same journey as I do.",0,0,0,0,0,0,0,1,0,0,0,0,0
"Today was another day spent in isolation. Not seeing people has become a daily hassle that I never anticipated. The once bustling hallways of DLSU are now empty, and the familiar faces that used to greet me are nowhere to be found. Zoom lectures and online group projects have replaced the lively discussions and camaraderie I used to enjoy. It's lonely, and I miss the energy of the campus. But I hold on to the hope that one day soon, I'll be back in the company of my fellow students, laughing and learning together once again.",0,0,0,0,0,0,0,1,0,0,0,0,0
"Today was a typical day at DLSU, filled with the usual hustle and bustle. However, one thing that bothered me was not seeing many familiar faces. It felt strange walking through the usually crowded hallways and not bumping into friends or classmates. The absence of laughter and chatter made the campus feel empty. It made me realize how much I took for granted the presence of people and the sense of community that comes with it. I long for the day when we can all be together again, filling these halls with joy and camaraderie.",0,0,0,0,0,0,0,1,0,0,0,0,0
"Today was another day of online classes at DLSU, and once again, I found myself missing the simple joy of seeing people face-to-face. The virtual interactions just don't compare to the vibrant atmosphere of campus life. As I stared at the screen, longing for the lively conversations and laughter, I couldn't help but feel a sense of disconnect. Despite the convenience of technology, it's the human connection that truly makes each day special. I can't wait for the day when I can walk through the bustling halls of DLSU and engage with my fellow students once again.",0,0,0,0,0,0,0,1,0,0,0,0,0
"Today was another solitary day at DLSU. Not seeing people has become a daily hassle that I've grown accustomed to. The empty hallways and quiet library make it feel like a ghost town. I miss the vibrant energy of bustling students and the random encounters with friends. Zoom classes just can't compare to the vibrant atmosphere of campus life. But despite the isolation, I remind myself to stay positive and look forward to the day when we can all be together again.",0,0,0,0,0,0,0,1,0,0,0,0,0
